granuleId,packageId,congress,title,parsed_text,text_readability,text_bs4,__source_file,parsed_text_len,text_readability_len,text_bs4_len,search_text,search_text_len
CREC-2015-05-29-pt1-PgE795-2,CREC-2015-05-29,114,RECOGNIZING WKIP NEWS RADIO,"[Congressional Record Volume 161, Number 84 (Friday, May 29, 2015)] [Extensions of Remarks] [Page E795] From the Congressional Record Online through the Government Publishing Office [ www.gpo.gov ] RECOGNIZING WKIP NEWS RADIO ______ HON. CHRISTOPHER P. GIBSON of new york in the house of representatives Friday, May 29, 2015 Mr. GIBSON. Mr. Speaker, I rise today to recognize WKIP, a news radio station serving the residents of New York's Hudson Valley. This year marks the station's 75th anniversary of operations, and I congratulate them on reaching this impressive milestone. On Friday, June 5 WKIP will celebrate its anniversary with a live broadcast from the Henry A. Wallace Center at the Franklin D. Roosevelt Presidential Library and Museum in historic Hyde Park. As area residents gather for this special event, I want to take this opportunity to express my gratitude to the staff, hosts, and management of WKIP for their commitment to our community. We rely on locally-operated media organizations like WKIP to keep us informed of news and weather and to partner with our small businesses to help them grow. This radio station is an important component of the social fabric in our region, broadcasting announcements from government officials, emergency information, and valuable updates on public events, school activities, local sports, and ways that we can be helpful to our neighbors. WKIP programming helps bring people together, and I am proud to recognize this organization's many contributions to community life and the economy in the Hudson Valley over the past 75 years. WKIP listeners are also provided a daily platform for the exchange of ideas, which is crucial to the health of our democracy. I am deeply grateful to WKIP for carrying out this mission and for inviting me to be a part of its programming as I endeavor to represent the residents of the 19th District of New York. Mr. Speaker, I want to send my best wishes to everyone assembled for the WKIP anniversary gala in Hyde Park. ____________________","[Congressional Record Volume 161, Number 84 (Friday, May 29, 2015)] [Extensions of Remarks] [Page E795] From the Congressional Record Online through the Government Publishing Office [ www.gpo.gov ] RECOGNIZING WKIP NEWS RADIO ______ HON. CHRISTOPHER P. GIBSON of new york in the house of representatives Friday, May 29, 2015 Mr. GIBSON. Mr. Speaker, I rise today to recognize WKIP, a news radio station serving the residents of New York's Hudson Valley. This year marks the station's 75th anniversary of operations, and I congratulate them on reaching this impressive milestone. On Friday, June 5 WKIP will celebrate its anniversary with a live broadcast from the Henry A. Wallace Center at the Franklin D. Roosevelt Presidential Library and Museum in historic Hyde Park. As area residents gather for this special event, I want to take this opportunity to express my gratitude to the staff, hosts, and management of WKIP for their commitment to our community. We rely on locally-operated media organizations like WKIP to keep us informed of news and weather and to partner with our small businesses to help them grow. This radio station is an important component of the social fabric in our region, broadcasting announcements from government officials, emergency information, and valuable updates on public events, school activities, local sports, and ways that we can be helpful to our neighbors. WKIP programming helps bring people together, and I am proud to recognize this organization's many contributions to community life and the economy in the Hudson Valley over the past 75 years. WKIP listeners are also provided a daily platform for the exchange of ideas, which is crucial to the health of our democracy. I am deeply grateful to WKIP for carrying out this mission and for inviting me to be a part of its programming as I endeavor to represent the residents of the 19th District of New York. Mr. Speaker, I want to send my best wishes to everyone assembled for the WKIP anniversary gala in Hyde Park. ____________________","Congressional Record, Volume 161 Issue 84 (Friday, May 29, 2015) [Congressional Record Volume 161, Number 84 (Friday, May 29, 2015)] [Extensions of Remarks] [Page E795] From the Congressional Record Online through the Government Publishing Office [ www.gpo.gov ] RECOGNIZING WKIP NEWS RADIO ______ HON. CHRISTOPHER P. GIBSON of new york in the house of representatives Friday, May 29, 2015 Mr. GIBSON. Mr. Speaker, I rise today to recognize WKIP, a news radio station serving the residents of New York's Hudson Valley. This year marks the station's 75th anniversary of operations, and I congratulate them on reaching this impressive milestone. On Friday, June 5 WKIP will celebrate its anniversary with a live broadcast from the Henry A. Wallace Center at the Franklin D. Roosevelt Presidential Library and Museum in historic Hyde Park. As area residents gather for this special event, I want to take this opportunity to express my gratitude to the staff, hosts, and management of WKIP for their commitment to our community. We rely on locally-operated media organizations like WKIP to keep us informed of news and weather and to partner with our small businesses to help them grow. This radio station is an important component of the social fabric in our region, broadcasting announcements from government officials, emergency information, and valuable updates on public events, school activities, local sports, and ways that we can be helpful to our neighbors. WKIP programming helps bring people together, and I am proud to recognize this organization's many contributions to community life and the economy in the Hudson Valley over the past 75 years. WKIP listeners are also provided a daily platform for the exchange of ideas, which is crucial to the health of our democracy. I am deeply grateful to WKIP for carrying out this mission and for inviting me to be a part of its programming as I endeavor to represent the residents of the 19th District of New York. Mr. Speaker, I want to send my best wishes to everyone assembled for the WKIP anniversary gala in Hyde Park. ____________________",package_114_272.csv,2031,2031,2096,"[congressional record volume 161, number 84 (friday, may 29, 2015)] [extensions of remarks] [page e795] from the congressional record online through the government publishing office [ www.gpo.gov ] recognizing wkip news radio ______ hon. christopher p. gibson of new york in the house of representatives friday, may 29, 2015 mr. gibson. mr. speaker, i rise today to recognize wkip, a news radio station serving the residents of new york's hudson valley. this year marks the station's 75th anniversary of operations, and i congratulate them on reaching this impressive milestone. on friday, june 5 wkip will celebrate its anniversary with a live broadcast from the henry a. wallace center at the franklin d. roosevelt presidential library and museum in historic hyde park. as area residents gather for this special event, i want to take this opportunity to express my gratitude to the staff, hosts, and management of wkip for their commitment to our community. we rely on locally-operated media organizations like wkip to keep us informed of news and weather and to partner with our small businesses to help them grow. this radio station is an important component of the social fabric in our region, broadcasting announcements from government officials, emergency information, and valuable updates on public events, school activities, local sports, and ways that we can be helpful to our neighbors. wkip programming helps bring people together, and i am proud to recognize this organization's many contributions to community life and the economy in the hudson valley over the past 75 years. wkip listeners are also provided a daily platform for the exchange of ideas, which is crucial to the health of our democracy. i am deeply grateful to wkip for carrying out this mission and for inviting me to be a part of its programming as i endeavor to represent the residents of the 19th district of new york. mr. speaker, i want to send my best wishes to everyone assembled for the wkip anniversary gala in hyde park. ____________________",2031
CREC-2015-05-29-pt1-PgE795-3,CREC-2015-05-29,114,DEDICATION OF THE LGBT MONUMENT IN ABRAHAM LINCOLN NATIONAL CEMETERY,"[Congressional Record Volume 161, Number 84 (Friday, May 29, 2015)] [Extensions of Remarks] [Page E795] From the Congressional Record Online through the Government Publishing Office [ www.gpo.gov ] DEDICATION OF THE LGBT MONUMENT IN ABRAHAM LINCOLN NATIONAL CEMETERY ______ HON. MIKE QUIGLEY of illinois in the house of representatives Friday, May 29, 2015 Mr. QUIGLEY. Mr. Speaker, I rise today to recognize the Chicago Chapter of American Veterans for Equal Rights, which dedicated a monument for LGBT Veterans in Abraham Lincoln National Cemetery in Elwood, IL on May 25, 2015. This is an historic day, as this is the first federally-approved monument honoring LGBT veterans to be dedicated in a National Cemetery in the United States. It is fitting that this monument is located in the Abraham Lincoln National Cemetery. President Lincoln was not only our 16th President and from the great state of Illinois, but he was also the founder of the National Cemetery system. His Gettysburg Address of 1863 became a model of the principles of nationalism, republicanism, equal rights, liberty, and democracy. I am grateful for the efforts of the American Veterans for Equal Rights (AVER) and their continued commitment and dedication to equal rights and equitable treatment for all present and former members of the United States Armed Forces. Thanks to Stanley J. Jenczyk and his colleagues with the Chicago Chapter of AVER, the LGBT veteran community will have a lasting tribute honoring their achievements and sacrifices. This monument recognizes the innumerable accomplishments of our military and forever commemorates their endeavors as servants of our great nation. Mr. Speaker, I ask my colleagues to join me in celebrating this significant dedication with the Chicago Chapter of American Veterans for Equal Rights. I am honored to have such an exceptional organization in my district.","[Congressional Record Volume 161, Number 84 (Friday, May 29, 2015)] [Extensions of Remarks] [Page E795] From the Congressional Record Online through the Government Publishing Office [ www.gpo.gov ] DEDICATION OF THE LGBT MONUMENT IN ABRAHAM LINCOLN NATIONAL CEMETERY ______ HON. MIKE QUIGLEY of illinois in the house of representatives Friday, May 29, 2015 Mr. QUIGLEY. Mr. Speaker, I rise today to recognize the Chicago Chapter of American Veterans for Equal Rights, which dedicated a monument for LGBT Veterans in Abraham Lincoln National Cemetery in Elwood, IL on May 25, 2015. This is an historic day, as this is the first federally-approved monument honoring LGBT veterans to be dedicated in a National Cemetery in the United States. It is fitting that this monument is located in the Abraham Lincoln National Cemetery. President Lincoln was not only our 16th President and from the great state of Illinois, but he was also the founder of the National Cemetery system. His Gettysburg Address of 1863 became a model of the principles of nationalism, republicanism, equal rights, liberty, and democracy. I am grateful for the efforts of the American Veterans for Equal Rights (AVER) and their continued commitment and dedication to equal rights and equitable treatment for all present and former members of the United States Armed Forces. Thanks to Stanley J. Jenczyk and his colleagues with the Chicago Chapter of AVER, the LGBT veteran community will have a lasting tribute honoring their achievements and sacrifices. This monument recognizes the innumerable accomplishments of our military and forever commemorates their endeavors as servants of our great nation. Mr. Speaker, I ask my colleagues to join me in celebrating this significant dedication with the Chicago Chapter of American Veterans for Equal Rights. I am honored to have such an exceptional organization in my district.","Congressional Record, Volume 161 Issue 84 (Friday, May 29, 2015) [Congressional Record Volume 161, Number 84 (Friday, May 29, 2015)] [Extensions of Remarks] [Page E795] From the Congressional Record Online through the Government Publishing Office [ www.gpo.gov ] DEDICATION OF THE LGBT MONUMENT IN ABRAHAM LINCOLN NATIONAL CEMETERY ______ HON. MIKE QUIGLEY of illinois in the house of representatives Friday, May 29, 2015 Mr. QUIGLEY. Mr. Speaker, I rise today to recognize the Chicago Chapter of American Veterans for Equal Rights, which dedicated a monument for LGBT Veterans in Abraham Lincoln National Cemetery in Elwood, IL on May 25, 2015. This is an historic day, as this is the first federally-approved monument honoring LGBT veterans to be dedicated in a National Cemetery in the United States. It is fitting that this monument is located in the Abraham Lincoln National Cemetery. President Lincoln was not only our 16th President and from the great state of Illinois, but he was also the founder of the National Cemetery system. His Gettysburg Address of 1863 became a model of the principles of nationalism, republicanism, equal rights, liberty, and democracy. I am grateful for the efforts of the American Veterans for Equal Rights (AVER) and their continued commitment and dedication to equal rights and equitable treatment for all present and former members of the United States Armed Forces. Thanks to Stanley J. Jenczyk and his colleagues with the Chicago Chapter of AVER, the LGBT veteran community will have a lasting tribute honoring their achievements and sacrifices. This monument recognizes the innumerable accomplishments of our military and forever commemorates their endeavors as servants of our great nation. Mr. Speaker, I ask my colleagues to join me in celebrating this significant dedication with the Chicago Chapter of American Veterans for Equal Rights. I am honored to have such an exceptional organization in my district.",package_114_272.csv,1890,1890,1955,"[congressional record volume 161, number 84 (friday, may 29, 2015)] [extensions of remarks] [page e795] from the congressional record online through the government publishing office [ www.gpo.gov ] dedication of the lgbt monument in abraham lincoln national cemetery ______ hon. mike quigley of illinois in the house of representatives friday, may 29, 2015 mr. quigley. mr. speaker, i rise today to recognize the chicago chapter of american veterans for equal rights, which dedicated a monument for lgbt veterans in abraham lincoln national cemetery in elwood, il on may 25, 2015. this is an historic day, as this is the first federally-approved monument honoring lgbt veterans to be dedicated in a national cemetery in the united states. it is fitting that this monument is located in the abraham lincoln national cemetery. president lincoln was not only our 16th president and from the great state of illinois, but he was also the founder of the national cemetery system. his gettysburg address of 1863 became a model of the principles of nationalism, republicanism, equal rights, liberty, and democracy. i am grateful for the efforts of the american veterans for equal rights (aver) and their continued commitment and dedication to equal rights and equitable treatment for all present and former members of the united states armed forces. thanks to stanley j. jenczyk and his colleagues with the chicago chapter of aver, the lgbt veteran community will have a lasting tribute honoring their achievements and sacrifices. this monument recognizes the innumerable accomplishments of our military and forever commemorates their endeavors as servants of our great nation. mr. speaker, i ask my colleagues to join me in celebrating this significant dedication with the chicago chapter of american veterans for equal rights. i am honored to have such an exceptional organization in my district.",1890
CREC-2015-05-29-pt1-PgD609-3,CREC-2015-05-29,114,Daily Digest/House of Representatives,"[Congressional Record Volume 161, Number 84 (Friday, May 29, 2015)] [Daily Digest] [Page D609] From the Congressional Record Online through the Government Publishing Office [ www.gpo.gov ] House of Representatives Chamber Action Public Bills and Resolutions Introduced: 5 public bills, H.R. 2579- 2583, were introduced. Page H3581 Additional Cosponsors: Page H3582 Reports Filed: Reports were filed on May 27, 2015 as follows: H.R. 2577, making appropriations for the Departments of Transportation, and Housing and Urban Development, and related agencies for the fiscal year ending September 30, 2016, and for other purposes (H. Rept. 114-129); and H.R. 2578, making appropriations for the Departments of Commerce and Justice, Science, and Related Agencies for the fiscal year ending September 30, 2016, and for other purposes (H. Rept. 114-130). Reports were filed today as follows: H.R. 2393, to amend the Agricultural Marketing Act of 1946 to repeal country of origin labeling requirements with respect to beef, pork, and chicken, and for other purposes, with an amendment (H. Rept. 114-131); H.R. 2051, to amend the Agricultural Marketing Act of 1946 to extend the livestock mandatory price reporting requirements, and for other purposes, with an amendment (H. Rept. 114-132); H.R. 2088, to amend the United States Grain Standards Act to improve inspection services performed at export elevators at export port locations, to reauthorize certain authorities of the Secretary of Agriculture under such Act, and for other purposes (H. Rept. 114-133); and H.R. 2289, to reauthorize the Commodity Futures Trading Commission, to better protect futures customers, to provide end-users with market certainty, to make basic reforms to ensure transparency and accountability at the Commission, to help farmers, ranchers, and end- users manage risks, to help keep consumer costs low, and for other purposes, with an amendment (H. Rept. 114-134). Page H3581 Speaker: Read a letter from the Speaker wherein he appointed Representative Messer to act as Speaker pro tempore for today. Page H3579 Quorum Calls--Votes: There were no yea-and-nay votes, and there were no recorded votes. There were no quorum calls. Adjournment: The House met at 10 a.m. and adjourned at 10:03 a.m.","[Congressional Record Volume 161, Number 84 (Friday, May 29, 2015)] [Daily Digest] [Page D609] From the Congressional Record Online through the Government Publishing Office [ www.gpo.gov ] House of Representatives Chamber Action Public Bills and Resolutions Introduced: 5 public bills, H.R. 2579- 2583, were introduced. Page H3581 Additional Cosponsors: Page H3582 Reports Filed: Reports were filed on May 27, 2015 as follows: H.R. 2577, making appropriations for the Departments of Transportation, and Housing and Urban Development, and related agencies for the fiscal year ending September 30, 2016, and for other purposes (H. Rept. 114-129); and H.R. 2578, making appropriations for the Departments of Commerce and Justice, Science, and Related Agencies for the fiscal year ending September 30, 2016, and for other purposes (H. Rept. 114-130). Reports were filed today as follows: H.R. 2393, to amend the Agricultural Marketing Act of 1946 to repeal country of origin labeling requirements with respect to beef, pork, and chicken, and for other purposes, with an amendment (H. Rept. 114-131); H.R. 2051, to amend the Agricultural Marketing Act of 1946 to extend the livestock mandatory price reporting requirements, and for other purposes, with an amendment (H. Rept. 114-132); H.R. 2088, to amend the United States Grain Standards Act to improve inspection services performed at export elevators at export port locations, to reauthorize certain authorities of the Secretary of Agriculture under such Act, and for other purposes (H. Rept. 114-133); and H.R. 2289, to reauthorize the Commodity Futures Trading Commission, to better protect futures customers, to provide end-users with market certainty, to make basic reforms to ensure transparency and accountability at the Commission, to help farmers, ranchers, and end- users manage risks, to help keep consumer costs low, and for other purposes, with an amendment (H. Rept. 114-134). Page H3581 Speaker: Read a letter from the Speaker wherein he appointed Representative Messer to act as Speaker pro tempore for today. Page H3579 Quorum Calls--Votes: There were no yea-and-nay votes, and there were no recorded votes. There were no quorum calls. Adjournment: The House met at 10 a.m. and adjourned at 10:03 a.m.","Congressional Record, Volume 161 Issue 84 (Friday, May 29, 2015) [Congressional Record Volume 161, Number 84 (Friday, May 29, 2015)] [Daily Digest] [Page D609] From the Congressional Record Online through the Government Publishing Office [ www.gpo.gov ] House of Representatives Chamber Action Public Bills and Resolutions Introduced: 5 public bills, H.R. 2579- 2583, were introduced. Page H3581 Additional Cosponsors: Page H3582 Reports Filed: Reports were filed on May 27, 2015 as follows: H.R. 2577, making appropriations for the Departments of Transportation, and Housing and Urban Development, and related agencies for the fiscal year ending September 30, 2016, and for other purposes (H. Rept. 114-129); and H.R. 2578, making appropriations for the Departments of Commerce and Justice, Science, and Related Agencies for the fiscal year ending September 30, 2016, and for other purposes (H. Rept. 114-130). Reports were filed today as follows: H.R. 2393, to amend the Agricultural Marketing Act of 1946 to repeal country of origin labeling requirements with respect to beef, pork, and chicken, and for other purposes, with an amendment (H. Rept. 114-131); H.R. 2051, to amend the Agricultural Marketing Act of 1946 to extend the livestock mandatory price reporting requirements, and for other purposes, with an amendment (H. Rept. 114-132); H.R. 2088, to amend the United States Grain Standards Act to improve inspection services performed at export elevators at export port locations, to reauthorize certain authorities of the Secretary of Agriculture under such Act, and for other purposes (H. Rept. 114-133); and H.R. 2289, to reauthorize the Commodity Futures Trading Commission, to better protect futures customers, to provide end-users with market certainty, to make basic reforms to ensure transparency and accountability at the Commission, to help farmers, ranchers, and end- users manage risks, to help keep consumer costs low, and for other purposes, with an amendment (H. Rept. 114-134). Page H3581 Speaker: Read a letter from the Speaker wherein he appointed Representative Messer to act as Speaker pro tempore for today. Page H3579 Quorum Calls--Votes: There were no yea-and-nay votes, and there were no recorded votes. There were no quorum calls. Adjournment: The House met at 10 a.m. and adjourned at 10:03 a.m.",package_114_272.csv,2266,2266,2331,"[congressional record volume 161, number 84 (friday, may 29, 2015)] [daily digest] [page d609] from the congressional record online through the government publishing office [ www.gpo.gov ] house of representatives chamber action public bills and resolutions introduced: 5 public bills, h.r. 2579- 2583, were introduced. page h3581 additional cosponsors: page h3582 reports filed: reports were filed on may 27, 2015 as follows: h.r. 2577, making appropriations for the departments of transportation, and housing and urban development, and related agencies for the fiscal year ending september 30, 2016, and for other purposes (h. rept. 114-129); and h.r. 2578, making appropriations for the departments of commerce and justice, science, and related agencies for the fiscal year ending september 30, 2016, and for other purposes (h. rept. 114-130). reports were filed today as follows: h.r. 2393, to amend the agricultural marketing act of 1946 to repeal country of origin labeling requirements with respect to beef, pork, and chicken, and for other purposes, with an amendment (h. rept. 114-131); h.r. 2051, to amend the agricultural marketing act of 1946 to extend the livestock mandatory price reporting requirements, and for other purposes, with an amendment (h. rept. 114-132); h.r. 2088, to amend the united states grain standards act to improve inspection services performed at export elevators at export port locations, to reauthorize certain authorities of the secretary of agriculture under such act, and for other purposes (h. rept. 114-133); and h.r. 2289, to reauthorize the commodity futures trading commission, to better protect futures customers, to provide end-users with market certainty, to make basic reforms to ensure transparency and accountability at the commission, to help farmers, ranchers, and end- users manage risks, to help keep consumer costs low, and for other purposes, with an amendment (h. rept. 114-134). page h3581 speaker: read a letter from the speaker wherein he appointed representative messer to act as speaker pro tempore for today. page h3579 quorum calls--votes: there were no yea-and-nay votes, and there were no recorded votes. there were no quorum calls. adjournment: the house met at 10 a.m. and adjourned at 10:03 a.m.",2266
