granuleId,packageId,congress,title,parsed_text,text_readability,text_bs4,__source_file,parsed_text_len,text_readability_len,text_bs4_len,search_text,search_text_len
CREC-2015-03-06-pt1-PgH1621-5,CREC-2015-03-06,114,PLEDGE OF ALLEGIANCE,"[Congressional Record Volume 161, Number 38 (Friday, March 6, 2015)] [House] [Page H1621] From the Congressional Record Online through the Government Publishing Office [ www.gpo.gov ] PLEDGE OF ALLEGIANCE The SPEAKER pro tempore. The Chair will lead the House in the Pledge of Allegiance. The SPEAKER pro tempore led the Pledge of Allegiance as follows: I pledge allegiance to the Flag of the United States of America, and to the Republic for which it stands, one nation under God, indivisible, with liberty and justice for all. ____________________","[Congressional Record Volume 161, Number 38 (Friday, March 6, 2015)] [House] [Page H1621] From the Congressional Record Online through the Government Publishing Office [ www.gpo.gov ] PLEDGE OF ALLEGIANCE The SPEAKER pro tempore. The Chair will lead the House in the Pledge of Allegiance. The SPEAKER pro tempore led the Pledge of Allegiance as follows: I pledge allegiance to the Flag of the United States of America, and to the Republic for which it stands, one nation under God, indivisible, with liberty and justice for all. ____________________","Congressional Record, Volume 161 Issue 38 (Friday, March 6, 2015) [Congressional Record Volume 161, Number 38 (Friday, March 6, 2015)] [House] [Page H1621] From the Congressional Record Online through the Government Publishing Office [ www.gpo.gov ] PLEDGE OF ALLEGIANCE The SPEAKER pro tempore. The Chair will lead the House in the Pledge of Allegiance. The SPEAKER pro tempore led the Pledge of Allegiance as follows: I pledge allegiance to the Flag of the United States of America, and to the Republic for which it stands, one nation under God, indivisible, with liberty and justice for all. ____________________",package_114_279.csv,549,549,615,"[congressional record volume 161, number 38 (friday, march 6, 2015)] [house] [page h1621] from the congressional record online through the government publishing office [ www.gpo.gov ] pledge of allegiance the speaker pro tempore. the chair will lead the house in the pledge of allegiance. the speaker pro tempore led the pledge of allegiance as follows: i pledge allegiance to the flag of the united states of america, and to the republic for which it stands, one nation under god, indivisible, with liberty and justice for all. ____________________",549
CREC-2015-03-06-pt1-PgH1621-3,CREC-2015-03-06,114,PRAYER,"[Congressional Record Volume 161, Number 38 (Friday, March 6, 2015)] [House] [Page H1621] From the Congressional Record Online through the Government Publishing Office [ www.gpo.gov ] PRAYER The Chaplain, the Reverend Patrick J. Conroy, offered the following prayer: Eternal God, we give You thanks for giving us another day. The House has come to the close of an eventful week, and we approach a weekend during which many Members of this assembly will gather to remember an historic event in Selma, Alabama. Fifty years ago, brave men and women, Americans of all races, colors, and faiths, walked together to help guarantee freedoms that were still denied men and women in Alabama. Bless the Members of this assembly, and us all, that we would be worthy of the call we have been given as Americans, to nurture and guarantee democratic freedoms to all who dwell in our great Nation. Help us all to be truly thankful and appropriately generous in our response. May all that is done this day be for Your greater honor and glory. Amen. ____________________","[Congressional Record Volume 161, Number 38 (Friday, March 6, 2015)] [House] [Page H1621] From the Congressional Record Online through the Government Publishing Office [ www.gpo.gov ] PRAYER The Chaplain, the Reverend Patrick J. Conroy, offered the following prayer: Eternal God, we give You thanks for giving us another day. The House has come to the close of an eventful week, and we approach a weekend during which many Members of this assembly will gather to remember an historic event in Selma, Alabama. Fifty years ago, brave men and women, Americans of all races, colors, and faiths, walked together to help guarantee freedoms that were still denied men and women in Alabama. Bless the Members of this assembly, and us all, that we would be worthy of the call we have been given as Americans, to nurture and guarantee democratic freedoms to all who dwell in our great Nation. Help us all to be truly thankful and appropriately generous in our response. May all that is done this day be for Your greater honor and glory. Amen. ____________________","Congressional Record, Volume 161 Issue 38 (Friday, March 6, 2015) [Congressional Record Volume 161, Number 38 (Friday, March 6, 2015)] [House] [Page H1621] From the Congressional Record Online through the Government Publishing Office [ www.gpo.gov ] PRAYER The Chaplain, the Reverend Patrick J. Conroy, offered the following prayer: Eternal God, we give You thanks for giving us another day. The House has come to the close of an eventful week, and we approach a weekend during which many Members of this assembly will gather to remember an historic event in Selma, Alabama. Fifty years ago, brave men and women, Americans of all races, colors, and faiths, walked together to help guarantee freedoms that were still denied men and women in Alabama. Bless the Members of this assembly, and us all, that we would be worthy of the call we have been given as Americans, to nurture and guarantee democratic freedoms to all who dwell in our great Nation. Help us all to be truly thankful and appropriately generous in our response. May all that is done this day be for Your greater honor and glory. Amen. ____________________",package_114_279.csv,1053,1053,1119,"[congressional record volume 161, number 38 (friday, march 6, 2015)] [house] [page h1621] from the congressional record online through the government publishing office [ www.gpo.gov ] prayer the chaplain, the reverend patrick j. conroy, offered the following prayer: eternal god, we give you thanks for giving us another day. the house has come to the close of an eventful week, and we approach a weekend during which many members of this assembly will gather to remember an historic event in selma, alabama. fifty years ago, brave men and women, americans of all races, colors, and faiths, walked together to help guarantee freedoms that were still denied men and women in alabama. bless the members of this assembly, and us all, that we would be worthy of the call we have been given as americans, to nurture and guarantee democratic freedoms to all who dwell in our great nation. help us all to be truly thankful and appropriately generous in our response. may all that is done this day be for your greater honor and glory. amen. ____________________",1053
CREC-2015-03-06-pt1-PgH1621-7,CREC-2015-03-06,114,APPOINTMENT OF MEMBERS TO BOARD OF VISITORS TO THE UNITED STATES NAVAL ACADEMY,"[Congressional Record Volume 161, Number 38 (Friday, March 6, 2015)] [House] [Page H1621] From the Congressional Record Online through the Government Publishing Office [ www.gpo.gov ] APPOINTMENT OF MEMBERS TO BOARD OF VISITORS TO THE UNITED STATES NAVAL ACADEMY The SPEAKER pro tempore. The Chair announces the Speaker's appointment, pursuant to 10 U.S.C. 6968(a), and the order of the House of January 6, 2015, of the following Members on the part of the House to the Board of Visitors to the United States Naval Academy: Mr. Cummings, Maryland Mr. Ruppersberger, Maryland ____________________","[Congressional Record Volume 161, Number 38 (Friday, March 6, 2015)] [House] [Page H1621] From the Congressional Record Online through the Government Publishing Office [ www.gpo.gov ] APPOINTMENT OF MEMBERS TO BOARD OF VISITORS TO THE UNITED STATES NAVAL ACADEMY The SPEAKER pro tempore. The Chair announces the Speaker's appointment, pursuant to 10 U.S.C. 6968(a), and the order of the House of January 6, 2015, of the following Members on the part of the House to the Board of Visitors to the United States Naval Academy: Mr. Cummings, Maryland Mr. Ruppersberger, Maryland ____________________","Congressional Record, Volume 161 Issue 38 (Friday, March 6, 2015) [Congressional Record Volume 161, Number 38 (Friday, March 6, 2015)] [House] [Page H1621] From the Congressional Record Online through the Government Publishing Office [ www.gpo.gov ] APPOINTMENT OF MEMBERS TO BOARD OF VISITORS TO THE UNITED STATES NAVAL ACADEMY The SPEAKER pro tempore. The Chair announces the Speaker's appointment, pursuant to 10 U.S.C. 6968(a), and the order of the House of January 6, 2015, of the following Members on the part of the House to the Board of Visitors to the United States Naval Academy: Mr. Cummings, Maryland Mr. Ruppersberger, Maryland ____________________",package_114_279.csv,595,595,661,"[congressional record volume 161, number 38 (friday, march 6, 2015)] [house] [page h1621] from the congressional record online through the government publishing office [ www.gpo.gov ] appointment of members to board of visitors to the united states naval academy the speaker pro tempore. the chair announces the speaker's appointment, pursuant to 10 u.s.c. 6968(a), and the order of the house of january 6, 2015, of the following members on the part of the house to the board of visitors to the united states naval academy: mr. cummings, maryland mr. ruppersberger, maryland ____________________",595
CREC-2015-03-06-pt1-PgH1621-4,CREC-2015-03-06,114,THE JOURNAL,"[Congressional Record Volume 161, Number 38 (Friday, March 6, 2015)] [House] [Page H1621] From the Congressional Record Online through the Government Publishing Office [ www.gpo.gov ] THE JOURNAL The SPEAKER pro tempore. Pursuant to section 2(a) of House Resolution 134, the Journal of the last day's proceedings is approved. ____________________","[Congressional Record Volume 161, Number 38 (Friday, March 6, 2015)] [House] [Page H1621] From the Congressional Record Online through the Government Publishing Office [ www.gpo.gov ] THE JOURNAL The SPEAKER pro tempore. Pursuant to section 2(a) of House Resolution 134, the Journal of the last day's proceedings is approved. ____________________","Congressional Record, Volume 161 Issue 38 (Friday, March 6, 2015) [Congressional Record Volume 161, Number 38 (Friday, March 6, 2015)] [House] [Page H1621] From the Congressional Record Online through the Government Publishing Office [ www.gpo.gov ] THE JOURNAL The SPEAKER pro tempore. Pursuant to section 2(a) of House Resolution 134, the Journal of the last day's proceedings is approved. ____________________",package_114_279.csv,346,346,412,"[congressional record volume 161, number 38 (friday, march 6, 2015)] [house] [page h1621] from the congressional record online through the government publishing office [ www.gpo.gov ] the journal the speaker pro tempore. pursuant to section 2(a) of house resolution 134, the journal of the last day's proceedings is approved. ____________________",346
CREC-2015-03-06-pt1-PgH1621-2,CREC-2015-03-06,114,DESIGNATION OF THE SPEAKER PRO TEMPORE,"[Congressional Record Volume 161, Number 38 (Friday, March 6, 2015)] [House] [Page H1621] From the Congressional Record Online through the Government Publishing Office [ www.gpo.gov ] DESIGNATION OF THE SPEAKER PRO TEMPORE The SPEAKER pro tempore laid before the House the following communication from the Speaker: Washington, DC, March 6, 2015. I hereby appoint the Honorable Jeff Denham to act as Speaker pro tempore on this day. John A. Boehner, Speaker of the House of Representatives. ____________________","[Congressional Record Volume 161, Number 38 (Friday, March 6, 2015)] [House] [Page H1621] From the Congressional Record Online through the Government Publishing Office [ www.gpo.gov ] DESIGNATION OF THE SPEAKER PRO TEMPORE The SPEAKER pro tempore laid before the House the following communication from the Speaker: Washington, DC, March 6, 2015. I hereby appoint the Honorable Jeff Denham to act as Speaker pro tempore on this day. John A. Boehner, Speaker of the House of Representatives. ____________________","Congressional Record, Volume 161 Issue 38 (Friday, March 6, 2015) [Congressional Record Volume 161, Number 38 (Friday, March 6, 2015)] [House] [Page H1621] From the Congressional Record Online through the Government Publishing Office [ www.gpo.gov ] DESIGNATION OF THE SPEAKER PRO TEMPORE The SPEAKER pro tempore laid before the House the following communication from the Speaker: Washington, DC, March 6, 2015. I hereby appoint the Honorable Jeff Denham to act as Speaker pro tempore on this day. John A. Boehner, Speaker of the House of Representatives. ____________________",package_114_279.csv,510,510,576,"[congressional record volume 161, number 38 (friday, march 6, 2015)] [house] [page h1621] from the congressional record online through the government publishing office [ www.gpo.gov ] designation of the speaker pro tempore the speaker pro tempore laid before the house the following communication from the speaker: washington, dc, march 6, 2015. i hereby appoint the honorable jeff denham to act as speaker pro tempore on this day. john a. boehner, speaker of the house of representatives. ____________________",510
CREC-2015-03-06-pt1-PgH-FrontMatter-3,CREC-2015-03-06,114,CONGRESSIONAL RECORD,"[Congressional Record Volume 161, Number 38 (Friday, March 6, 2015)] [House] [Page H1621] From the Congressional Record Online through the Government Publishing Office [ www.gpo.gov ] CONGRESSIONAL RECORD United States of America American eagle (seal) PROCEEDINGS AND DEBATES OF THE 114th CONGRESS, FIRST SESSION ------------------------------------------------------------------------- This symbol represents the time of day during the House proceedings, e.g.,1407 is 2:07 p.m. Matter set in this typeface Indicates words inserted or appended, rather than spoken, by a Member of the House on the floor. -------------------------------------------------------------------------- (seal) recycle Printed on recycled paper. Vol. 161 WASHINGTON, FRIDAY, MARCH 6, 2015 No. 38","[Congressional Record Volume 161, Number 38 (Friday, March 6, 2015)] [House] [Page H1621] From the Congressional Record Online through the Government Publishing Office [ www.gpo.gov ] CONGRESSIONAL RECORD United States of America American eagle (seal) PROCEEDINGS AND DEBATES OF THE 114th CONGRESS, FIRST SESSION ------------------------------------------------------------------------- This symbol represents the time of day during the House proceedings, e.g.,1407 is 2:07 p.m. Matter set in this typeface Indicates words inserted or appended, rather than spoken, by a Member of the House on the floor. -------------------------------------------------------------------------- (seal) recycle Printed on recycled paper. Vol. 161 WASHINGTON, FRIDAY, MARCH 6, 2015 No. 38","Congressional Record, Volume 161 Issue 38 (Friday, March 6, 2015) [Congressional Record Volume 161, Number 38 (Friday, March 6, 2015)] [House] [Page H1621] From the Congressional Record Online through the Government Publishing Office [ www.gpo.gov ] CONGRESSIONAL RECORD United States of America American eagle (seal) PROCEEDINGS AND DEBATES OF THE 114th CONGRESS, FIRST SESSION ------------------------------------------------------------------------- This symbol represents the time of day during the House proceedings, e.g.,1407 is 2:07 p.m. Matter set in this typeface Indicates words inserted or appended, rather than spoken, by a Member of the House on the floor. -------------------------------------------------------------------------- (seal) recycle Printed on recycled paper. Vol. 161 WASHINGTON, FRIDAY, MARCH 6, 2015 No. 38",package_114_279.csv,770,770,836,"[congressional record volume 161, number 38 (friday, march 6, 2015)] [house] [page h1621] from the congressional record online through the government publishing office [ www.gpo.gov ] congressional record united states of america american eagle (seal) proceedings and debates of the 114th congress, first session ------------------------------------------------------------------------- this symbol represents the time of day during the house proceedings, e.g.,1407 is 2:07 p.m. matter set in this typeface indicates words inserted or appended, rather than spoken, by a member of the house on the floor. -------------------------------------------------------------------------- (seal) recycle printed on recycled paper. vol. 161 washington, friday, march 6, 2015 no. 38",770
CREC-2015-03-06-pt1-PgH1621-6,CREC-2015-03-06,114,COMMUNICATION FROM THE DEMOCRATIC LEADER,"[Congressional Record Volume 161, Number 38 (Friday, March 6, 2015)] [House] [Page H1621] From the Congressional Record Online through the Government Publishing Office [ www.gpo.gov ] COMMUNICATION FROM THE DEMOCRATIC LEADER The SPEAKER pro tempore laid before the House the following communication from the Honorable Nancy Pelosi, Democratic Leader: Congress of the United States, House of Representatives, Washington, DC, March 4, 2015. Hon. John Boehner, Speaker of the House, U.S. Capitol, Washington, DC. Dear Speaker Boehner: Pursuant to Section 4(b) of House Resolution 5, 114th Congress, I am writing to reappoint the following Members to the House Democracy Partnership: The Honorable David Price of North Carolina, Ranking Member The Honorable Lois Capps of California The Honorable Sam Farr of California The Honorable Keith Ellison of Minnesota The Honorable Susan Davis of California The Honorable Gwen Moore of Wisconsin The Honorable Jim McDermott of Washington The Honorable Dina Titus of Nevada Thank you for your attention to these appointments. Sincerely, Nancy Pelosi, Democratic Leader. ____________________","[Congressional Record Volume 161, Number 38 (Friday, March 6, 2015)] [House] [Page H1621] From the Congressional Record Online through the Government Publishing Office [ www.gpo.gov ] COMMUNICATION FROM THE DEMOCRATIC LEADER The SPEAKER pro tempore laid before the House the following communication from the Honorable Nancy Pelosi, Democratic Leader: Congress of the United States, House of Representatives, Washington, DC, March 4, 2015. Hon. John Boehner, Speaker of the House, U.S. Capitol, Washington, DC. Dear Speaker Boehner: Pursuant to Section 4(b) of House Resolution 5, 114th Congress, I am writing to reappoint the following Members to the House Democracy Partnership: The Honorable David Price of North Carolina, Ranking Member The Honorable Lois Capps of California The Honorable Sam Farr of California The Honorable Keith Ellison of Minnesota The Honorable Susan Davis of California The Honorable Gwen Moore of Wisconsin The Honorable Jim McDermott of Washington The Honorable Dina Titus of Nevada Thank you for your attention to these appointments. Sincerely, Nancy Pelosi, Democratic Leader. ____________________","Congressional Record, Volume 161 Issue 38 (Friday, March 6, 2015) [Congressional Record Volume 161, Number 38 (Friday, March 6, 2015)] [House] [Page H1621] From the Congressional Record Online through the Government Publishing Office [ www.gpo.gov ] COMMUNICATION FROM THE DEMOCRATIC LEADER The SPEAKER pro tempore laid before the House the following communication from the Honorable Nancy Pelosi, Democratic Leader: Congress of the United States, House of Representatives, Washington, DC, March 4, 2015. Hon. John Boehner, Speaker of the House, U.S. Capitol, Washington, DC. Dear Speaker Boehner: Pursuant to Section 4(b) of House Resolution 5, 114th Congress, I am writing to reappoint the following Members to the House Democracy Partnership: The Honorable David Price of North Carolina, Ranking Member The Honorable Lois Capps of California The Honorable Sam Farr of California The Honorable Keith Ellison of Minnesota The Honorable Susan Davis of California The Honorable Gwen Moore of Wisconsin The Honorable Jim McDermott of Washington The Honorable Dina Titus of Nevada Thank you for your attention to these appointments. Sincerely, Nancy Pelosi, Democratic Leader. ____________________",package_114_279.csv,1128,1128,1194,"[congressional record volume 161, number 38 (friday, march 6, 2015)] [house] [page h1621] from the congressional record online through the government publishing office [ www.gpo.gov ] communication from the democratic leader the speaker pro tempore laid before the house the following communication from the honorable nancy pelosi, democratic leader: congress of the united states, house of representatives, washington, dc, march 4, 2015. hon. john boehner, speaker of the house, u.s. capitol, washington, dc. dear speaker boehner: pursuant to section 4(b) of house resolution 5, 114th congress, i am writing to reappoint the following members to the house democracy partnership: the honorable david price of north carolina, ranking member the honorable lois capps of california the honorable sam farr of california the honorable keith ellison of minnesota the honorable susan davis of california the honorable gwen moore of wisconsin the honorable jim mcdermott of washington the honorable dina titus of nevada thank you for your attention to these appointments. sincerely, nancy pelosi, democratic leader. ____________________",1128
CREC-2015-03-06-pt1-PgH1621,CREC-2015-03-06,114,House of Representatives,"[Congressional Record Volume 161, Number 38 (Friday, March 6, 2015)] [House] [Page H1621] From the Congressional Record Online through the Government Publishing Office [ www.gpo.gov ] [[Page H1621]] ----------------------------------------------------------------------- House of Representatives The House met at 2 p.m. and was called to order by the Speaker pro tempore (Mr. Denham). ____________________","[Congressional Record Volume 161, Number 38 (Friday, March 6, 2015)] [House] [Page H1621] From the Congressional Record Online through the Government Publishing Office [ www.gpo.gov ] [[Page H1621]] ----------------------------------------------------------------------- House of Representatives The House met at 2 p.m. and was called to order by the Speaker pro tempore (Mr. Denham). ____________________","Congressional Record, Volume 161 Issue 38 (Friday, March 6, 2015) [Congressional Record Volume 161, Number 38 (Friday, March 6, 2015)] [House] [Page H1621] From the Congressional Record Online through the Government Publishing Office [ www.gpo.gov ] [[Page H1621]] ----------------------------------------------------------------------- House of Representatives The House met at 2 p.m. and was called to order by the Speaker pro tempore (Mr. Denham). ____________________",package_114_279.csv,405,405,471,"[congressional record volume 161, number 38 (friday, march 6, 2015)] [house] [page h1621] from the congressional record online through the government publishing office [ www.gpo.gov ] [[page h1621]] ----------------------------------------------------------------------- house of representatives the house met at 2 p.m. and was called to order by the speaker pro tempore (mr. denham). ____________________",405
CREC-2015-03-06-pt1-PgH1621-8,CREC-2015-03-06,114,ADJOURNMENT,"[Congressional Record Volume 161, Number 38 (Friday, March 6, 2015)] [House] [Page H1621] From the Congressional Record Online through the Government Publishing Office [ www.gpo.gov ] ADJOURNMENT The SPEAKER pro tempore. Pursuant to section 2(b) of House Resolution 134, the House stands adjourned until noon on Tuesday, March 10, 2015. Thereupon (at 2 o'clock and 4 minutes p.m.), under its previous order, the House adjourned until Tuesday, March 10, 2015, at noon. ____________________","[Congressional Record Volume 161, Number 38 (Friday, March 6, 2015)] [House] [Page H1621] From the Congressional Record Online through the Government Publishing Office [ www.gpo.gov ] ADJOURNMENT The SPEAKER pro tempore. Pursuant to section 2(b) of House Resolution 134, the House stands adjourned until noon on Tuesday, March 10, 2015. Thereupon (at 2 o'clock and 4 minutes p.m.), under its previous order, the House adjourned until Tuesday, March 10, 2015, at noon. ____________________","Congressional Record, Volume 161 Issue 38 (Friday, March 6, 2015) [Congressional Record Volume 161, Number 38 (Friday, March 6, 2015)] [House] [Page H1621] From the Congressional Record Online through the Government Publishing Office [ www.gpo.gov ] ADJOURNMENT The SPEAKER pro tempore. Pursuant to section 2(b) of House Resolution 134, the House stands adjourned until noon on Tuesday, March 10, 2015. Thereupon (at 2 o'clock and 4 minutes p.m.), under its previous order, the House adjourned until Tuesday, March 10, 2015, at noon. ____________________",package_114_279.csv,488,488,554,"[congressional record volume 161, number 38 (friday, march 6, 2015)] [house] [page h1621] from the congressional record online through the government publishing office [ www.gpo.gov ] adjournment the speaker pro tempore. pursuant to section 2(b) of house resolution 134, the house stands adjourned until noon on tuesday, march 10, 2015. thereupon (at 2 o'clock and 4 minutes p.m.), under its previous order, the house adjourned until tuesday, march 10, 2015, at noon. ____________________",488
