granuleId,packageId,congress,title,parsed_text,text_readability,text_bs4,__source_file,parsed_text_len,text_readability_len,text_bs4_len,search_text,search_text_len
CREC-2015-03-06-pt1-PgE314-2,CREC-2015-03-06,114,RESOLUTION COMMEMORATING THE 50TH ANNIVERSARY OF THE SELMA VOTING RIGHTS MARCH WITH THE ISSUANCE OF A POSTAL STAMP,"[Congressional Record Volume 161, Number 38 (Friday, March 6, 2015)] [Extensions of Remarks] [Page E314] From the Congressional Record Online through the Government Publishing Office [ www.gpo.gov ] RESOLUTION COMMEMORATING THE 50TH ANNIVERSARY OF THE SELMA VOTING RIGHTS MARCH WITH THE ISSUANCE OF A POSTAL STAMP _____ HON. JOYCE BEATTY of ohio in the house of representatives Friday, March 6, 2015 Mrs. BEATTY. Mr. Speaker, today I introduced a bipartisan resolution, House Concurrent Resolution 23, that would honor the Selma to Montgomery, Alabama marches with a commemorative stamp. I thank the 102 House Members who co-sponsored this resolution and leading sponsors Congressman Byrne, Congressman Hurd, and Congresswoman Sewell. The Selma Voting Rights March was a pivotal moment in our history that brought together Americans to march from Selma to Montgomery, Alabama 50 years ago. This stamp celebrates the march and reminds us to protect voting rights. For 125 years the Postal Service has been issuing stamps that celebrate cultural milestones and the unique history of our nation. Surely the protection of voting rights is a landmark development in our nation's development. It is my hope that as we remember the struggles of discrimination and inequality we lift our hearts and unite to find bridges to equality and justice. I ask that all Members unite and join with me in commemorating this critical watershed event. ____________________","[Congressional Record Volume 161, Number 38 (Friday, March 6, 2015)] [Extensions of Remarks] [Page E314] From the Congressional Record Online through the Government Publishing Office [ www.gpo.gov ] RESOLUTION COMMEMORATING THE 50TH ANNIVERSARY OF THE SELMA VOTING RIGHTS MARCH WITH THE ISSUANCE OF A POSTAL STAMP _____ HON. JOYCE BEATTY of ohio in the house of representatives Friday, March 6, 2015 Mrs. BEATTY. Mr. Speaker, today I introduced a bipartisan resolution, House Concurrent Resolution 23, that would honor the Selma to Montgomery, Alabama marches with a commemorative stamp. I thank the 102 House Members who co-sponsored this resolution and leading sponsors Congressman Byrne, Congressman Hurd, and Congresswoman Sewell. The Selma Voting Rights March was a pivotal moment in our history that brought together Americans to march from Selma to Montgomery, Alabama 50 years ago. This stamp celebrates the march and reminds us to protect voting rights. For 125 years the Postal Service has been issuing stamps that celebrate cultural milestones and the unique history of our nation. Surely the protection of voting rights is a landmark development in our nation's development. It is my hope that as we remember the struggles of discrimination and inequality we lift our hearts and unite to find bridges to equality and justice. I ask that all Members unite and join with me in commemorating this critical watershed event. ____________________","Congressional Record, Volume 161 Issue 38 (Friday, March 6, 2015) [Congressional Record Volume 161, Number 38 (Friday, March 6, 2015)] [Extensions of Remarks] [Page E314] From the Congressional Record Online through the Government Publishing Office [ www.gpo.gov ] RESOLUTION COMMEMORATING THE 50TH ANNIVERSARY OF THE SELMA VOTING RIGHTS MARCH WITH THE ISSUANCE OF A POSTAL STAMP _____ HON. JOYCE BEATTY of ohio in the house of representatives Friday, March 6, 2015 Mrs. BEATTY. Mr. Speaker, today I introduced a bipartisan resolution, House Concurrent Resolution 23, that would honor the Selma to Montgomery, Alabama marches with a commemorative stamp. I thank the 102 House Members who co-sponsored this resolution and leading sponsors Congressman Byrne, Congressman Hurd, and Congresswoman Sewell. The Selma Voting Rights March was a pivotal moment in our history that brought together Americans to march from Selma to Montgomery, Alabama 50 years ago. This stamp celebrates the march and reminds us to protect voting rights. For 125 years the Postal Service has been issuing stamps that celebrate cultural milestones and the unique history of our nation. Surely the protection of voting rights is a landmark development in our nation's development. It is my hope that as we remember the struggles of discrimination and inequality we lift our hearts and unite to find bridges to equality and justice. I ask that all Members unite and join with me in commemorating this critical watershed event. ____________________",package_114_279.csv,1452,1452,1518,"[congressional record volume 161, number 38 (friday, march 6, 2015)] [extensions of remarks] [page e314] from the congressional record online through the government publishing office [ www.gpo.gov ] resolution commemorating the 50th anniversary of the selma voting rights march with the issuance of a postal stamp _____ hon. joyce beatty of ohio in the house of representatives friday, march 6, 2015 mrs. beatty. mr. speaker, today i introduced a bipartisan resolution, house concurrent resolution 23, that would honor the selma to montgomery, alabama marches with a commemorative stamp. i thank the 102 house members who co-sponsored this resolution and leading sponsors congressman byrne, congressman hurd, and congresswoman sewell. the selma voting rights march was a pivotal moment in our history that brought together americans to march from selma to montgomery, alabama 50 years ago. this stamp celebrates the march and reminds us to protect voting rights. for 125 years the postal service has been issuing stamps that celebrate cultural milestones and the unique history of our nation. surely the protection of voting rights is a landmark development in our nation's development. it is my hope that as we remember the struggles of discrimination and inequality we lift our hearts and unite to find bridges to equality and justice. i ask that all members unite and join with me in commemorating this critical watershed event. ____________________",1452
CREC-2015-03-06-pt1-PgE314-3,CREC-2015-03-06,114,INTRODUCTION OF THE VISION ZERO ACT OF 2015,"[Congressional Record Volume 161, Number 38 (Friday, March 6, 2015)] [Extensions of Remarks] [Page E314] From the Congressional Record Online through the Government Publishing Office [ www.gpo.gov ] INTRODUCTION OF THE VISION ZERO ACT OF 2015 _____ HON. EARL BLUMENAUER of oregon in the house of representatives Friday, March 6, 2015 Mr. BLUMENAUER. Mr. Speaker, our communities need to be safer. More than 33,000 Americans die on our roadways each year, yet this is accepted as inevitability. Even more concerning, fatalities of our most vulnerable road users--pedestrians and bicyclists--make up a growing share of those deaths, with pedestrian fatalities increasing 16% from 2009 to 2014. People who die on our streets are disproportionally children, seniors, and people from low income or minority communities. Communities across the country are recognizing that there is only one number of acceptable deaths on our streets: zero. ``Vision Zero'' is the goal of eliminating all transportation-related fatalities, including pedestrians, bicyclists, transit users, motorists and passengers. Cities from New York to San Diego are implementing interagency Vision Zero plans connecting engineering, education, and enforcement, to reach the goal of ending transportation deaths. Congress should encourage this innovative approach to transportation safety, and today I'm pleased to introduce the Vision Zero Act of 2015 with my colleague, Representative Buchanan. This bill provides local communities of all sizes with funding and best practices to plan and implement a Vision Zero framework. We should no longer accept bicycle and pedestrian fatalities as harsh reality, and this bill gives us the tools to reverse this trend. ____________________","[Congressional Record Volume 161, Number 38 (Friday, March 6, 2015)] [Extensions of Remarks] [Page E314] From the Congressional Record Online through the Government Publishing Office [ www.gpo.gov ] INTRODUCTION OF THE VISION ZERO ACT OF 2015 _____ HON. EARL BLUMENAUER of oregon in the house of representatives Friday, March 6, 2015 Mr. BLUMENAUER. Mr. Speaker, our communities need to be safer. More than 33,000 Americans die on our roadways each year, yet this is accepted as inevitability. Even more concerning, fatalities of our most vulnerable road users--pedestrians and bicyclists--make up a growing share of those deaths, with pedestrian fatalities increasing 16% from 2009 to 2014. People who die on our streets are disproportionally children, seniors, and people from low income or minority communities. Communities across the country are recognizing that there is only one number of acceptable deaths on our streets: zero. ``Vision Zero'' is the goal of eliminating all transportation-related fatalities, including pedestrians, bicyclists, transit users, motorists and passengers. Cities from New York to San Diego are implementing interagency Vision Zero plans connecting engineering, education, and enforcement, to reach the goal of ending transportation deaths. Congress should encourage this innovative approach to transportation safety, and today I'm pleased to introduce the Vision Zero Act of 2015 with my colleague, Representative Buchanan. This bill provides local communities of all sizes with funding and best practices to plan and implement a Vision Zero framework. We should no longer accept bicycle and pedestrian fatalities as harsh reality, and this bill gives us the tools to reverse this trend. ____________________","Congressional Record, Volume 161 Issue 38 (Friday, March 6, 2015) [Congressional Record Volume 161, Number 38 (Friday, March 6, 2015)] [Extensions of Remarks] [Page E314] From the Congressional Record Online through the Government Publishing Office [ www.gpo.gov ] INTRODUCTION OF THE VISION ZERO ACT OF 2015 _____ HON. EARL BLUMENAUER of oregon in the house of representatives Friday, March 6, 2015 Mr. BLUMENAUER. Mr. Speaker, our communities need to be safer. More than 33,000 Americans die on our roadways each year, yet this is accepted as inevitability. Even more concerning, fatalities of our most vulnerable road users--pedestrians and bicyclists--make up a growing share of those deaths, with pedestrian fatalities increasing 16% from 2009 to 2014. People who die on our streets are disproportionally children, seniors, and people from low income or minority communities. Communities across the country are recognizing that there is only one number of acceptable deaths on our streets: zero. ``Vision Zero'' is the goal of eliminating all transportation-related fatalities, including pedestrians, bicyclists, transit users, motorists and passengers. Cities from New York to San Diego are implementing interagency Vision Zero plans connecting engineering, education, and enforcement, to reach the goal of ending transportation deaths. Congress should encourage this innovative approach to transportation safety, and today I'm pleased to introduce the Vision Zero Act of 2015 with my colleague, Representative Buchanan. This bill provides local communities of all sizes with funding and best practices to plan and implement a Vision Zero framework. We should no longer accept bicycle and pedestrian fatalities as harsh reality, and this bill gives us the tools to reverse this trend. ____________________",package_114_279.csv,1745,1745,1811,"[congressional record volume 161, number 38 (friday, march 6, 2015)] [extensions of remarks] [page e314] from the congressional record online through the government publishing office [ www.gpo.gov ] introduction of the vision zero act of 2015 _____ hon. earl blumenauer of oregon in the house of representatives friday, march 6, 2015 mr. blumenauer. mr. speaker, our communities need to be safer. more than 33,000 americans die on our roadways each year, yet this is accepted as inevitability. even more concerning, fatalities of our most vulnerable road users--pedestrians and bicyclists--make up a growing share of those deaths, with pedestrian fatalities increasing 16% from 2009 to 2014. people who die on our streets are disproportionally children, seniors, and people from low income or minority communities. communities across the country are recognizing that there is only one number of acceptable deaths on our streets: zero. ``vision zero'' is the goal of eliminating all transportation-related fatalities, including pedestrians, bicyclists, transit users, motorists and passengers. cities from new york to san diego are implementing interagency vision zero plans connecting engineering, education, and enforcement, to reach the goal of ending transportation deaths. congress should encourage this innovative approach to transportation safety, and today i'm pleased to introduce the vision zero act of 2015 with my colleague, representative buchanan. this bill provides local communities of all sizes with funding and best practices to plan and implement a vision zero framework. we should no longer accept bicycle and pedestrian fatalities as harsh reality, and this bill gives us the tools to reverse this trend. ____________________",1745
CREC-2015-03-06-pt1-PgE314-4,CREC-2015-03-06,114,HONORING MS. DORIS GENTRY,"[Congressional Record Volume 161, Number 38 (Friday, March 6, 2015)] [Extensions of Remarks] [Page E314] From the Congressional Record Online through the Government Publishing Office [ www.gpo.gov ] HONORING MS. DORIS GENTRY _____ HON. MIKE THOMPSON of california in the house of representatives Friday, March 6, 2015 Mr. THOMPSON of California. Mr. Speaker, I rise today to honor Doris Gentry and the Human Trafficking Steering Committee for the planning and implementation of the first Napa Conference on Human Trafficking. Ms. Gentry saw the need to bring awareness on this important issue, created and led a steering committee made up of the honorable law enforcement officers of Napa County, and has been working hard to bring this conference to fruition. Human trafficking affects as many as twenty-seven million people worldwide, and as many as eighty percent of the victims of human trafficking are former foster youth, but it is both a global and a local problem. The effort by individuals, businesses, organizations, and governing bodies to promote the observance of Human Trafficking Awareness on March 13th of 2015 represents one of the many examples of the ongoing commitment to raise awareness of and to actively oppose human trafficking. For Ms. Gentry, philanthropy and volunteerism has been a life-long activity. She has led numerous boards and organizations dedicated to making our community a better place to live, work, and raise a family, and this conference is yet another demonstration of her devotion. Ms. Gentry is also a foster mom to one hundred teen boys, and has four children and six grand children of her own. I am proud to represent a district with principled, community-minded and globally conscious people such as Doris Gentry. Mr. Speaker, Ms. Gentry and the Human Trafficking Steering Committee deserve to be recognized and honored here today. ____________________","[Congressional Record Volume 161, Number 38 (Friday, March 6, 2015)] [Extensions of Remarks] [Page E314] From the Congressional Record Online through the Government Publishing Office [ www.gpo.gov ] HONORING MS. DORIS GENTRY _____ HON. MIKE THOMPSON of california in the house of representatives Friday, March 6, 2015 Mr. THOMPSON of California. Mr. Speaker, I rise today to honor Doris Gentry and the Human Trafficking Steering Committee for the planning and implementation of the first Napa Conference on Human Trafficking. Ms. Gentry saw the need to bring awareness on this important issue, created and led a steering committee made up of the honorable law enforcement officers of Napa County, and has been working hard to bring this conference to fruition. Human trafficking affects as many as twenty-seven million people worldwide, and as many as eighty percent of the victims of human trafficking are former foster youth, but it is both a global and a local problem. The effort by individuals, businesses, organizations, and governing bodies to promote the observance of Human Trafficking Awareness on March 13th of 2015 represents one of the many examples of the ongoing commitment to raise awareness of and to actively oppose human trafficking. For Ms. Gentry, philanthropy and volunteerism has been a life-long activity. She has led numerous boards and organizations dedicated to making our community a better place to live, work, and raise a family, and this conference is yet another demonstration of her devotion. Ms. Gentry is also a foster mom to one hundred teen boys, and has four children and six grand children of her own. I am proud to represent a district with principled, community-minded and globally conscious people such as Doris Gentry. Mr. Speaker, Ms. Gentry and the Human Trafficking Steering Committee deserve to be recognized and honored here today. ____________________","Congressional Record, Volume 161 Issue 38 (Friday, March 6, 2015) [Congressional Record Volume 161, Number 38 (Friday, March 6, 2015)] [Extensions of Remarks] [Page E314] From the Congressional Record Online through the Government Publishing Office [ www.gpo.gov ] HONORING MS. DORIS GENTRY _____ HON. MIKE THOMPSON of california in the house of representatives Friday, March 6, 2015 Mr. THOMPSON of California. Mr. Speaker, I rise today to honor Doris Gentry and the Human Trafficking Steering Committee for the planning and implementation of the first Napa Conference on Human Trafficking. Ms. Gentry saw the need to bring awareness on this important issue, created and led a steering committee made up of the honorable law enforcement officers of Napa County, and has been working hard to bring this conference to fruition. Human trafficking affects as many as twenty-seven million people worldwide, and as many as eighty percent of the victims of human trafficking are former foster youth, but it is both a global and a local problem. The effort by individuals, businesses, organizations, and governing bodies to promote the observance of Human Trafficking Awareness on March 13th of 2015 represents one of the many examples of the ongoing commitment to raise awareness of and to actively oppose human trafficking. For Ms. Gentry, philanthropy and volunteerism has been a life-long activity. She has led numerous boards and organizations dedicated to making our community a better place to live, work, and raise a family, and this conference is yet another demonstration of her devotion. Ms. Gentry is also a foster mom to one hundred teen boys, and has four children and six grand children of her own. I am proud to represent a district with principled, community-minded and globally conscious people such as Doris Gentry. Mr. Speaker, Ms. Gentry and the Human Trafficking Steering Committee deserve to be recognized and honored here today. ____________________",package_114_279.csv,1900,1900,1966,"[congressional record volume 161, number 38 (friday, march 6, 2015)] [extensions of remarks] [page e314] from the congressional record online through the government publishing office [ www.gpo.gov ] honoring ms. doris gentry _____ hon. mike thompson of california in the house of representatives friday, march 6, 2015 mr. thompson of california. mr. speaker, i rise today to honor doris gentry and the human trafficking steering committee for the planning and implementation of the first napa conference on human trafficking. ms. gentry saw the need to bring awareness on this important issue, created and led a steering committee made up of the honorable law enforcement officers of napa county, and has been working hard to bring this conference to fruition. human trafficking affects as many as twenty-seven million people worldwide, and as many as eighty percent of the victims of human trafficking are former foster youth, but it is both a global and a local problem. the effort by individuals, businesses, organizations, and governing bodies to promote the observance of human trafficking awareness on march 13th of 2015 represents one of the many examples of the ongoing commitment to raise awareness of and to actively oppose human trafficking. for ms. gentry, philanthropy and volunteerism has been a life-long activity. she has led numerous boards and organizations dedicated to making our community a better place to live, work, and raise a family, and this conference is yet another demonstration of her devotion. ms. gentry is also a foster mom to one hundred teen boys, and has four children and six grand children of her own. i am proud to represent a district with principled, community-minded and globally conscious people such as doris gentry. mr. speaker, ms. gentry and the human trafficking steering committee deserve to be recognized and honored here today. ____________________",1900
