granuleId,packageId,congress,title,parsed_text,text_readability,text_bs4,__source_file,parsed_text_len,text_readability_len,text_bs4_len,search_text,search_text_len
CREC-2016-05-03-pt1-PgE646,CREC-2016-05-03,114,CONGRATULATING VALLEY HOPE AT GRAPEVINE ON THEIR FIFTEENTH ANNIVERSARY,"[Congressional Record Volume 162, Number 69 (Tuesday, May 3, 2016)] [Extensions of Remarks] [Page E646] From the Congressional Record Online through the Government Publishing Office [ www.gpo.gov ] CONGRATULATING VALLEY HOPE AT GRAPEVINE ON THEIR FIFTEENTH ANNIVERSARY ______ HON. KENNY MARCHANT of texas in the house of representatives Tuesday, May 3, 2016 Mr. MARCHANT. Mr. Speaker, I rise today to congratulate Valley Hope at Grapevine on their fifteenth anniversary of service in the Dallas- Fort Worth Metroplex. Nearly fifty years ago in Norton, Kansas, Valley Hope began providing affordable treatment services to those within their community suffering from addiction and needing assistance. Since first opening in 1967, Valley Hope has grown to offer their services in seven states and provides support to thousands of individuals in need. Over the last fifteen years, Valley Hope has provided the residents of Grapevine and the Dallas-Fort Worth Metroplex with addiction treatment and rehabilitative services, impacting the lives of countless Texans and their families struggling with addiction. By providing comprehensive treatment services for substance use disorders, Valley Hope is able to increase the quality of life of their patients and allow them the opportunity to live their lives free from the anchors of addiction. The nation's substance abuse epidemic continues to spread throughout our cities, our communities, and our schools. I commend Valley Hope for their efforts to address this crisis and tackle an issue of such great importance head on. Rehabilitation services such as those offered by Valley Hope provide a tremendous benefit to the community. Mr. Speaker, it is a pleasure to recognize the tireless efforts Valley Hope has made towards ending chemical dependency and substance use disorders. I ask all of my distinguished colleagues to join me in congratulating Valley Hope at Grapevine on their fifteenth anniversary of service. ____________________","[Congressional Record Volume 162, Number 69 (Tuesday, May 3, 2016)] [Extensions of Remarks] [Page E646] From the Congressional Record Online through the Government Publishing Office [ www.gpo.gov ] CONGRATULATING VALLEY HOPE AT GRAPEVINE ON THEIR FIFTEENTH ANNIVERSARY ______ HON. KENNY MARCHANT of texas in the house of representatives Tuesday, May 3, 2016 Mr. MARCHANT. Mr. Speaker, I rise today to congratulate Valley Hope at Grapevine on their fifteenth anniversary of service in the Dallas- Fort Worth Metroplex. Nearly fifty years ago in Norton, Kansas, Valley Hope began providing affordable treatment services to those within their community suffering from addiction and needing assistance. Since first opening in 1967, Valley Hope has grown to offer their services in seven states and provides support to thousands of individuals in need. Over the last fifteen years, Valley Hope has provided the residents of Grapevine and the Dallas-Fort Worth Metroplex with addiction treatment and rehabilitative services, impacting the lives of countless Texans and their families struggling with addiction. By providing comprehensive treatment services for substance use disorders, Valley Hope is able to increase the quality of life of their patients and allow them the opportunity to live their lives free from the anchors of addiction. The nation's substance abuse epidemic continues to spread throughout our cities, our communities, and our schools. I commend Valley Hope for their efforts to address this crisis and tackle an issue of such great importance head on. Rehabilitation services such as those offered by Valley Hope provide a tremendous benefit to the community. Mr. Speaker, it is a pleasure to recognize the tireless efforts Valley Hope has made towards ending chemical dependency and substance use disorders. I ask all of my distinguished colleagues to join me in congratulating Valley Hope at Grapevine on their fifteenth anniversary of service. ____________________","Congressional Record, Volume 162 Issue 69 (Tuesday, May 3, 2016) [Congressional Record Volume 162, Number 69 (Tuesday, May 3, 2016)] [Extensions of Remarks] [Page E646] From the Congressional Record Online through the Government Publishing Office [ www.gpo.gov ] CONGRATULATING VALLEY HOPE AT GRAPEVINE ON THEIR FIFTEENTH ANNIVERSARY ______ HON. KENNY MARCHANT of texas in the house of representatives Tuesday, May 3, 2016 Mr. MARCHANT. Mr. Speaker, I rise today to congratulate Valley Hope at Grapevine on their fifteenth anniversary of service in the Dallas- Fort Worth Metroplex. Nearly fifty years ago in Norton, Kansas, Valley Hope began providing affordable treatment services to those within their community suffering from addiction and needing assistance. Since first opening in 1967, Valley Hope has grown to offer their services in seven states and provides support to thousands of individuals in need. Over the last fifteen years, Valley Hope has provided the residents of Grapevine and the Dallas-Fort Worth Metroplex with addiction treatment and rehabilitative services, impacting the lives of countless Texans and their families struggling with addiction. By providing comprehensive treatment services for substance use disorders, Valley Hope is able to increase the quality of life of their patients and allow them the opportunity to live their lives free from the anchors of addiction. The nation's substance abuse epidemic continues to spread throughout our cities, our communities, and our schools. I commend Valley Hope for their efforts to address this crisis and tackle an issue of such great importance head on. Rehabilitation services such as those offered by Valley Hope provide a tremendous benefit to the community. Mr. Speaker, it is a pleasure to recognize the tireless efforts Valley Hope has made towards ending chemical dependency and substance use disorders. I ask all of my distinguished colleagues to join me in congratulating Valley Hope at Grapevine on their fifteenth anniversary of service. ____________________",package_114_258.csv,1984,1984,2049,"[congressional record volume 162, number 69 (tuesday, may 3, 2016)] [extensions of remarks] [page e646] from the congressional record online through the government publishing office [ www.gpo.gov ] congratulating valley hope at grapevine on their fifteenth anniversary ______ hon. kenny marchant of texas in the house of representatives tuesday, may 3, 2016 mr. marchant. mr. speaker, i rise today to congratulate valley hope at grapevine on their fifteenth anniversary of service in the dallas- fort worth metroplex. nearly fifty years ago in norton, kansas, valley hope began providing affordable treatment services to those within their community suffering from addiction and needing assistance. since first opening in 1967, valley hope has grown to offer their services in seven states and provides support to thousands of individuals in need. over the last fifteen years, valley hope has provided the residents of grapevine and the dallas-fort worth metroplex with addiction treatment and rehabilitative services, impacting the lives of countless texans and their families struggling with addiction. by providing comprehensive treatment services for substance use disorders, valley hope is able to increase the quality of life of their patients and allow them the opportunity to live their lives free from the anchors of addiction. the nation's substance abuse epidemic continues to spread throughout our cities, our communities, and our schools. i commend valley hope for their efforts to address this crisis and tackle an issue of such great importance head on. rehabilitation services such as those offered by valley hope provide a tremendous benefit to the community. mr. speaker, it is a pleasure to recognize the tireless efforts valley hope has made towards ending chemical dependency and substance use disorders. i ask all of my distinguished colleagues to join me in congratulating valley hope at grapevine on their fifteenth anniversary of service. ____________________",1984
CREC-2016-05-03-pt1-PgE645-6,CREC-2016-05-03,114,PERSONAL EXPLANATION,"[Congressional Record Volume 162, Number 69 (Tuesday, May 3, 2016)] [Extensions of Remarks] [Page E645] From the Congressional Record Online through the Government Publishing Office [ www.gpo.gov ] PERSONAL EXPLANATION ______ HON. RICHARD M. NOLAN of minnesota in the house of representatives Tuesday, May 3, 2016 Mr. NOLAN. Mr. Speaker, I would like to amend my vote on Roll Call No. 179 (Motion to Recommit H.R. 4901) to YES. I inadvertently voted in the negative. In my view, every child deserves access to a quality education without fear of being ostracized, punished, or discriminated against because of their race, religion, gender, ability, or because they are LGBT. I have long been an outspoken advocate for efforts to protect individuals from discrimination because of who they are or whom they love. That has not and will not change. ____________________","[Congressional Record Volume 162, Number 69 (Tuesday, May 3, 2016)] [Extensions of Remarks] [Page E645] From the Congressional Record Online through the Government Publishing Office [ www.gpo.gov ] PERSONAL EXPLANATION ______ HON. RICHARD M. NOLAN of minnesota in the house of representatives Tuesday, May 3, 2016 Mr. NOLAN. Mr. Speaker, I would like to amend my vote on Roll Call No. 179 (Motion to Recommit H.R. 4901) to YES. I inadvertently voted in the negative. In my view, every child deserves access to a quality education without fear of being ostracized, punished, or discriminated against because of their race, religion, gender, ability, or because they are LGBT. I have long been an outspoken advocate for efforts to protect individuals from discrimination because of who they are or whom they love. That has not and will not change. ____________________","Congressional Record, Volume 162 Issue 69 (Tuesday, May 3, 2016) [Congressional Record Volume 162, Number 69 (Tuesday, May 3, 2016)] [Extensions of Remarks] [Page E645] From the Congressional Record Online through the Government Publishing Office [ www.gpo.gov ] PERSONAL EXPLANATION ______ HON. RICHARD M. NOLAN of minnesota in the house of representatives Tuesday, May 3, 2016 Mr. NOLAN. Mr. Speaker, I would like to amend my vote on Roll Call No. 179 (Motion to Recommit H.R. 4901) to YES. I inadvertently voted in the negative. In my view, every child deserves access to a quality education without fear of being ostracized, punished, or discriminated against because of their race, religion, gender, ability, or because they are LGBT. I have long been an outspoken advocate for efforts to protect individuals from discrimination because of who they are or whom they love. That has not and will not change. ____________________",package_114_258.csv,866,866,931,"[congressional record volume 162, number 69 (tuesday, may 3, 2016)] [extensions of remarks] [page e645] from the congressional record online through the government publishing office [ www.gpo.gov ] personal explanation ______ hon. richard m. nolan of minnesota in the house of representatives tuesday, may 3, 2016 mr. nolan. mr. speaker, i would like to amend my vote on roll call no. 179 (motion to recommit h.r. 4901) to yes. i inadvertently voted in the negative. in my view, every child deserves access to a quality education without fear of being ostracized, punished, or discriminated against because of their race, religion, gender, ability, or because they are lgbt. i have long been an outspoken advocate for efforts to protect individuals from discrimination because of who they are or whom they love. that has not and will not change. ____________________",866
CREC-2016-05-03-pt1-PgE645-7,CREC-2016-05-03,114,26TH ANNUAL DC BLACK PRIDE CELEBRATION,"[Congressional Record Volume 162, Number 69 (Tuesday, May 3, 2016)] [Extensions of Remarks] [Pages E645-E646] From the Congressional Record Online through the Government Publishing Office [ www.gpo.gov ] 26TH ANNUAL DC BLACK PRIDE CELEBRATION ______ HON. ELEANOR HOLMES NORTON of the district of columbia in the house of representatives Tuesday, May 3, 2016 Ms. NORTON. Mr. Speaker, I rise today to ask the House of Representatives to join me in celebrating the 26th annual DC Black Pride celebration on May 27-29, 2016. DC Black Pride 2016 is a multi-day festival featuring a reception, films, a poetry slam, a church service, educational workshops, community town hall meetings, a basketball tournament, an awards ceremony, and a health and wellness expo, among other events. We in the District of Columbia are pleased and proud that the DC Black Pride celebration is widely considered to be one of the world's preeminent Black Pride celebrations, drawing more than 30,000 people to the nation's capital from across the United States as well as [[Page E646]] from Canada, the Caribbean, South Africa, Great Britain, France, Germany, and the Netherlands. As the very first Black Pride festival, DC Black Pride fostered the beginning of the Center for Black Equity (formerly known as the International Federation of Black Prides, Inc. (IFBP)) and the ``Black Pride Movement,'' which now consists of 40 Black Prides on four continents. The Center For Black Equity, the celebration's organizing body, chose: ``I AM U. U R ME. WE ARE PRIDE!'' as the theme for this year's celebration. DC Black Pride is a project of the Center For Black Equity and is coordinated by Earl D. Fowlkes, Jr. and Kenya Hutton with assistance from a volunteer advisory board, which coordinates this annual event and consists of Andrea Woody-Macko; Shannon Garcon; Genise Chambers- Woods; Reginald Shaw-Richardson; and Gladece Knight. I ask the House to join me in welcoming all attending the 26th annual DC Black Pride celebration in Washington, D.C., and I take this opportunity to remind the celebrants that United States citizens who reside in the District of Columbia are taxed without full voting representation in Congress. ____________________","[Congressional Record Volume 162, Number 69 (Tuesday, May 3, 2016)] [Extensions of Remarks] [Pages E645-E646] From the Congressional Record Online through the Government Publishing Office [ www.gpo.gov ] 26TH ANNUAL DC BLACK PRIDE CELEBRATION ______ HON. ELEANOR HOLMES NORTON of the district of columbia in the house of representatives Tuesday, May 3, 2016 Ms. NORTON. Mr. Speaker, I rise today to ask the House of Representatives to join me in celebrating the 26th annual DC Black Pride celebration on May 27-29, 2016. DC Black Pride 2016 is a multi-day festival featuring a reception, films, a poetry slam, a church service, educational workshops, community town hall meetings, a basketball tournament, an awards ceremony, and a health and wellness expo, among other events. We in the District of Columbia are pleased and proud that the DC Black Pride celebration is widely considered to be one of the world's preeminent Black Pride celebrations, drawing more than 30,000 people to the nation's capital from across the United States as well as [[Page E646]] from Canada, the Caribbean, South Africa, Great Britain, France, Germany, and the Netherlands. As the very first Black Pride festival, DC Black Pride fostered the beginning of the Center for Black Equity (formerly known as the International Federation of Black Prides, Inc. (IFBP)) and the ``Black Pride Movement,'' which now consists of 40 Black Prides on four continents. The Center For Black Equity, the celebration's organizing body, chose: ``I AM U. U R ME. WE ARE PRIDE!'' as the theme for this year's celebration. DC Black Pride is a project of the Center For Black Equity and is coordinated by Earl D. Fowlkes, Jr. and Kenya Hutton with assistance from a volunteer advisory board, which coordinates this annual event and consists of Andrea Woody-Macko; Shannon Garcon; Genise Chambers- Woods; Reginald Shaw-Richardson; and Gladece Knight. I ask the House to join me in welcoming all attending the 26th annual DC Black Pride celebration in Washington, D.C., and I take this opportunity to remind the celebrants that United States citizens who reside in the District of Columbia are taxed without full voting representation in Congress. ____________________","Congressional Record, Volume 162 Issue 69 (Tuesday, May 3, 2016) [Congressional Record Volume 162, Number 69 (Tuesday, May 3, 2016)] [Extensions of Remarks] [Pages E645-E646] From the Congressional Record Online through the Government Publishing Office [ www.gpo.gov ] 26TH ANNUAL DC BLACK PRIDE CELEBRATION ______ HON. ELEANOR HOLMES NORTON of the district of columbia in the house of representatives Tuesday, May 3, 2016 Ms. NORTON. Mr. Speaker, I rise today to ask the House of Representatives to join me in celebrating the 26th annual DC Black Pride celebration on May 27-29, 2016. DC Black Pride 2016 is a multi-day festival featuring a reception, films, a poetry slam, a church service, educational workshops, community town hall meetings, a basketball tournament, an awards ceremony, and a health and wellness expo, among other events. We in the District of Columbia are pleased and proud that the DC Black Pride celebration is widely considered to be one of the world's preeminent Black Pride celebrations, drawing more than 30,000 people to the nation's capital from across the United States as well as [[Page E646]] from Canada, the Caribbean, South Africa, Great Britain, France, Germany, and the Netherlands. As the very first Black Pride festival, DC Black Pride fostered the beginning of the Center for Black Equity (formerly known as the International Federation of Black Prides, Inc. (IFBP)) and the ``Black Pride Movement,'' which now consists of 40 Black Prides on four continents. The Center For Black Equity, the celebration's organizing body, chose: ``I AM U. U R ME. WE ARE PRIDE!'' as the theme for this year's celebration. DC Black Pride is a project of the Center For Black Equity and is coordinated by Earl D. Fowlkes, Jr. and Kenya Hutton with assistance from a volunteer advisory board, which coordinates this annual event and consists of Andrea Woody-Macko; Shannon Garcon; Genise Chambers- Woods; Reginald Shaw-Richardson; and Gladece Knight. I ask the House to join me in welcoming all attending the 26th annual DC Black Pride celebration in Washington, D.C., and I take this opportunity to remind the celebrants that United States citizens who reside in the District of Columbia are taxed without full voting representation in Congress. ____________________",package_114_258.csv,2224,2224,2289,"[congressional record volume 162, number 69 (tuesday, may 3, 2016)] [extensions of remarks] [pages e645-e646] from the congressional record online through the government publishing office [ www.gpo.gov ] 26th annual dc black pride celebration ______ hon. eleanor holmes norton of the district of columbia in the house of representatives tuesday, may 3, 2016 ms. norton. mr. speaker, i rise today to ask the house of representatives to join me in celebrating the 26th annual dc black pride celebration on may 27-29, 2016. dc black pride 2016 is a multi-day festival featuring a reception, films, a poetry slam, a church service, educational workshops, community town hall meetings, a basketball tournament, an awards ceremony, and a health and wellness expo, among other events. we in the district of columbia are pleased and proud that the dc black pride celebration is widely considered to be one of the world's preeminent black pride celebrations, drawing more than 30,000 people to the nation's capital from across the united states as well as [[page e646]] from canada, the caribbean, south africa, great britain, france, germany, and the netherlands. as the very first black pride festival, dc black pride fostered the beginning of the center for black equity (formerly known as the international federation of black prides, inc. (ifbp)) and the ``black pride movement,'' which now consists of 40 black prides on four continents. the center for black equity, the celebration's organizing body, chose: ``i am u. u r me. we are pride!'' as the theme for this year's celebration. dc black pride is a project of the center for black equity and is coordinated by earl d. fowlkes, jr. and kenya hutton with assistance from a volunteer advisory board, which coordinates this annual event and consists of andrea woody-macko; shannon garcon; genise chambers- woods; reginald shaw-richardson; and gladece knight. i ask the house to join me in welcoming all attending the 26th annual dc black pride celebration in washington, d.c., and i take this opportunity to remind the celebrants that united states citizens who reside in the district of columbia are taxed without full voting representation in congress. ____________________",2224
