granuleId,packageId,congress,title,parsed_text,text_readability,text_bs4,__source_file,parsed_text_len,text_readability_len,text_bs4_len,search_text,search_text_len
CREC-2016-05-03-pt1-PgH2153-6,CREC-2016-05-03,114,ADJOURNMENT,"[Congressional Record Volume 162, Number 69 (Tuesday, May 3, 2016)] [House] [Page H2153] From the Congressional Record Online through the Government Publishing Office [ www.gpo.gov ] ADJOURNMENT The SPEAKER pro tempore. Pursuant to section 3(b) of House Resolution 706, the House stands adjourned until 9 a.m. on Friday, May 6, 2016. Thereupon (at 3 o'clock and 2 minutes p.m.), under its previous order, the House adjourned until Friday, May 6, 2016, at 9 a.m. ____________________","[Congressional Record Volume 162, Number 69 (Tuesday, May 3, 2016)] [House] [Page H2153] From the Congressional Record Online through the Government Publishing Office [ www.gpo.gov ] ADJOURNMENT The SPEAKER pro tempore. Pursuant to section 3(b) of House Resolution 706, the House stands adjourned until 9 a.m. on Friday, May 6, 2016. Thereupon (at 3 o'clock and 2 minutes p.m.), under its previous order, the House adjourned until Friday, May 6, 2016, at 9 a.m. ____________________","Congressional Record, Volume 162 Issue 69 (Tuesday, May 3, 2016) [Congressional Record Volume 162, Number 69 (Tuesday, May 3, 2016)] [House] [Page H2153] From the Congressional Record Online through the Government Publishing Office [ www.gpo.gov ] ADJOURNMENT The SPEAKER pro tempore. Pursuant to section 3(b) of House Resolution 706, the House stands adjourned until 9 a.m. on Friday, May 6, 2016. Thereupon (at 3 o'clock and 2 minutes p.m.), under its previous order, the House adjourned until Friday, May 6, 2016, at 9 a.m. ____________________",package_114_258.csv,482,482,547,"[congressional record volume 162, number 69 (tuesday, may 3, 2016)] [house] [page h2153] from the congressional record online through the government publishing office [ www.gpo.gov ] adjournment the speaker pro tempore. pursuant to section 3(b) of house resolution 706, the house stands adjourned until 9 a.m. on friday, may 6, 2016. thereupon (at 3 o'clock and 2 minutes p.m.), under its previous order, the house adjourned until friday, may 6, 2016, at 9 a.m. ____________________",482
CREC-2016-05-03-pt1-PgH-FrontMatter,CREC-2016-05-03,114,Senate,"[Congressional Record Volume 162, Number 69 (Tuesday, May 3, 2016)] [House] [Page H2153] From the Congressional Record Online through the Government Publishing Office [ www.gpo.gov ] S E N A T E Vol. 162 WASHINGTON, TUESDAY, MAY 3, 2016 No. 69","[Congressional Record Volume 162, Number 69 (Tuesday, May 3, 2016)] [House] [Page H2153] From the Congressional Record Online through the Government Publishing Office [ www.gpo.gov ] S E N A T E Vol. 162 WASHINGTON, TUESDAY, MAY 3, 2016 No. 69","Congressional Record, Volume 162 Issue 69 (Tuesday, May 3, 2016) [Congressional Record Volume 162, Number 69 (Tuesday, May 3, 2016)] [House] [Page H2153] From the Congressional Record Online through the Government Publishing Office [ www.gpo.gov ] S E N A T E Vol. 162 WASHINGTON, TUESDAY, MAY 3, 2016 No. 69",package_114_258.csv,243,243,308,"[congressional record volume 162, number 69 (tuesday, may 3, 2016)] [house] [page h2153] from the congressional record online through the government publishing office [ www.gpo.gov ] s e n a t e vol. 162 washington, tuesday, may 3, 2016 no. 69",243
CREC-2016-05-03-pt1-PgH2153-4,CREC-2016-05-03,114,THE JOURNAL,"[Congressional Record Volume 162, Number 69 (Tuesday, May 3, 2016)] [House] [Page H2153] From the Congressional Record Online through the Government Publishing Office [ www.gpo.gov ] THE JOURNAL The SPEAKER pro tempore. Pursuant to section 3(a) of House Resolution 706, the Journal of the last day's proceedings is approved. ____________________","[Congressional Record Volume 162, Number 69 (Tuesday, May 3, 2016)] [House] [Page H2153] From the Congressional Record Online through the Government Publishing Office [ www.gpo.gov ] THE JOURNAL The SPEAKER pro tempore. Pursuant to section 3(a) of House Resolution 706, the Journal of the last day's proceedings is approved. ____________________","Congressional Record, Volume 162 Issue 69 (Tuesday, May 3, 2016) [Congressional Record Volume 162, Number 69 (Tuesday, May 3, 2016)] [House] [Page H2153] From the Congressional Record Online through the Government Publishing Office [ www.gpo.gov ] THE JOURNAL The SPEAKER pro tempore. Pursuant to section 3(a) of House Resolution 706, the Journal of the last day's proceedings is approved. ____________________",package_114_258.csv,345,345,410,"[congressional record volume 162, number 69 (tuesday, may 3, 2016)] [house] [page h2153] from the congressional record online through the government publishing office [ www.gpo.gov ] the journal the speaker pro tempore. pursuant to section 3(a) of house resolution 706, the journal of the last day's proceedings is approved. ____________________",345
CREC-2016-05-03-pt1-PgH2153-2,CREC-2016-05-03,114,DESIGNATION OF THE SPEAKER PRO TEMPORE,"[Congressional Record Volume 162, Number 69 (Tuesday, May 3, 2016)] [House] [Page H2153] From the Congressional Record Online through the Government Publishing Office [ www.gpo.gov ] DESIGNATION OF THE SPEAKER PRO TEMPORE The SPEAKER pro tempore laid before the House the following communication from the Speaker: Washington, DC, May 3, 2016. I hereby appoint the Honorable Thomas J. Rooney to act as Speaker pro tempore on this day. Paul D. Ryan, Speaker of the House of Representatives. ____________________","[Congressional Record Volume 162, Number 69 (Tuesday, May 3, 2016)] [House] [Page H2153] From the Congressional Record Online through the Government Publishing Office [ www.gpo.gov ] DESIGNATION OF THE SPEAKER PRO TEMPORE The SPEAKER pro tempore laid before the House the following communication from the Speaker: Washington, DC, May 3, 2016. I hereby appoint the Honorable Thomas J. Rooney to act as Speaker pro tempore on this day. Paul D. Ryan, Speaker of the House of Representatives. ____________________","Congressional Record, Volume 162 Issue 69 (Tuesday, May 3, 2016) [Congressional Record Volume 162, Number 69 (Tuesday, May 3, 2016)] [House] [Page H2153] From the Congressional Record Online through the Government Publishing Office [ www.gpo.gov ] DESIGNATION OF THE SPEAKER PRO TEMPORE The SPEAKER pro tempore laid before the House the following communication from the Speaker: Washington, DC, May 3, 2016. I hereby appoint the Honorable Thomas J. Rooney to act as Speaker pro tempore on this day. Paul D. Ryan, Speaker of the House of Representatives. ____________________",package_114_258.csv,509,509,574,"[congressional record volume 162, number 69 (tuesday, may 3, 2016)] [house] [page h2153] from the congressional record online through the government publishing office [ www.gpo.gov ] designation of the speaker pro tempore the speaker pro tempore laid before the house the following communication from the speaker: washington, dc, may 3, 2016. i hereby appoint the honorable thomas j. rooney to act as speaker pro tempore on this day. paul d. ryan, speaker of the house of representatives. ____________________",509
