granuleId,packageId,congress,title,parsed_text,text_readability,text_bs4,__source_file,parsed_text_len,text_readability_len,text_bs4_len,search_text,search_text_len
CREC-2016-05-03-pt1-PgH2154-2,CREC-2016-05-03,114,PUBLIC BILLS AND RESOLUTIONS,"[Congressional Record Volume 162, Number 69 (Tuesday, May 3, 2016)] [House] [Pages H2154-H2155] From the Congressional Record Online through the Government Publishing Office [ www.gpo.gov ] PUBLIC BILLS AND RESOLUTIONS Under clause 2 of rule XII, public bills and resolutions of the following titles were introduced and severally referred, as follows: By Ms. JENKINS of Kansas (for herself, Mr. Loebsack, and Mr. Smith of Nebraska): H.R. 5164. A bill to provide for a permanent extension of the enforcement instruction on supervision requirements for outpatient therapeutic services in critical access and small rural hospitals; to the Committee on Energy and Commerce, and in addition to the Committee on Ways and Means, for a period to be subsequently determined by the Speaker, in each case for consideration of such provisions as fall within the jurisdiction of the committee concerned. By Mr. DELANEY (for himself, Ms. Bordallo, Ms. Clarke of New York, Mr. Connolly, Mr. Conyers, Mr. DeFazio, Mr. DeSaulnier, Ms. Edwards, Mr. Garamendi, Mr. Gibson, Mr. Grayson, Mr. Grijalva, Mr. Hastings, Mr. Honda, Mr. Jones, Mr. Keating, Mr. Larson of Connecticut, Mrs. Lawrence, Ms. Lee, Mr. McDermott, Mr. McGovern, Ms. Moore, Mrs. Napolitano, Ms. Norton, Mr. O'Rourke, Mr. Peterson, Ms. Pingree, Mr. Pocan, Mr. Rangel, Mr. Rush, Ms. Sinema, Mr. Takai, and Mr. Van Hollen): H.R. 5165. A bill to amend the Family and Medical Leave Act of 1993 to provide a partial exemption to veterans from the eligibility requirements, and for other purposes; to the Committee on Education and the Workforce, and in addition to the Committees on Oversight and Government Reform, and House Administration, for a period to be subsequently determined by the Speaker, in each case for consideration of such provisions as fall within the jurisdiction of the committee concerned. By Mr. YOHO (for himself, Mr. Murphy of Florida, Mr. Rodney Davis of Illinois, Mr. Weber of Texas, Ms. Sinema, Mr. Collins of Georgia, Mr. Nugent, Mr. DeSantis, Mr. Meehan, Mr. Poe of Texas, Mr. Rothfus, Mrs. Kirkpatrick, Ms. Kaptur, Mr. Babin, Mr. Heck of Nevada, Mr. Sablan, Mr. Thompson of California, Mr. Rouzer, Mr. LaMalfa, Mr. Harper, Mr. Curbelo of Florida, Mrs. Wagner, [[Page H2155]] Mr. Williams, Mr. Jody B. Hice of Georgia, Mr. Pearce, Mr. Ruppersberger, Mr. DeSaulnier, Mr. Costa, Mr. Brat, Mr. Rooney of Florida, and Mr. Rangel): H.R. 5166. A bill to amend title 38, United States Code, to provide certain employees of Members of Congress and certain employees of State or local governmental agencies with access to case-tracking information of the Department of Veterans Affairs; to the Committee on Veterans' Affairs. By Mr. PAULSEN (for himself, Ms. McCollum, Mr. Nolan, and Mr. Ellison): H. Res. 718. A resolution honoring the 75th Anniversary of Flotilla 11-1, 8th District-Western Rivers Region, Coast Guard Auxiliary; to the Committee on Transportation and Infrastructure. ____________________","[Congressional Record Volume 162, Number 69 (Tuesday, May 3, 2016)] [House] [Pages H2154-H2155] From the Congressional Record Online through the Government Publishing Office [ www.gpo.gov ] PUBLIC BILLS AND RESOLUTIONS Under clause 2 of rule XII, public bills and resolutions of the following titles were introduced and severally referred, as follows: By Ms. JENKINS of Kansas (for herself, Mr. Loebsack, and Mr. Smith of Nebraska): H.R. 5164. A bill to provide for a permanent extension of the enforcement instruction on supervision requirements for outpatient therapeutic services in critical access and small rural hospitals; to the Committee on Energy and Commerce, and in addition to the Committee on Ways and Means, for a period to be subsequently determined by the Speaker, in each case for consideration of such provisions as fall within the jurisdiction of the committee concerned. By Mr. DELANEY (for himself, Ms. Bordallo, Ms. Clarke of New York, Mr. Connolly, Mr. Conyers, Mr. DeFazio, Mr. DeSaulnier, Ms. Edwards, Mr. Garamendi, Mr. Gibson, Mr. Grayson, Mr. Grijalva, Mr. Hastings, Mr. Honda, Mr. Jones, Mr. Keating, Mr. Larson of Connecticut, Mrs. Lawrence, Ms. Lee, Mr. McDermott, Mr. McGovern, Ms. Moore, Mrs. Napolitano, Ms. Norton, Mr. O'Rourke, Mr. Peterson, Ms. Pingree, Mr. Pocan, Mr. Rangel, Mr. Rush, Ms. Sinema, Mr. Takai, and Mr. Van Hollen): H.R. 5165. A bill to amend the Family and Medical Leave Act of 1993 to provide a partial exemption to veterans from the eligibility requirements, and for other purposes; to the Committee on Education and the Workforce, and in addition to the Committees on Oversight and Government Reform, and House Administration, for a period to be subsequently determined by the Speaker, in each case for consideration of such provisions as fall within the jurisdiction of the committee concerned. By Mr. YOHO (for himself, Mr. Murphy of Florida, Mr. Rodney Davis of Illinois, Mr. Weber of Texas, Ms. Sinema, Mr. Collins of Georgia, Mr. Nugent, Mr. DeSantis, Mr. Meehan, Mr. Poe of Texas, Mr. Rothfus, Mrs. Kirkpatrick, Ms. Kaptur, Mr. Babin, Mr. Heck of Nevada, Mr. Sablan, Mr. Thompson of California, Mr. Rouzer, Mr. LaMalfa, Mr. Harper, Mr. Curbelo of Florida, Mrs. Wagner, [[Page H2155]] Mr. Williams, Mr. Jody B. Hice of Georgia, Mr. Pearce, Mr. Ruppersberger, Mr. DeSaulnier, Mr. Costa, Mr. Brat, Mr. Rooney of Florida, and Mr. Rangel): H.R. 5166. A bill to amend title 38, United States Code, to provide certain employees of Members of Congress and certain employees of State or local governmental agencies with access to case-tracking information of the Department of Veterans Affairs; to the Committee on Veterans' Affairs. By Mr. PAULSEN (for himself, Ms. McCollum, Mr. Nolan, and Mr. Ellison): H. Res. 718. A resolution honoring the 75th Anniversary of Flotilla 11-1, 8th District-Western Rivers Region, Coast Guard Auxiliary; to the Committee on Transportation and Infrastructure. ____________________","Congressional Record, Volume 162 Issue 69 (Tuesday, May 3, 2016) [Congressional Record Volume 162, Number 69 (Tuesday, May 3, 2016)] [House] [Pages H2154-H2155] From the Congressional Record Online through the Government Publishing Office [ www.gpo.gov ] PUBLIC BILLS AND RESOLUTIONS Under clause 2 of rule XII, public bills and resolutions of the following titles were introduced and severally referred, as follows: By Ms. JENKINS of Kansas (for herself, Mr. Loebsack, and Mr. Smith of Nebraska): H.R. 5164. A bill to provide for a permanent extension of the enforcement instruction on supervision requirements for outpatient therapeutic services in critical access and small rural hospitals; to the Committee on Energy and Commerce, and in addition to the Committee on Ways and Means, for a period to be subsequently determined by the Speaker, in each case for consideration of such provisions as fall within the jurisdiction of the committee concerned. By Mr. DELANEY (for himself, Ms. Bordallo, Ms. Clarke of New York, Mr. Connolly, Mr. Conyers, Mr. DeFazio, Mr. DeSaulnier, Ms. Edwards, Mr. Garamendi, Mr. Gibson, Mr. Grayson, Mr. Grijalva, Mr. Hastings, Mr. Honda, Mr. Jones, Mr. Keating, Mr. Larson of Connecticut, Mrs. Lawrence, Ms. Lee, Mr. McDermott, Mr. McGovern, Ms. Moore, Mrs. Napolitano, Ms. Norton, Mr. O'Rourke, Mr. Peterson, Ms. Pingree, Mr. Pocan, Mr. Rangel, Mr. Rush, Ms. Sinema, Mr. Takai, and Mr. Van Hollen): H.R. 5165. A bill to amend the Family and Medical Leave Act of 1993 to provide a partial exemption to veterans from the eligibility requirements, and for other purposes; to the Committee on Education and the Workforce, and in addition to the Committees on Oversight and Government Reform, and House Administration, for a period to be subsequently determined by the Speaker, in each case for consideration of such provisions as fall within the jurisdiction of the committee concerned. By Mr. YOHO (for himself, Mr. Murphy of Florida, Mr. Rodney Davis of Illinois, Mr. Weber of Texas, Ms. Sinema, Mr. Collins of Georgia, Mr. Nugent, Mr. DeSantis, Mr. Meehan, Mr. Poe of Texas, Mr. Rothfus, Mrs. Kirkpatrick, Ms. Kaptur, Mr. Babin, Mr. Heck of Nevada, Mr. Sablan, Mr. Thompson of California, Mr. Rouzer, Mr. LaMalfa, Mr. Harper, Mr. Curbelo of Florida, Mrs. Wagner, [[Page H2155]] Mr. Williams, Mr. Jody B. Hice of Georgia, Mr. Pearce, Mr. Ruppersberger, Mr. DeSaulnier, Mr. Costa, Mr. Brat, Mr. Rooney of Florida, and Mr. Rangel): H.R. 5166. A bill to amend title 38, United States Code, to provide certain employees of Members of Congress and certain employees of State or local governmental agencies with access to case-tracking information of the Department of Veterans Affairs; to the Committee on Veterans' Affairs. By Mr. PAULSEN (for himself, Ms. McCollum, Mr. Nolan, and Mr. Ellison): H. Res. 718. A resolution honoring the 75th Anniversary of Flotilla 11-1, 8th District-Western Rivers Region, Coast Guard Auxiliary; to the Committee on Transportation and Infrastructure. ____________________",package_114_258.csv,2967,2967,3032,"[congressional record volume 162, number 69 (tuesday, may 3, 2016)] [house] [pages h2154-h2155] from the congressional record online through the government publishing office [ www.gpo.gov ] public bills and resolutions under clause 2 of rule xii, public bills and resolutions of the following titles were introduced and severally referred, as follows: by ms. jenkins of kansas (for herself, mr. loebsack, and mr. smith of nebraska): h.r. 5164. a bill to provide for a permanent extension of the enforcement instruction on supervision requirements for outpatient therapeutic services in critical access and small rural hospitals; to the committee on energy and commerce, and in addition to the committee on ways and means, for a period to be subsequently determined by the speaker, in each case for consideration of such provisions as fall within the jurisdiction of the committee concerned. by mr. delaney (for himself, ms. bordallo, ms. clarke of new york, mr. connolly, mr. conyers, mr. defazio, mr. desaulnier, ms. edwards, mr. garamendi, mr. gibson, mr. grayson, mr. grijalva, mr. hastings, mr. honda, mr. jones, mr. keating, mr. larson of connecticut, mrs. lawrence, ms. lee, mr. mcdermott, mr. mcgovern, ms. moore, mrs. napolitano, ms. norton, mr. o'rourke, mr. peterson, ms. pingree, mr. pocan, mr. rangel, mr. rush, ms. sinema, mr. takai, and mr. van hollen): h.r. 5165. a bill to amend the family and medical leave act of 1993 to provide a partial exemption to veterans from the eligibility requirements, and for other purposes; to the committee on education and the workforce, and in addition to the committees on oversight and government reform, and house administration, for a period to be subsequently determined by the speaker, in each case for consideration of such provisions as fall within the jurisdiction of the committee concerned. by mr. yoho (for himself, mr. murphy of florida, mr. rodney davis of illinois, mr. weber of texas, ms. sinema, mr. collins of georgia, mr. nugent, mr. desantis, mr. meehan, mr. poe of texas, mr. rothfus, mrs. kirkpatrick, ms. kaptur, mr. babin, mr. heck of nevada, mr. sablan, mr. thompson of california, mr. rouzer, mr. lamalfa, mr. harper, mr. curbelo of florida, mrs. wagner, [[page h2155]] mr. williams, mr. jody b. hice of georgia, mr. pearce, mr. ruppersberger, mr. desaulnier, mr. costa, mr. brat, mr. rooney of florida, and mr. rangel): h.r. 5166. a bill to amend title 38, united states code, to provide certain employees of members of congress and certain employees of state or local governmental agencies with access to case-tracking information of the department of veterans affairs; to the committee on veterans' affairs. by mr. paulsen (for himself, ms. mccollum, mr. nolan, and mr. ellison): h. res. 718. a resolution honoring the 75th anniversary of flotilla 11-1, 8th district-western rivers region, coast guard auxiliary; to the committee on transportation and infrastructure. ____________________",2967
CREC-2016-05-03-pt1-PgH2155-4,CREC-2016-05-03,114,Constitutional Authority Statement for H.R. 5165,"[Congressional Record Volume 162, Number 69 (Tuesday, May 3, 2016)] [House] [Page H2155] From the Congressional Record Online through the Government Publishing Office [ www.gpo.gov ] By Mr. DELANEY: H.R. 5165. Congress has the power to enact this legislation pursuant to the following: Article 1, Section 8 of the United States Constitution","[Congressional Record Volume 162, Number 69 (Tuesday, May 3, 2016)] [House] [Page H2155] From the Congressional Record Online through the Government Publishing Office [ www.gpo.gov ] By Mr. DELANEY: H.R. 5165. Congress has the power to enact this legislation pursuant to the following: Article 1, Section 8 of the United States Constitution","Congressional Record, Volume 162 Issue 69 (Tuesday, May 3, 2016) [Congressional Record Volume 162, Number 69 (Tuesday, May 3, 2016)] [House] [Page H2155] From the Congressional Record Online through the Government Publishing Office [ www.gpo.gov ] By Mr. DELANEY: H.R. 5165. Congress has the power to enact this legislation pursuant to the following: Article 1, Section 8 of the United States Constitution",package_114_258.csv,340,340,405,"[congressional record volume 162, number 69 (tuesday, may 3, 2016)] [house] [page h2155] from the congressional record online through the government publishing office [ www.gpo.gov ] by mr. delaney: h.r. 5165. congress has the power to enact this legislation pursuant to the following: article 1, section 8 of the united states constitution",340
CREC-2016-05-03-pt1-PgH2155-5,CREC-2016-05-03,114,Constitutional Authority Statement for H.R. 5166,"[Congressional Record Volume 162, Number 69 (Tuesday, May 3, 2016)] [House] [Page H2155] From the Congressional Record Online through the Government Publishing Office [ www.gpo.gov ] By Mr. YOHO: H.R. 5166. Congress has the power to enact this legislation pursuant to the following: Title I, Section 8 of the United States Constitution ____________________","[Congressional Record Volume 162, Number 69 (Tuesday, May 3, 2016)] [House] [Page H2155] From the Congressional Record Online through the Government Publishing Office [ www.gpo.gov ] By Mr. YOHO: H.R. 5166. Congress has the power to enact this legislation pursuant to the following: Title I, Section 8 of the United States Constitution ____________________","Congressional Record, Volume 162 Issue 69 (Tuesday, May 3, 2016) [Congressional Record Volume 162, Number 69 (Tuesday, May 3, 2016)] [House] [Page H2155] From the Congressional Record Online through the Government Publishing Office [ www.gpo.gov ] By Mr. YOHO: H.R. 5166. Congress has the power to enact this legislation pursuant to the following: Title I, Section 8 of the United States Constitution ____________________",package_114_258.csv,356,356,421,"[congressional record volume 162, number 69 (tuesday, may 3, 2016)] [house] [page h2155] from the congressional record online through the government publishing office [ www.gpo.gov ] by mr. yoho: h.r. 5166. congress has the power to enact this legislation pursuant to the following: title i, section 8 of the united states constitution ____________________",356
CREC-2016-05-03-pt1-PgH2155,CREC-2016-05-03,114,MEMORIALS,"[Congressional Record Volume 162, Number 69 (Tuesday, May 3, 2016)] [House] [Page H2155] From the Congressional Record Online through the Government Publishing Office [ www.gpo.gov ] MEMORIALS Under clause 3 of rule XII, memorials were presented and referred as follows: 214. The SPEAKER presented a memorial of the Legislature of the Territory of Guam, relative to Resolution No. 299-33 (COR), expressing I Liheslaturan Guahan's unequivocal support for H.R. 4345, cited as the National Community Service Improvement Act of 2015; to the Committee on Education and the Workforce. 215. Also, a memorial of the House of Representatives of the State of Michigan, relative to House Resolution No. 228, urging the United States Congress to enact legislation that will enhance hunting, fishing, recreational shooting, and other outdoor recreational opportunities for sportsmen and women nationwide; to the Committee on Natural Resources. ____________________","[Congressional Record Volume 162, Number 69 (Tuesday, May 3, 2016)] [House] [Page H2155] From the Congressional Record Online through the Government Publishing Office [ www.gpo.gov ] MEMORIALS Under clause 3 of rule XII, memorials were presented and referred as follows: 214. The SPEAKER presented a memorial of the Legislature of the Territory of Guam, relative to Resolution No. 299-33 (COR), expressing I Liheslaturan Guahan's unequivocal support for H.R. 4345, cited as the National Community Service Improvement Act of 2015; to the Committee on Education and the Workforce. 215. Also, a memorial of the House of Representatives of the State of Michigan, relative to House Resolution No. 228, urging the United States Congress to enact legislation that will enhance hunting, fishing, recreational shooting, and other outdoor recreational opportunities for sportsmen and women nationwide; to the Committee on Natural Resources. ____________________","Congressional Record, Volume 162 Issue 69 (Tuesday, May 3, 2016) [Congressional Record Volume 162, Number 69 (Tuesday, May 3, 2016)] [House] [Page H2155] From the Congressional Record Online through the Government Publishing Office [ www.gpo.gov ] MEMORIALS Under clause 3 of rule XII, memorials were presented and referred as follows: 214. The SPEAKER presented a memorial of the Legislature of the Territory of Guam, relative to Resolution No. 299-33 (COR), expressing I Liheslaturan Guahan's unequivocal support for H.R. 4345, cited as the National Community Service Improvement Act of 2015; to the Committee on Education and the Workforce. 215. Also, a memorial of the House of Representatives of the State of Michigan, relative to House Resolution No. 228, urging the United States Congress to enact legislation that will enhance hunting, fishing, recreational shooting, and other outdoor recreational opportunities for sportsmen and women nationwide; to the Committee on Natural Resources. ____________________",package_114_258.csv,951,951,1016,"[congressional record volume 162, number 69 (tuesday, may 3, 2016)] [house] [page h2155] from the congressional record online through the government publishing office [ www.gpo.gov ] memorials under clause 3 of rule xii, memorials were presented and referred as follows: 214. the speaker presented a memorial of the legislature of the territory of guam, relative to resolution no. 299-33 (cor), expressing i liheslaturan guahan's unequivocal support for h.r. 4345, cited as the national community service improvement act of 2015; to the committee on education and the workforce. 215. also, a memorial of the house of representatives of the state of michigan, relative to house resolution no. 228, urging the united states congress to enact legislation that will enhance hunting, fishing, recreational shooting, and other outdoor recreational opportunities for sportsmen and women nationwide; to the committee on natural resources. ____________________",951
CREC-2016-05-03-pt1-PgH2155-3,CREC-2016-05-03,114,Constitutional Authority Statement for H.R. 5164,"[Congressional Record Volume 162, Number 69 (Tuesday, May 3, 2016)] [House] [Page H2155] From the Congressional Record Online through the Government Publishing Office [ www.gpo.gov ] By Ms. JENKINS of Kansas: H.R. 5164. Congress has the power to enact this legislation pursuant to the following: Article 1, Section 8","[Congressional Record Volume 162, Number 69 (Tuesday, May 3, 2016)] [House] [Page H2155] From the Congressional Record Online through the Government Publishing Office [ www.gpo.gov ] By Ms. JENKINS of Kansas: H.R. 5164. Congress has the power to enact this legislation pursuant to the following: Article 1, Section 8","Congressional Record, Volume 162 Issue 69 (Tuesday, May 3, 2016) [Congressional Record Volume 162, Number 69 (Tuesday, May 3, 2016)] [House] [Page H2155] From the Congressional Record Online through the Government Publishing Office [ www.gpo.gov ] By Ms. JENKINS of Kansas: H.R. 5164. Congress has the power to enact this legislation pursuant to the following: Article 1, Section 8",package_114_258.csv,316,316,381,"[congressional record volume 162, number 69 (tuesday, may 3, 2016)] [house] [page h2155] from the congressional record online through the government publishing office [ www.gpo.gov ] by ms. jenkins of kansas: h.r. 5164. congress has the power to enact this legislation pursuant to the following: article 1, section 8",316
