granuleId,packageId,congress,title,parsed_text,text_readability,text_bs4,__source_file,parsed_text_len,text_readability_len,text_bs4_len,search_text,search_text_len
CREC-2015-02-20-pt1-PgE226-3,CREC-2015-02-20,114,IN HONOR OF JAMES ``JIM'' D. TACKETT,"[Congressional Record Volume 161, Number 29 (Friday, February 20, 2015)] [Extensions of Remarks] [Pages E226-E227] From the Congressional Record Online through the Government Publishing Office [ www.gpo.gov ] IN HONOR OF JAMES ``JIM'' D. TACKETT _____ HON. DOUG LAMBORN of colorado in the house of representatives Friday, February 20, 2015 Mr. LAMBORN. Mr. Speaker, Jim began his journey by enlisting and attending basic training December 1, 1972, assigned by the Army to a region in Alaska September of 1973, and left active duty December 22, 1978. Arriving in Colorado in 1983 with his wife and two sons, Jim dabbled in car sales. He joined the Colorado National Guard in 1987 and stayed in until his retirement in 2002. His adventures with the Department of Veterans Affairs began as a work-study student at Fort Carson in March 1986 and then hired by El Paso County February 22, 1988 as an Assistant Veteran Service Officer to assist veterans and surviving spouses with completing disability claims. During Jim's 27 years of service to veterans with the El Paso County Veteran Services, he received numerous awards for his outstanding efforts to serve local veterans and became a part of the community that he worked so tirelessly to help in any way he could. Jim has also been an invaluable advisor to me on all topics related to veterans' affairs. I greatly appreciated his service when he was a member of my Veterans Advisory Board for 8 years. In 1999, Jim collaborated with local veteran organizations to create the El Paso County Homeless Standdown Committee. He served on the standdown committee for 15 years and helped coordinate the annual Standdown event to assist homeless veterans. Since 2000 Jim has served as President of the Colorado Veterans Resource Coalition, a non-profit organization to assist with veterans' homeless issues, which is operated in collaboration with numerous other veteran service organizations. As part of this Coalition, Jim has provided executive oversight of the purchase and operation of the Crawford House, two transitional housing buildings, and an apartment complex, which provides services such as safe emergency housing for veterans who are homeless, receiving mental health care, and/or safe transitional low income housing. From 2003 to 2008, Jim served on the Executive Board and as the Vice President of the National Association of County Veteran Service Officers. During this time Jim ensured numerous Colorado County Veteran Service Officers were accredited through the National organization. Jim played a critical role in the planning of the new national cemetery in southern Colorado. In 2006, Jim was appointed to the Pikes Peak National Veterans Cemetery Committee and has been instrumental in the upcoming construction of a Veterans Cemetery in El Paso County that is anticipated to be open in 2018. Jim also served on a joint committee to name the new Colorado Springs VA Clinic. Jim was appointed as the El Paso County Veteran Service Officer in 2008, and immediately began an expanded outreach program to ensure El Paso County veterans are aware of local veteran services and programs. Since this program, the Veteran Service Office has almost doubled the yearly office visits which has resulted in a 190 percent increase in the number of claims for veterans and their dependents, and has made the El Paso County Veteran Services Office one of the most active offices in the United States. In 2014, Jim served on my Veteran Affairs Clinic Naming Committee which honored our local hometown hero, WWII Medal of Honor recipient, PFC Floyd Lindstrom. He also served on the clinic's Grand Opening Committee to open one of the largest VA Community-Based Outpatient Clinics in the United States. During this year, Jim also coordinated with Home Depot to construct a Veterans Memorial at Bear Creek Regional Park that honors El Paso County Veterans and their outstanding service. Jim is one of the most intelligent, highly respected and dependable service officers in the great state of Colorado. He has given every bit of his heart and soul to the Pikes Peak community and he remains one of the most influential community leaders. I am very proud [[Page E227]] and grateful for his selfless service to the veterans in Colorado's 5th Congressional District. ____________________","[Congressional Record Volume 161, Number 29 (Friday, February 20, 2015)] [Extensions of Remarks] [Pages E226-E227] From the Congressional Record Online through the Government Publishing Office [ www.gpo.gov ] IN HONOR OF JAMES ``JIM'' D. TACKETT _____ HON. DOUG LAMBORN of colorado in the house of representatives Friday, February 20, 2015 Mr. LAMBORN. Mr. Speaker, Jim began his journey by enlisting and attending basic training December 1, 1972, assigned by the Army to a region in Alaska September of 1973, and left active duty December 22, 1978. Arriving in Colorado in 1983 with his wife and two sons, Jim dabbled in car sales. He joined the Colorado National Guard in 1987 and stayed in until his retirement in 2002. His adventures with the Department of Veterans Affairs began as a work-study student at Fort Carson in March 1986 and then hired by El Paso County February 22, 1988 as an Assistant Veteran Service Officer to assist veterans and surviving spouses with completing disability claims. During Jim's 27 years of service to veterans with the El Paso County Veteran Services, he received numerous awards for his outstanding efforts to serve local veterans and became a part of the community that he worked so tirelessly to help in any way he could. Jim has also been an invaluable advisor to me on all topics related to veterans' affairs. I greatly appreciated his service when he was a member of my Veterans Advisory Board for 8 years. In 1999, Jim collaborated with local veteran organizations to create the El Paso County Homeless Standdown Committee. He served on the standdown committee for 15 years and helped coordinate the annual Standdown event to assist homeless veterans. Since 2000 Jim has served as President of the Colorado Veterans Resource Coalition, a non-profit organization to assist with veterans' homeless issues, which is operated in collaboration with numerous other veteran service organizations. As part of this Coalition, Jim has provided executive oversight of the purchase and operation of the Crawford House, two transitional housing buildings, and an apartment complex, which provides services such as safe emergency housing for veterans who are homeless, receiving mental health care, and/or safe transitional low income housing. From 2003 to 2008, Jim served on the Executive Board and as the Vice President of the National Association of County Veteran Service Officers. During this time Jim ensured numerous Colorado County Veteran Service Officers were accredited through the National organization. Jim played a critical role in the planning of the new national cemetery in southern Colorado. In 2006, Jim was appointed to the Pikes Peak National Veterans Cemetery Committee and has been instrumental in the upcoming construction of a Veterans Cemetery in El Paso County that is anticipated to be open in 2018. Jim also served on a joint committee to name the new Colorado Springs VA Clinic. Jim was appointed as the El Paso County Veteran Service Officer in 2008, and immediately began an expanded outreach program to ensure El Paso County veterans are aware of local veteran services and programs. Since this program, the Veteran Service Office has almost doubled the yearly office visits which has resulted in a 190 percent increase in the number of claims for veterans and their dependents, and has made the El Paso County Veteran Services Office one of the most active offices in the United States. In 2014, Jim served on my Veteran Affairs Clinic Naming Committee which honored our local hometown hero, WWII Medal of Honor recipient, PFC Floyd Lindstrom. He also served on the clinic's Grand Opening Committee to open one of the largest VA Community-Based Outpatient Clinics in the United States. During this year, Jim also coordinated with Home Depot to construct a Veterans Memorial at Bear Creek Regional Park that honors El Paso County Veterans and their outstanding service. Jim is one of the most intelligent, highly respected and dependable service officers in the great state of Colorado. He has given every bit of his heart and soul to the Pikes Peak community and he remains one of the most influential community leaders. I am very proud [[Page E227]] and grateful for his selfless service to the veterans in Colorado's 5th Congressional District. ____________________","Congressional Record, Volume 161 Issue 29 (Friday, February 20, 2015) [Congressional Record Volume 161, Number 29 (Friday, February 20, 2015)] [Extensions of Remarks] [Pages E226-E227] From the Congressional Record Online through the Government Publishing Office [ www.gpo.gov ] IN HONOR OF JAMES ``JIM'' D. TACKETT _____ HON. DOUG LAMBORN of colorado in the house of representatives Friday, February 20, 2015 Mr. LAMBORN. Mr. Speaker, Jim began his journey by enlisting and attending basic training December 1, 1972, assigned by the Army to a region in Alaska September of 1973, and left active duty December 22, 1978. Arriving in Colorado in 1983 with his wife and two sons, Jim dabbled in car sales. He joined the Colorado National Guard in 1987 and stayed in until his retirement in 2002. His adventures with the Department of Veterans Affairs began as a work-study student at Fort Carson in March 1986 and then hired by El Paso County February 22, 1988 as an Assistant Veteran Service Officer to assist veterans and surviving spouses with completing disability claims. During Jim's 27 years of service to veterans with the El Paso County Veteran Services, he received numerous awards for his outstanding efforts to serve local veterans and became a part of the community that he worked so tirelessly to help in any way he could. Jim has also been an invaluable advisor to me on all topics related to veterans' affairs. I greatly appreciated his service when he was a member of my Veterans Advisory Board for 8 years. In 1999, Jim collaborated with local veteran organizations to create the El Paso County Homeless Standdown Committee. He served on the standdown committee for 15 years and helped coordinate the annual Standdown event to assist homeless veterans. Since 2000 Jim has served as President of the Colorado Veterans Resource Coalition, a non-profit organization to assist with veterans' homeless issues, which is operated in collaboration with numerous other veteran service organizations. As part of this Coalition, Jim has provided executive oversight of the purchase and operation of the Crawford House, two transitional housing buildings, and an apartment complex, which provides services such as safe emergency housing for veterans who are homeless, receiving mental health care, and/or safe transitional low income housing. From 2003 to 2008, Jim served on the Executive Board and as the Vice President of the National Association of County Veteran Service Officers. During this time Jim ensured numerous Colorado County Veteran Service Officers were accredited through the National organization. Jim played a critical role in the planning of the new national cemetery in southern Colorado. In 2006, Jim was appointed to the Pikes Peak National Veterans Cemetery Committee and has been instrumental in the upcoming construction of a Veterans Cemetery in El Paso County that is anticipated to be open in 2018. Jim also served on a joint committee to name the new Colorado Springs VA Clinic. Jim was appointed as the El Paso County Veteran Service Officer in 2008, and immediately began an expanded outreach program to ensure El Paso County veterans are aware of local veteran services and programs. Since this program, the Veteran Service Office has almost doubled the yearly office visits which has resulted in a 190 percent increase in the number of claims for veterans and their dependents, and has made the El Paso County Veteran Services Office one of the most active offices in the United States. In 2014, Jim served on my Veteran Affairs Clinic Naming Committee which honored our local hometown hero, WWII Medal of Honor recipient, PFC Floyd Lindstrom. He also served on the clinic's Grand Opening Committee to open one of the largest VA Community-Based Outpatient Clinics in the United States. During this year, Jim also coordinated with Home Depot to construct a Veterans Memorial at Bear Creek Regional Park that honors El Paso County Veterans and their outstanding service. Jim is one of the most intelligent, highly respected and dependable service officers in the great state of Colorado. He has given every bit of his heart and soul to the Pikes Peak community and he remains one of the most influential community leaders. I am very proud [[Page E227]] and grateful for his selfless service to the veterans in Colorado's 5th Congressional District. ____________________",package_114_267.csv,4334,4334,4404,"[congressional record volume 161, number 29 (friday, february 20, 2015)] [extensions of remarks] [pages e226-e227] from the congressional record online through the government publishing office [ www.gpo.gov ] in honor of james ``jim'' d. tackett _____ hon. doug lamborn of colorado in the house of representatives friday, february 20, 2015 mr. lamborn. mr. speaker, jim began his journey by enlisting and attending basic training december 1, 1972, assigned by the army to a region in alaska september of 1973, and left active duty december 22, 1978. arriving in colorado in 1983 with his wife and two sons, jim dabbled in car sales. he joined the colorado national guard in 1987 and stayed in until his retirement in 2002. his adventures with the department of veterans affairs began as a work-study student at fort carson in march 1986 and then hired by el paso county february 22, 1988 as an assistant veteran service officer to assist veterans and surviving spouses with completing disability claims. during jim's 27 years of service to veterans with the el paso county veteran services, he received numerous awards for his outstanding efforts to serve local veterans and became a part of the community that he worked so tirelessly to help in any way he could. jim has also been an invaluable advisor to me on all topics related to veterans' affairs. i greatly appreciated his service when he was a member of my veterans advisory board for 8 years. in 1999, jim collaborated with local veteran organizations to create the el paso county homeless standdown committee. he served on the standdown committee for 15 years and helped coordinate the annual standdown event to assist homeless veterans. since 2000 jim has served as president of the colorado veterans resource coalition, a non-profit organization to assist with veterans' homeless issues, which is operated in collaboration with numerous other veteran service organizations. as part of this coalition, jim has provided executive oversight of the purchase and operation of the crawford house, two transitional housing buildings, and an apartment complex, which provides services such as safe emergency housing for veterans who are homeless, receiving mental health care, and/or safe transitional low income housing. from 2003 to 2008, jim served on the executive board and as the vice president of the national association of county veteran service officers. during this time jim ensured numerous colorado county veteran service officers were accredited through the national organization. jim played a critical role in the planning of the new national cemetery in southern colorado. in 2006, jim was appointed to the pikes peak national veterans cemetery committee and has been instrumental in the upcoming construction of a veterans cemetery in el paso county that is anticipated to be open in 2018. jim also served on a joint committee to name the new colorado springs va clinic. jim was appointed as the el paso county veteran service officer in 2008, and immediately began an expanded outreach program to ensure el paso county veterans are aware of local veteran services and programs. since this program, the veteran service office has almost doubled the yearly office visits which has resulted in a 190 percent increase in the number of claims for veterans and their dependents, and has made the el paso county veteran services office one of the most active offices in the united states. in 2014, jim served on my veteran affairs clinic naming committee which honored our local hometown hero, wwii medal of honor recipient, pfc floyd lindstrom. he also served on the clinic's grand opening committee to open one of the largest va community-based outpatient clinics in the united states. during this year, jim also coordinated with home depot to construct a veterans memorial at bear creek regional park that honors el paso county veterans and their outstanding service. jim is one of the most intelligent, highly respected and dependable service officers in the great state of colorado. he has given every bit of his heart and soul to the pikes peak community and he remains one of the most influential community leaders. i am very proud [[page e227]] and grateful for his selfless service to the veterans in colorado's 5th congressional district. ____________________",4334
CREC-2015-02-20-pt1-PgD155-2,CREC-2015-02-20,114,Daily Digest/Senate Committee Meetings,"[Congressional Record Volume 161, Number 29 (Friday, February 20, 2015)] [Daily Digest] [Page D155] From the Congressional Record Online through the Government Publishing Office [ www.gpo.gov ] Committee Meetings No committee meetings were held.","[Congressional Record Volume 161, Number 29 (Friday, February 20, 2015)] [Daily Digest] [Page D155] From the Congressional Record Online through the Government Publishing Office [ www.gpo.gov ] Committee Meetings No committee meetings were held.","Congressional Record, Volume 161 Issue 29 (Friday, February 20, 2015) [Congressional Record Volume 161, Number 29 (Friday, February 20, 2015)] [Daily Digest] [Page D155] From the Congressional Record Online through the Government Publishing Office [ www.gpo.gov ] Committee Meetings No committee meetings were held.",package_114_267.csv,245,245,315,"[congressional record volume 161, number 29 (friday, february 20, 2015)] [daily digest] [page d155] from the congressional record online through the government publishing office [ www.gpo.gov ] committee meetings no committee meetings were held.",245
CREC-2015-02-20-pt1-PgD155,CREC-2015-02-20,114,Daily Digest/Senate,"[Congressional Record Volume 161, Number 29 (Friday, February 20, 2015)] [Daily Digest] [Page D155] From the Congressional Record Online through the Government Publishing Office [ www.gpo.gov ] Friday, February 20, 2015 [[Page D155]] Daily Digest Senate Chamber Action The Senate was not in session and stands adjourned until 3 p.m., on Monday, February 23, 2015.","[Congressional Record Volume 161, Number 29 (Friday, February 20, 2015)] [Daily Digest] [Page D155] From the Congressional Record Online through the Government Publishing Office [ www.gpo.gov ] Friday, February 20, 2015 [[Page D155]] Daily Digest Senate Chamber Action The Senate was not in session and stands adjourned until 3 p.m., on Monday, February 23, 2015.","Congressional Record, Volume 161 Issue 29 (Friday, February 20, 2015) [Congressional Record Volume 161, Number 29 (Friday, February 20, 2015)] [Daily Digest] [Page D155] From the Congressional Record Online through the Government Publishing Office [ www.gpo.gov ] Friday, February 20, 2015 [[Page D155]] Daily Digest Senate Chamber Action The Senate was not in session and stands adjourned until 3 p.m., on Monday, February 23, 2015.",package_114_267.csv,363,363,433,"[congressional record volume 161, number 29 (friday, february 20, 2015)] [daily digest] [page d155] from the congressional record online through the government publishing office [ www.gpo.gov ] friday, february 20, 2015 [[page d155]] daily digest senate chamber action the senate was not in session and stands adjourned until 3 p.m., on monday, february 23, 2015.",363
