granuleId,packageId,congress,title,parsed_text,text_readability,text_bs4,__source_file,parsed_text_len,text_readability_len,text_bs4_len,search_text,search_text_len
CREC-2015-02-20-pt1-PgH1084,CREC-2015-02-20,114,PUBLIC BILLS AND RESOLUTIONS,"[Congressional Record Volume 161, Number 29 (Friday, February 20, 2015)] [House] [Page H1084] From the Congressional Record Online through the Government Publishing Office [ www.gpo.gov ] PUBLIC BILLS AND RESOLUTIONS Under clause 2 of rule XII, public bills and resolutions of the following titles were introduced and severally referred, as follows: By Mr. POLIS (for himself, Mr. Blumenauer, Mr. Pocan, Mr. Swalwell of California, Ms. Norton, Mr. Cohen, Mr. Lowenthal, Mr. Capuano, Mr. Honda, Mr. Rohrabacher, Ms. Pingree, and Ms. Lee): H.R. 1013. A bill to decriminalize marijuana at the Federal level, to leave to the States a power to regulate marijuana that is similar to the power they have to regulate alcohol, and for other purposes; to the Committee on the Judiciary, and in addition to the Committees on Energy and Commerce, Ways and Means, Natural Resources, and Agriculture, for a period to be subsequently determined by the Speaker, in each case for consideration of such provisions as fall within the jurisdiction of the committee concerned. By Mr. BLUMENAUER (for himself, Mr. Polis, Mr. Swalwell of California, Ms. Lee, Mr. Pocan, Mr. Cohen, Ms. Norton, and Ms. Pingree): H.R. 1014. A bill to amend the Internal Revenue Code of 1986 to provide for the taxation of marijuana, and for other purposes; to the Committee on Ways and Means. By Mr. HUELSKAMP: H.R. 1015. A bill to amend title 38, United States Code, to improve the oversight of contracts awarded by the Secretary of Veterans Affairs to small business concerns owned and controlled by veterans; to the Committee on Veterans' Affairs. By Mr. ROE of Tennessee: H.R. 1016. A bill to amend title 38, United States Code, to direct the Secretary of Veterans Affairs to adopt and implement a standard identification protocol for use in the tracking and procurement of biological implants by the Department of Veterans Affairs, and for other purposes; to the Committee on Veterans' Affairs. By Mrs. WALORSKI: H.R. 1017. A bill to improve the information security of the Department of Veterans Affairs by directing the Secretary of Veterans Affairs to carry out certain actions to improve the transparency and the governance of the information security program of the Department, and for other purposes; to the Committee on Veterans' Affairs. By Mrs. ELLMERS of North Carolina (for herself, Mr. Butterfield, and Mrs. Blackburn): H.R. 1018. A bill to amend title XVIII of the Social Security Act to provide coverage of certain disposable medical technologies under the Medicare program, and for other purposes; to the Committee on Energy and Commerce, and in addition to the Committee on Ways and Means, for a period to be subsequently determined by the Speaker, in each case for consideration of such provisions as fall within the jurisdiction of the committee concerned. By Mr. ROSKAM (for himself, Mr. Connolly, Mr. Franks of Arizona, Mr. Westmoreland, Mr. Holding, Ms. Bordallo, Mr. Farenthold, Mr. Schiff, Mr. Takano, Ms. Meng, Mr. Lowenthal, Mr. Beyer, Mr. Cole, Mr. Honda, Mr. Engel, Mr. Van Hollen, Mr. Collins of Georgia, Mr. Himes, Mr. Royce, and Mr. Smith of Washington): H.R. 1019. A bill to provide high-skilled visas for nationals of the Republic of Korea, and for other purposes; to the Committee on the Judiciary. By Mr. SMITH of Texas (for himself, Ms. Esty, Mrs. Comstock, Mr. Lipinski, Mr. Moolenaar, Mr. Hultgren, Mr. Bucshon, and Mr. Collins of New York): H.R. 1020. A bill to define STEM education to include computer science, and to support existing STEM education programs at the National Science Foundation; to the Committee on Science, Space, and Technology. By Mr. LIPINSKI (for himself, Mr. Collins of New York, Mr. Loebsack, Mr. Rangel, Ms. Edwards, Mr. Tonko, Mr. Pocan, Mr. Caardenas, Mr. McKinley, Ms. Esty, Mr. Kennedy, Mr. Rush, Mr. Peters, Mr. Honda, Ms. Bordallo, and Mr. Garamendi): H. Res. 119. A resolution supporting the goals and ideals of Engineers Week; to the Committee on Science, Space, and Technology, and in addition to the Committee on Education and the Workforce, for a period to be subsequently determined by the Speaker, in each case for consideration of such provisions as fall within the jurisdiction of the committee concerned. ____________________","[Congressional Record Volume 161, Number 29 (Friday, February 20, 2015)] [House] [Page H1084] From the Congressional Record Online through the Government Publishing Office [ www.gpo.gov ] PUBLIC BILLS AND RESOLUTIONS Under clause 2 of rule XII, public bills and resolutions of the following titles were introduced and severally referred, as follows: By Mr. POLIS (for himself, Mr. Blumenauer, Mr. Pocan, Mr. Swalwell of California, Ms. Norton, Mr. Cohen, Mr. Lowenthal, Mr. Capuano, Mr. Honda, Mr. Rohrabacher, Ms. Pingree, and Ms. Lee): H.R. 1013. A bill to decriminalize marijuana at the Federal level, to leave to the States a power to regulate marijuana that is similar to the power they have to regulate alcohol, and for other purposes; to the Committee on the Judiciary, and in addition to the Committees on Energy and Commerce, Ways and Means, Natural Resources, and Agriculture, for a period to be subsequently determined by the Speaker, in each case for consideration of such provisions as fall within the jurisdiction of the committee concerned. By Mr. BLUMENAUER (for himself, Mr. Polis, Mr. Swalwell of California, Ms. Lee, Mr. Pocan, Mr. Cohen, Ms. Norton, and Ms. Pingree): H.R. 1014. A bill to amend the Internal Revenue Code of 1986 to provide for the taxation of marijuana, and for other purposes; to the Committee on Ways and Means. By Mr. HUELSKAMP: H.R. 1015. A bill to amend title 38, United States Code, to improve the oversight of contracts awarded by the Secretary of Veterans Affairs to small business concerns owned and controlled by veterans; to the Committee on Veterans' Affairs. By Mr. ROE of Tennessee: H.R. 1016. A bill to amend title 38, United States Code, to direct the Secretary of Veterans Affairs to adopt and implement a standard identification protocol for use in the tracking and procurement of biological implants by the Department of Veterans Affairs, and for other purposes; to the Committee on Veterans' Affairs. By Mrs. WALORSKI: H.R. 1017. A bill to improve the information security of the Department of Veterans Affairs by directing the Secretary of Veterans Affairs to carry out certain actions to improve the transparency and the governance of the information security program of the Department, and for other purposes; to the Committee on Veterans' Affairs. By Mrs. ELLMERS of North Carolina (for herself, Mr. Butterfield, and Mrs. Blackburn): H.R. 1018. A bill to amend title XVIII of the Social Security Act to provide coverage of certain disposable medical technologies under the Medicare program, and for other purposes; to the Committee on Energy and Commerce, and in addition to the Committee on Ways and Means, for a period to be subsequently determined by the Speaker, in each case for consideration of such provisions as fall within the jurisdiction of the committee concerned. By Mr. ROSKAM (for himself, Mr. Connolly, Mr. Franks of Arizona, Mr. Westmoreland, Mr. Holding, Ms. Bordallo, Mr. Farenthold, Mr. Schiff, Mr. Takano, Ms. Meng, Mr. Lowenthal, Mr. Beyer, Mr. Cole, Mr. Honda, Mr. Engel, Mr. Van Hollen, Mr. Collins of Georgia, Mr. Himes, Mr. Royce, and Mr. Smith of Washington): H.R. 1019. A bill to provide high-skilled visas for nationals of the Republic of Korea, and for other purposes; to the Committee on the Judiciary. By Mr. SMITH of Texas (for himself, Ms. Esty, Mrs. Comstock, Mr. Lipinski, Mr. Moolenaar, Mr. Hultgren, Mr. Bucshon, and Mr. Collins of New York): H.R. 1020. A bill to define STEM education to include computer science, and to support existing STEM education programs at the National Science Foundation; to the Committee on Science, Space, and Technology. By Mr. LIPINSKI (for himself, Mr. Collins of New York, Mr. Loebsack, Mr. Rangel, Ms. Edwards, Mr. Tonko, Mr. Pocan, Mr. Caardenas, Mr. McKinley, Ms. Esty, Mr. Kennedy, Mr. Rush, Mr. Peters, Mr. Honda, Ms. Bordallo, and Mr. Garamendi): H. Res. 119. A resolution supporting the goals and ideals of Engineers Week; to the Committee on Science, Space, and Technology, and in addition to the Committee on Education and the Workforce, for a period to be subsequently determined by the Speaker, in each case for consideration of such provisions as fall within the jurisdiction of the committee concerned. ____________________","Congressional Record, Volume 161 Issue 29 (Friday, February 20, 2015) [Congressional Record Volume 161, Number 29 (Friday, February 20, 2015)] [House] [Page H1084] From the Congressional Record Online through the Government Publishing Office [ www.gpo.gov ] PUBLIC BILLS AND RESOLUTIONS Under clause 2 of rule XII, public bills and resolutions of the following titles were introduced and severally referred, as follows: By Mr. POLIS (for himself, Mr. Blumenauer, Mr. Pocan, Mr. Swalwell of California, Ms. Norton, Mr. Cohen, Mr. Lowenthal, Mr. Capuano, Mr. Honda, Mr. Rohrabacher, Ms. Pingree, and Ms. Lee): H.R. 1013. A bill to decriminalize marijuana at the Federal level, to leave to the States a power to regulate marijuana that is similar to the power they have to regulate alcohol, and for other purposes; to the Committee on the Judiciary, and in addition to the Committees on Energy and Commerce, Ways and Means, Natural Resources, and Agriculture, for a period to be subsequently determined by the Speaker, in each case for consideration of such provisions as fall within the jurisdiction of the committee concerned. By Mr. BLUMENAUER (for himself, Mr. Polis, Mr. Swalwell of California, Ms. Lee, Mr. Pocan, Mr. Cohen, Ms. Norton, and Ms. Pingree): H.R. 1014. A bill to amend the Internal Revenue Code of 1986 to provide for the taxation of marijuana, and for other purposes; to the Committee on Ways and Means. By Mr. HUELSKAMP: H.R. 1015. A bill to amend title 38, United States Code, to improve the oversight of contracts awarded by the Secretary of Veterans Affairs to small business concerns owned and controlled by veterans; to the Committee on Veterans' Affairs. By Mr. ROE of Tennessee: H.R. 1016. A bill to amend title 38, United States Code, to direct the Secretary of Veterans Affairs to adopt and implement a standard identification protocol for use in the tracking and procurement of biological implants by the Department of Veterans Affairs, and for other purposes; to the Committee on Veterans' Affairs. By Mrs. WALORSKI: H.R. 1017. A bill to improve the information security of the Department of Veterans Affairs by directing the Secretary of Veterans Affairs to carry out certain actions to improve the transparency and the governance of the information security program of the Department, and for other purposes; to the Committee on Veterans' Affairs. By Mrs. ELLMERS of North Carolina (for herself, Mr. Butterfield, and Mrs. Blackburn): H.R. 1018. A bill to amend title XVIII of the Social Security Act to provide coverage of certain disposable medical technologies under the Medicare program, and for other purposes; to the Committee on Energy and Commerce, and in addition to the Committee on Ways and Means, for a period to be subsequently determined by the Speaker, in each case for consideration of such provisions as fall within the jurisdiction of the committee concerned. By Mr. ROSKAM (for himself, Mr. Connolly, Mr. Franks of Arizona, Mr. Westmoreland, Mr. Holding, Ms. Bordallo, Mr. Farenthold, Mr. Schiff, Mr. Takano, Ms. Meng, Mr. Lowenthal, Mr. Beyer, Mr. Cole, Mr. Honda, Mr. Engel, Mr. Van Hollen, Mr. Collins of Georgia, Mr. Himes, Mr. Royce, and Mr. Smith of Washington): H.R. 1019. A bill to provide high-skilled visas for nationals of the Republic of Korea, and for other purposes; to the Committee on the Judiciary. By Mr. SMITH of Texas (for himself, Ms. Esty, Mrs. Comstock, Mr. Lipinski, Mr. Moolenaar, Mr. Hultgren, Mr. Bucshon, and Mr. Collins of New York): H.R. 1020. A bill to define STEM education to include computer science, and to support existing STEM education programs at the National Science Foundation; to the Committee on Science, Space, and Technology. By Mr. LIPINSKI (for himself, Mr. Collins of New York, Mr. Loebsack, Mr. Rangel, Ms. Edwards, Mr. Tonko, Mr. Pocan, Mr. Caardenas, Mr. McKinley, Ms. Esty, Mr. Kennedy, Mr. Rush, Mr. Peters, Mr. Honda, Ms. Bordallo, and Mr. Garamendi): H. Res. 119. A resolution supporting the goals and ideals of Engineers Week; to the Committee on Science, Space, and Technology, and in addition to the Committee on Education and the Workforce, for a period to be subsequently determined by the Speaker, in each case for consideration of such provisions as fall within the jurisdiction of the committee concerned. ____________________",package_114_267.csv,4268,4268,4338,"[congressional record volume 161, number 29 (friday, february 20, 2015)] [house] [page h1084] from the congressional record online through the government publishing office [ www.gpo.gov ] public bills and resolutions under clause 2 of rule xii, public bills and resolutions of the following titles were introduced and severally referred, as follows: by mr. polis (for himself, mr. blumenauer, mr. pocan, mr. swalwell of california, ms. norton, mr. cohen, mr. lowenthal, mr. capuano, mr. honda, mr. rohrabacher, ms. pingree, and ms. lee): h.r. 1013. a bill to decriminalize marijuana at the federal level, to leave to the states a power to regulate marijuana that is similar to the power they have to regulate alcohol, and for other purposes; to the committee on the judiciary, and in addition to the committees on energy and commerce, ways and means, natural resources, and agriculture, for a period to be subsequently determined by the speaker, in each case for consideration of such provisions as fall within the jurisdiction of the committee concerned. by mr. blumenauer (for himself, mr. polis, mr. swalwell of california, ms. lee, mr. pocan, mr. cohen, ms. norton, and ms. pingree): h.r. 1014. a bill to amend the internal revenue code of 1986 to provide for the taxation of marijuana, and for other purposes; to the committee on ways and means. by mr. huelskamp: h.r. 1015. a bill to amend title 38, united states code, to improve the oversight of contracts awarded by the secretary of veterans affairs to small business concerns owned and controlled by veterans; to the committee on veterans' affairs. by mr. roe of tennessee: h.r. 1016. a bill to amend title 38, united states code, to direct the secretary of veterans affairs to adopt and implement a standard identification protocol for use in the tracking and procurement of biological implants by the department of veterans affairs, and for other purposes; to the committee on veterans' affairs. by mrs. walorski: h.r. 1017. a bill to improve the information security of the department of veterans affairs by directing the secretary of veterans affairs to carry out certain actions to improve the transparency and the governance of the information security program of the department, and for other purposes; to the committee on veterans' affairs. by mrs. ellmers of north carolina (for herself, mr. butterfield, and mrs. blackburn): h.r. 1018. a bill to amend title xviii of the social security act to provide coverage of certain disposable medical technologies under the medicare program, and for other purposes; to the committee on energy and commerce, and in addition to the committee on ways and means, for a period to be subsequently determined by the speaker, in each case for consideration of such provisions as fall within the jurisdiction of the committee concerned. by mr. roskam (for himself, mr. connolly, mr. franks of arizona, mr. westmoreland, mr. holding, ms. bordallo, mr. farenthold, mr. schiff, mr. takano, ms. meng, mr. lowenthal, mr. beyer, mr. cole, mr. honda, mr. engel, mr. van hollen, mr. collins of georgia, mr. himes, mr. royce, and mr. smith of washington): h.r. 1019. a bill to provide high-skilled visas for nationals of the republic of korea, and for other purposes; to the committee on the judiciary. by mr. smith of texas (for himself, ms. esty, mrs. comstock, mr. lipinski, mr. moolenaar, mr. hultgren, mr. bucshon, and mr. collins of new york): h.r. 1020. a bill to define stem education to include computer science, and to support existing stem education programs at the national science foundation; to the committee on science, space, and technology. by mr. lipinski (for himself, mr. collins of new york, mr. loebsack, mr. rangel, ms. edwards, mr. tonko, mr. pocan, mr. caardenas, mr. mckinley, ms. esty, mr. kennedy, mr. rush, mr. peters, mr. honda, ms. bordallo, and mr. garamendi): h. res. 119. a resolution supporting the goals and ideals of engineers week; to the committee on science, space, and technology, and in addition to the committee on education and the workforce, for a period to be subsequently determined by the speaker, in each case for consideration of such provisions as fall within the jurisdiction of the committee concerned. ____________________",4268
CREC-2015-02-20-pt1-PgH1084-6,CREC-2015-02-20,114,Constitutional Authority Statement for H.R. 1016,"[Congressional Record Volume 161, Number 29 (Friday, February 20, 2015)] [House] [Page H1084] From the Congressional Record Online through the Government Publishing Office [ www.gpo.gov ] By Mr. ROE of Tennessee: H.R. 1016. Congress has the power to enact this legislation pursuant to the following: Article 1, Section 8 of the United States Constitution.","[Congressional Record Volume 161, Number 29 (Friday, February 20, 2015)] [House] [Page H1084] From the Congressional Record Online through the Government Publishing Office [ www.gpo.gov ] By Mr. ROE of Tennessee: H.R. 1016. Congress has the power to enact this legislation pursuant to the following: Article 1, Section 8 of the United States Constitution.","Congressional Record, Volume 161 Issue 29 (Friday, February 20, 2015) [Congressional Record Volume 161, Number 29 (Friday, February 20, 2015)] [House] [Page H1084] From the Congressional Record Online through the Government Publishing Office [ www.gpo.gov ] By Mr. ROE of Tennessee: H.R. 1016. Congress has the power to enact this legislation pursuant to the following: Article 1, Section 8 of the United States Constitution.",package_114_267.csv,355,355,425,"[congressional record volume 161, number 29 (friday, february 20, 2015)] [house] [page h1084] from the congressional record online through the government publishing office [ www.gpo.gov ] by mr. roe of tennessee: h.r. 1016. congress has the power to enact this legislation pursuant to the following: article 1, section 8 of the united states constitution.",355
CREC-2015-02-20-pt1-PgH1084-2,CREC-2015-02-20,114,Constitutional Authority Statement,"[Congressional Record Volume 161, Number 29 (Friday, February 20, 2015)] [House] [Page H1084] From the Congressional Record Online through the Government Publishing Office [ www.gpo.gov ] CONSTITUTIONAL AUTHORITY STATEMENT Pursuant to clause 7 of rule XII of the Rules of the House of Representatives, the following statements are submitted regarding the specific powers granted to Congress in the Constitution to enact the accompanying bill or joint resolution.","[Congressional Record Volume 161, Number 29 (Friday, February 20, 2015)] [House] [Page H1084] From the Congressional Record Online through the Government Publishing Office [ www.gpo.gov ] CONSTITUTIONAL AUTHORITY STATEMENT Pursuant to clause 7 of rule XII of the Rules of the House of Representatives, the following statements are submitted regarding the specific powers granted to Congress in the Constitution to enact the accompanying bill or joint resolution.","Congressional Record, Volume 161 Issue 29 (Friday, February 20, 2015) [Congressional Record Volume 161, Number 29 (Friday, February 20, 2015)] [House] [Page H1084] From the Congressional Record Online through the Government Publishing Office [ www.gpo.gov ] CONSTITUTIONAL AUTHORITY STATEMENT Pursuant to clause 7 of rule XII of the Rules of the House of Representatives, the following statements are submitted regarding the specific powers granted to Congress in the Constitution to enact the accompanying bill or joint resolution.",package_114_267.csv,462,462,532,"[congressional record volume 161, number 29 (friday, february 20, 2015)] [house] [page h1084] from the congressional record online through the government publishing office [ www.gpo.gov ] constitutional authority statement pursuant to clause 7 of rule xii of the rules of the house of representatives, the following statements are submitted regarding the specific powers granted to congress in the constitution to enact the accompanying bill or joint resolution.",462
CREC-2015-02-20-pt1-PgH1084-5,CREC-2015-02-20,114,Constitutional Authority Statement for H.R. 1015,"[Congressional Record Volume 161, Number 29 (Friday, February 20, 2015)] [House] [Page H1084] From the Congressional Record Online through the Government Publishing Office [ www.gpo.gov ] By Mr. HUELSKAMP: H.R. 1015. Congress has the power to enact this legislation pursuant to the following: Article 1, Section 8 of the United States Constitution.","[Congressional Record Volume 161, Number 29 (Friday, February 20, 2015)] [House] [Page H1084] From the Congressional Record Online through the Government Publishing Office [ www.gpo.gov ] By Mr. HUELSKAMP: H.R. 1015. Congress has the power to enact this legislation pursuant to the following: Article 1, Section 8 of the United States Constitution.","Congressional Record, Volume 161 Issue 29 (Friday, February 20, 2015) [Congressional Record Volume 161, Number 29 (Friday, February 20, 2015)] [House] [Page H1084] From the Congressional Record Online through the Government Publishing Office [ www.gpo.gov ] By Mr. HUELSKAMP: H.R. 1015. Congress has the power to enact this legislation pursuant to the following: Article 1, Section 8 of the United States Constitution.",package_114_267.csv,348,348,418,"[congressional record volume 161, number 29 (friday, february 20, 2015)] [house] [page h1084] from the congressional record online through the government publishing office [ www.gpo.gov ] by mr. huelskamp: h.r. 1015. congress has the power to enact this legislation pursuant to the following: article 1, section 8 of the united states constitution.",348
