granuleId,packageId,congress,title,parsed_text,text_readability,text_bs4,__source_file,parsed_text_len,text_readability_len,text_bs4_len,search_text,search_text_len
CREC-2015-02-16-pt1-PgD149-2,CREC-2015-02-16,114,Daily Digest/Senate Committee Meetings,"[Congressional Record Volume 161, Number 26 (Monday, February 16, 2015)] [Daily Digest] [Page D149] From the Congressional Record Online through the Government Publishing Office [ www.gpo.gov ] Committee Meetings No committee meetings were held.","[Congressional Record Volume 161, Number 26 (Monday, February 16, 2015)] [Daily Digest] [Page D149] From the Congressional Record Online through the Government Publishing Office [ www.gpo.gov ] Committee Meetings No committee meetings were held.","Congressional Record, Volume 161 Issue 26 (Monday, February 16, 2015) [Congressional Record Volume 161, Number 26 (Monday, February 16, 2015)] [Daily Digest] [Page D149] From the Congressional Record Online through the Government Publishing Office [ www.gpo.gov ] Committee Meetings No committee meetings were held.",package_114_243.csv,245,245,315,"[congressional record volume 161, number 26 (monday, february 16, 2015)] [daily digest] [page d149] from the congressional record online through the government publishing office [ www.gpo.gov ] committee meetings no committee meetings were held.",245
CREC-2015-02-16-pt1-PgD149,CREC-2015-02-16,114,Daily Digest/Senate,"[Congressional Record Volume 161, Number 26 (Monday, February 16, 2015)] [Daily Digest] [Page D149] From the Congressional Record Online through the Government Publishing Office [ www.gpo.gov ] Monday, February 16, 2015 [[Page D149]] Daily Digest Senate Chamber Action Routine Proceedings, page S1013 The Senate met at 4:45:03 p.m. in pro forma session, and adjourned at 4:45:11 p.m. until 10 a.m., on Thursday, February 19, 2015.","[Congressional Record Volume 161, Number 26 (Monday, February 16, 2015)] [Daily Digest] [Page D149] From the Congressional Record Online through the Government Publishing Office [ www.gpo.gov ] Monday, February 16, 2015 [[Page D149]] Daily Digest Senate Chamber Action Routine Proceedings, page S1013 The Senate met at 4:45:03 p.m. in pro forma session, and adjourned at 4:45:11 p.m. until 10 a.m., on Thursday, February 19, 2015.","Congressional Record, Volume 161 Issue 26 (Monday, February 16, 2015) [Congressional Record Volume 161, Number 26 (Monday, February 16, 2015)] [Daily Digest] [Page D149] From the Congressional Record Online through the Government Publishing Office [ www.gpo.gov ] Monday, February 16, 2015 [[Page D149]] Daily Digest Senate Chamber Action Routine Proceedings, page S1013 The Senate met at 4:45:03 p.m. in pro forma session, and adjourned at 4:45:11 p.m. until 10 a.m., on Thursday, February 19, 2015.",package_114_243.csv,430,430,500,"[congressional record volume 161, number 26 (monday, february 16, 2015)] [daily digest] [page d149] from the congressional record online through the government publishing office [ www.gpo.gov ] monday, february 16, 2015 [[page d149]] daily digest senate chamber action routine proceedings, page s1013 the senate met at 4:45:03 p.m. in pro forma session, and adjourned at 4:45:11 p.m. until 10 a.m., on thursday, february 19, 2015.",430
CREC-2015-02-16-pt1-PgD149-5,CREC-2015-02-16,114,Daily Digest/COMMITTEE MEETINGS FOR 2015-02-17,"[Congressional Record Volume 161, Number 26 (Monday, February 16, 2015)] [Daily Digest] [Page D149] From the Congressional Record Online through the Government Publishing Office [ www.gpo.gov ] COMMITTEE MEETINGS FOR TUESDAY, FEBRUARY 17, 2015 (Committee meetings are open unless otherwise indicated) Senate No meetings/hearings scheduled. House No hearings are scheduled.","[Congressional Record Volume 161, Number 26 (Monday, February 16, 2015)] [Daily Digest] [Page D149] From the Congressional Record Online through the Government Publishing Office [ www.gpo.gov ] COMMITTEE MEETINGS FOR TUESDAY, FEBRUARY 17, 2015 (Committee meetings are open unless otherwise indicated) Senate No meetings/hearings scheduled. House No hearings are scheduled.","Congressional Record, Volume 161 Issue 26 (Monday, February 16, 2015) [Congressional Record Volume 161, Number 26 (Monday, February 16, 2015)] [Daily Digest] [Page D149] From the Congressional Record Online through the Government Publishing Office [ www.gpo.gov ] COMMITTEE MEETINGS FOR TUESDAY, FEBRUARY 17, 2015 (Committee meetings are open unless otherwise indicated) Senate No meetings/hearings scheduled. House No hearings are scheduled.",package_114_243.csv,372,372,442,"[congressional record volume 161, number 26 (monday, february 16, 2015)] [daily digest] [page d149] from the congressional record online through the government publishing office [ www.gpo.gov ] committee meetings for tuesday, february 17, 2015 (committee meetings are open unless otherwise indicated) senate no meetings/hearings scheduled. house no hearings are scheduled.",372
CREC-2015-02-16-pt1-PgS1013,CREC-2015-02-16,114,House of Representatives,"[Congressional Record Volume 161, Number 26 (Monday, February 16, 2015)] [Senate] [Page S1013] From the Congressional Record Online through the Government Publishing Office [ www.gpo.gov ] [[Page S1013]] ----------------------------------------------------------------------- House of Representatives The House was not in session today. Its next meeting will be held on Tuesday, February 17, 2015, at 2 p.m. ----------------------------------------------------------------------- Senate Monday, February 16, 2015 The Senate met at 4:45 and 3 seconds p.m. and was called to order by the President pro tempore (Mr. Hatch). ____________________","[Congressional Record Volume 161, Number 26 (Monday, February 16, 2015)] [Senate] [Page S1013] From the Congressional Record Online through the Government Publishing Office [ www.gpo.gov ] [[Page S1013]] ----------------------------------------------------------------------- House of Representatives The House was not in session today. Its next meeting will be held on Tuesday, February 17, 2015, at 2 p.m. ----------------------------------------------------------------------- Senate Monday, February 16, 2015 The Senate met at 4:45 and 3 seconds p.m. and was called to order by the President pro tempore (Mr. Hatch). ____________________","Congressional Record, Volume 161 Issue 26 (Monday, February 16, 2015) [Congressional Record Volume 161, Number 26 (Monday, February 16, 2015)] [Senate] [Page S1013] From the Congressional Record Online through the Government Publishing Office [ www.gpo.gov ] [[Page S1013]] ----------------------------------------------------------------------- House of Representatives The House was not in session today. Its next meeting will be held on Tuesday, February 17, 2015, at 2 p.m. ----------------------------------------------------------------------- Senate Monday, February 16, 2015 The Senate met at 4:45 and 3 seconds p.m. and was called to order by the President pro tempore (Mr. Hatch). ____________________",package_114_243.csv,641,641,711,"[congressional record volume 161, number 26 (monday, february 16, 2015)] [senate] [page s1013] from the congressional record online through the government publishing office [ www.gpo.gov ] [[page s1013]] ----------------------------------------------------------------------- house of representatives the house was not in session today. its next meeting will be held on tuesday, february 17, 2015, at 2 p.m. ----------------------------------------------------------------------- senate monday, february 16, 2015 the senate met at 4:45 and 3 seconds p.m. and was called to order by the president pro tempore (mr. hatch). ____________________",641
CREC-2015-02-16-pt1-PgD149-3,CREC-2015-02-16,114,Daily Digest/House of Representatives,"[Congressional Record Volume 161, Number 26 (Monday, February 16, 2015)] [Daily Digest] [Page D149] From the Congressional Record Online through the Government Publishing Office [ www.gpo.gov ] House of Representatives Chamber Action The House was not in session today. The House is scheduled to meet at 2 p.m. on Tuesday, February 17, 2015.","[Congressional Record Volume 161, Number 26 (Monday, February 16, 2015)] [Daily Digest] [Page D149] From the Congressional Record Online through the Government Publishing Office [ www.gpo.gov ] House of Representatives Chamber Action The House was not in session today. The House is scheduled to meet at 2 p.m. on Tuesday, February 17, 2015.","Congressional Record, Volume 161 Issue 26 (Monday, February 16, 2015) [Congressional Record Volume 161, Number 26 (Monday, February 16, 2015)] [Daily Digest] [Page D149] From the Congressional Record Online through the Government Publishing Office [ www.gpo.gov ] House of Representatives Chamber Action The House was not in session today. The House is scheduled to meet at 2 p.m. on Tuesday, February 17, 2015.",package_114_243.csv,341,341,411,"[congressional record volume 161, number 26 (monday, february 16, 2015)] [daily digest] [page d149] from the congressional record online through the government publishing office [ www.gpo.gov ] house of representatives chamber action the house was not in session today. the house is scheduled to meet at 2 p.m. on tuesday, february 17, 2015.",341
CREC-2015-02-16-pt1-PgD149-4,CREC-2015-02-16,114,Daily Digest/House Committee Meetings,"[Congressional Record Volume 161, Number 26 (Monday, February 16, 2015)] [Daily Digest] [Page D149] From the Congressional Record Online through the Government Publishing Office [ www.gpo.gov ] Committee Meetings No hearings were held. Joint Meetings No joint committee meetings were held.","[Congressional Record Volume 161, Number 26 (Monday, February 16, 2015)] [Daily Digest] [Page D149] From the Congressional Record Online through the Government Publishing Office [ www.gpo.gov ] Committee Meetings No hearings were held. Joint Meetings No joint committee meetings were held.","Congressional Record, Volume 161 Issue 26 (Monday, February 16, 2015) [Congressional Record Volume 161, Number 26 (Monday, February 16, 2015)] [Daily Digest] [Page D149] From the Congressional Record Online through the Government Publishing Office [ www.gpo.gov ] Committee Meetings No hearings were held. Joint Meetings No joint committee meetings were held.",package_114_243.csv,289,289,359,"[congressional record volume 161, number 26 (monday, february 16, 2015)] [daily digest] [page d149] from the congressional record online through the government publishing office [ www.gpo.gov ] committee meetings no hearings were held. joint meetings no joint committee meetings were held.",289
CREC-2015-02-16-pt1-PgS1013-2,CREC-2015-02-16,114,"ADJOURNMENT UNTIL THURSDAY, FEBRUARY 19, 2015, AT 10 A.M.","[Congressional Record Volume 161, Number 26 (Monday, February 16, 2015)] [Senate] [Page S1013] From the Congressional Record Online through the Government Publishing Office [ www.gpo.gov ] ADJOURNMENT UNTIL THURSDAY, FEBRUARY 19, 2015, AT 10 A.M. The PRESIDENT pro tempore. Under the previous order, the Senate stands adjourned until Thursday, February 19, 2015, at 10 a.m. Thereupon, the Senate, at 4:45 and 11 seconds p.m., adjourned until Thursday, February 19, 2015, at 10 a.m.","[Congressional Record Volume 161, Number 26 (Monday, February 16, 2015)] [Senate] [Page S1013] From the Congressional Record Online through the Government Publishing Office [ www.gpo.gov ] ADJOURNMENT UNTIL THURSDAY, FEBRUARY 19, 2015, AT 10 A.M. The PRESIDENT pro tempore. Under the previous order, the Senate stands adjourned until Thursday, February 19, 2015, at 10 a.m. Thereupon, the Senate, at 4:45 and 11 seconds p.m., adjourned until Thursday, February 19, 2015, at 10 a.m.","Congressional Record, Volume 161 Issue 26 (Monday, February 16, 2015) [Congressional Record Volume 161, Number 26 (Monday, February 16, 2015)] [Senate] [Page S1013] From the Congressional Record Online through the Government Publishing Office [ www.gpo.gov ] ADJOURNMENT UNTIL THURSDAY, FEBRUARY 19, 2015, AT 10 A.M. The PRESIDENT pro tempore. Under the previous order, the Senate stands adjourned until Thursday, February 19, 2015, at 10 a.m. Thereupon, the Senate, at 4:45 and 11 seconds p.m., adjourned until Thursday, February 19, 2015, at 10 a.m.",package_114_243.csv,481,481,551,"[congressional record volume 161, number 26 (monday, february 16, 2015)] [senate] [page s1013] from the congressional record online through the government publishing office [ www.gpo.gov ] adjournment until thursday, february 19, 2015, at 10 a.m. the president pro tempore. under the previous order, the senate stands adjourned until thursday, february 19, 2015, at 10 a.m. thereupon, the senate, at 4:45 and 11 seconds p.m., adjourned until thursday, february 19, 2015, at 10 a.m.",481
CREC-2015-02-16-pt1-PgE221-2,CREC-2015-02-16,114,SENATE COMMITTEE MEETINGS,"[Congressional Record Volume 161, Number 26 (Monday, February 16, 2015)] [Extensions of Remarks] [Page E221] From the Congressional Record Online through the Government Publishing Office [ www.gpo.gov ] SENATE COMMITTEE MEETINGS Title IV of Senate Resolution 4, agreed to by the Senate of February 4, 1977, calls for establishment of a system for a computerized schedule of all meetings and hearings of Senate committees, subcommittees, joint committees, and committees of conference. This title requires all such committees to notify the Office of the Senate Daily Digest--designated by the Rules Committee--of the time, place and purpose of the meetings, when scheduled and any cancellations or changes in the meetings as they occur. As an additional procedure along with the computerization of this information, the Office of the Senate Daily Digest will prepare this information for printing in the Extensions of Remarks section of the Congressional Record on Monday and Wednesday of each week. Meetings scheduled for Tuesday, February 17, 2015 may be found in the Daily Digest of today's record. MEETINGS SCHEDULED FEBRUARY 24 10 a.m. Committee on Energy and Natural Resources To hold hearings to examine the President's proposed budget request for fiscal year 2016 for the Department of the Interior. SD-366 Committee on Health, Education, Labor, and Pensions To hold hearings to examine recalibrating regulation of colleges and universities, focusing on a report from the Task Force on Government Regulation of Higher Education. SD-430 FEBRUARY 25 9:30 a.m. Committee on Environment and Public Works To hold hearings to examine Moving Ahead for Progress in the 21st Century Act (MAP-21) reauthorization, focusing on perspectives from owners, operators, and users of the system. SD-406 2:30 p.m. Committee on Armed Services To hold hearings to examine regional nuclear dynamics. SR-222 FEBRUARY 26 10 a.m. Committee on Energy and Natural Resources To hold hearings to examine the President's proposed budget request for fiscal year 2016 for the Forest Service. SD-366 MARCH 4 3:30 p.m. Committee on Armed Services Subcommittee on Strategic Forces To hold hearings to examine United States nuclear weapons policy, programs, and strategy in review of the Defense Authorization Request for fiscal year 2016 and the Future Years Defense Program. SR-222 MARCH 12 2:30 p.m. Committee on Armed Services Subcommittee on Strategic Forces To receive a closed briefing on missile defense programs in review of the Defense Authorization Request for fiscal year 2016 and the Future Years Defense Program. SVC-217 MARCH 25 2:30 p.m. Committee on Armed Services Subcommittee on Strategic Forces To hold hearings to examine ballistic missile defense programs in review of the Defense Authorization Request for fiscal year 2016 and the Future Years Defense Program. SR-222","[Congressional Record Volume 161, Number 26 (Monday, February 16, 2015)] [Extensions of Remarks] [Page E221] From the Congressional Record Online through the Government Publishing Office [ www.gpo.gov ] SENATE COMMITTEE MEETINGS Title IV of Senate Resolution 4, agreed to by the Senate of February 4, 1977, calls for establishment of a system for a computerized schedule of all meetings and hearings of Senate committees, subcommittees, joint committees, and committees of conference. This title requires all such committees to notify the Office of the Senate Daily Digest--designated by the Rules Committee--of the time, place and purpose of the meetings, when scheduled and any cancellations or changes in the meetings as they occur. As an additional procedure along with the computerization of this information, the Office of the Senate Daily Digest will prepare this information for printing in the Extensions of Remarks section of the Congressional Record on Monday and Wednesday of each week. Meetings scheduled for Tuesday, February 17, 2015 may be found in the Daily Digest of today's record. MEETINGS SCHEDULED FEBRUARY 24 10 a.m. Committee on Energy and Natural Resources To hold hearings to examine the President's proposed budget request for fiscal year 2016 for the Department of the Interior. SD-366 Committee on Health, Education, Labor, and Pensions To hold hearings to examine recalibrating regulation of colleges and universities, focusing on a report from the Task Force on Government Regulation of Higher Education. SD-430 FEBRUARY 25 9:30 a.m. Committee on Environment and Public Works To hold hearings to examine Moving Ahead for Progress in the 21st Century Act (MAP-21) reauthorization, focusing on perspectives from owners, operators, and users of the system. SD-406 2:30 p.m. Committee on Armed Services To hold hearings to examine regional nuclear dynamics. SR-222 FEBRUARY 26 10 a.m. Committee on Energy and Natural Resources To hold hearings to examine the President's proposed budget request for fiscal year 2016 for the Forest Service. SD-366 MARCH 4 3:30 p.m. Committee on Armed Services Subcommittee on Strategic Forces To hold hearings to examine United States nuclear weapons policy, programs, and strategy in review of the Defense Authorization Request for fiscal year 2016 and the Future Years Defense Program. SR-222 MARCH 12 2:30 p.m. Committee on Armed Services Subcommittee on Strategic Forces To receive a closed briefing on missile defense programs in review of the Defense Authorization Request for fiscal year 2016 and the Future Years Defense Program. SVC-217 MARCH 25 2:30 p.m. Committee on Armed Services Subcommittee on Strategic Forces To hold hearings to examine ballistic missile defense programs in review of the Defense Authorization Request for fiscal year 2016 and the Future Years Defense Program. SR-222","Congressional Record, Volume 161 Issue 26 (Monday, February 16, 2015) [Congressional Record Volume 161, Number 26 (Monday, February 16, 2015)] [Extensions of Remarks] [Page E221] From the Congressional Record Online through the Government Publishing Office [ www.gpo.gov ] SENATE COMMITTEE MEETINGS Title IV of Senate Resolution 4, agreed to by the Senate of February 4, 1977, calls for establishment of a system for a computerized schedule of all meetings and hearings of Senate committees, subcommittees, joint committees, and committees of conference. This title requires all such committees to notify the Office of the Senate Daily Digest--designated by the Rules Committee--of the time, place and purpose of the meetings, when scheduled and any cancellations or changes in the meetings as they occur. As an additional procedure along with the computerization of this information, the Office of the Senate Daily Digest will prepare this information for printing in the Extensions of Remarks section of the Congressional Record on Monday and Wednesday of each week. Meetings scheduled for Tuesday, February 17, 2015 may be found in the Daily Digest of today's record. MEETINGS SCHEDULED FEBRUARY 24 10 a.m. Committee on Energy and Natural Resources To hold hearings to examine the President's proposed budget request for fiscal year 2016 for the Department of the Interior. SD-366 Committee on Health, Education, Labor, and Pensions To hold hearings to examine recalibrating regulation of colleges and universities, focusing on a report from the Task Force on Government Regulation of Higher Education. SD-430 FEBRUARY 25 9:30 a.m. Committee on Environment and Public Works To hold hearings to examine Moving Ahead for Progress in the 21st Century Act (MAP-21) reauthorization, focusing on perspectives from owners, operators, and users of the system. SD-406 2:30 p.m. Committee on Armed Services To hold hearings to examine regional nuclear dynamics. SR-222 FEBRUARY 26 10 a.m. Committee on Energy and Natural Resources To hold hearings to examine the President's proposed budget request for fiscal year 2016 for the Forest Service. SD-366 MARCH 4 3:30 p.m. Committee on Armed Services Subcommittee on Strategic Forces To hold hearings to examine United States nuclear weapons policy, programs, and strategy in review of the Defense Authorization Request for fiscal year 2016 and the Future Years Defense Program. SR-222 MARCH 12 2:30 p.m. Committee on Armed Services Subcommittee on Strategic Forces To receive a closed briefing on missile defense programs in review of the Defense Authorization Request for fiscal year 2016 and the Future Years Defense Program. SVC-217 MARCH 25 2:30 p.m. Committee on Armed Services Subcommittee on Strategic Forces To hold hearings to examine ballistic missile defense programs in review of the Defense Authorization Request for fiscal year 2016 and the Future Years Defense Program. SR-222",package_114_243.csv,2861,2861,2931,"[congressional record volume 161, number 26 (monday, february 16, 2015)] [extensions of remarks] [page e221] from the congressional record online through the government publishing office [ www.gpo.gov ] senate committee meetings title iv of senate resolution 4, agreed to by the senate of february 4, 1977, calls for establishment of a system for a computerized schedule of all meetings and hearings of senate committees, subcommittees, joint committees, and committees of conference. this title requires all such committees to notify the office of the senate daily digest--designated by the rules committee--of the time, place and purpose of the meetings, when scheduled and any cancellations or changes in the meetings as they occur. as an additional procedure along with the computerization of this information, the office of the senate daily digest will prepare this information for printing in the extensions of remarks section of the congressional record on monday and wednesday of each week. meetings scheduled for tuesday, february 17, 2015 may be found in the daily digest of today's record. meetings scheduled february 24 10 a.m. committee on energy and natural resources to hold hearings to examine the president's proposed budget request for fiscal year 2016 for the department of the interior. sd-366 committee on health, education, labor, and pensions to hold hearings to examine recalibrating regulation of colleges and universities, focusing on a report from the task force on government regulation of higher education. sd-430 february 25 9:30 a.m. committee on environment and public works to hold hearings to examine moving ahead for progress in the 21st century act (map-21) reauthorization, focusing on perspectives from owners, operators, and users of the system. sd-406 2:30 p.m. committee on armed services to hold hearings to examine regional nuclear dynamics. sr-222 february 26 10 a.m. committee on energy and natural resources to hold hearings to examine the president's proposed budget request for fiscal year 2016 for the forest service. sd-366 march 4 3:30 p.m. committee on armed services subcommittee on strategic forces to hold hearings to examine united states nuclear weapons policy, programs, and strategy in review of the defense authorization request for fiscal year 2016 and the future years defense program. sr-222 march 12 2:30 p.m. committee on armed services subcommittee on strategic forces to receive a closed briefing on missile defense programs in review of the defense authorization request for fiscal year 2016 and the future years defense program. svc-217 march 25 2:30 p.m. committee on armed services subcommittee on strategic forces to hold hearings to examine ballistic missile defense programs in review of the defense authorization request for fiscal year 2016 and the future years defense program. sr-222",2861
