granuleId,packageId,congress,title,parsed_text,text_readability,text_bs4,__source_file,parsed_text_len,text_readability_len,text_bs4_len,search_text,search_text_len
CREC-2015-05-26-pt1-PgS3319,CREC-2015-05-26,114,Senate,"[Congressional Record Volume 161, Number 82 (Tuesday, May 26, 2015)] [Senate] [Page S3319] From the Congressional Record Online through the Government Publishing Office [ www.gpo.gov ] [[Page S3319]] ----------------------------------------------------------------------- Senate The Senate met at 4:29 and 55 seconds p.m., and was called to order by the Honorable Roy Blunt, a Senator from the State of Missouri. ____________________","[Congressional Record Volume 161, Number 82 (Tuesday, May 26, 2015)] [Senate] [Page S3319] From the Congressional Record Online through the Government Publishing Office [ www.gpo.gov ] [[Page S3319]] ----------------------------------------------------------------------- Senate The Senate met at 4:29 and 55 seconds p.m., and was called to order by the Honorable Roy Blunt, a Senator from the State of Missouri. ____________________","Congressional Record, Volume 161 Issue 82 (Tuesday, May 26, 2015) [Congressional Record Volume 161, Number 82 (Tuesday, May 26, 2015)] [Senate] [Page S3319] From the Congressional Record Online through the Government Publishing Office [ www.gpo.gov ] [[Page S3319]] ----------------------------------------------------------------------- Senate The Senate met at 4:29 and 55 seconds p.m., and was called to order by the Honorable Roy Blunt, a Senator from the State of Missouri. ____________________",package_114_293.csv,433,433,499,"[congressional record volume 161, number 82 (tuesday, may 26, 2015)] [senate] [page s3319] from the congressional record online through the government publishing office [ www.gpo.gov ] [[page s3319]] ----------------------------------------------------------------------- senate the senate met at 4:29 and 55 seconds p.m., and was called to order by the honorable roy blunt, a senator from the state of missouri. ____________________",433
CREC-2015-05-26-pt1-PgS3319-3,CREC-2015-05-26,114,"ADJOURNMENT UNTIL THURSDAY, MAY 28, 2015, AT 8:30 A.M.","[Congressional Record Volume 161, Number 82 (Tuesday, May 26, 2015)] [Senate] [Page S3319] From the Congressional Record Online through the Government Publishing Office [ www.gpo.gov ] ADJOURNMENT UNTIL THURSDAY, MAY 28, 2015, AT 8:30 A.M. The ACTING PRESIDENT pro tempore. Under the previous order, the Senate stands adjourned until 8:30 a.m. on Thursday, May 28, 2015. Thereupon, the Senate, at 4:30 and 23 seconds p.m., adjourned until Thursday, May 28, 2015, at 8:30 a.m.","[Congressional Record Volume 161, Number 82 (Tuesday, May 26, 2015)] [Senate] [Page S3319] From the Congressional Record Online through the Government Publishing Office [ www.gpo.gov ] ADJOURNMENT UNTIL THURSDAY, MAY 28, 2015, AT 8:30 A.M. The ACTING PRESIDENT pro tempore. Under the previous order, the Senate stands adjourned until 8:30 a.m. on Thursday, May 28, 2015. Thereupon, the Senate, at 4:30 and 23 seconds p.m., adjourned until Thursday, May 28, 2015, at 8:30 a.m.","Congressional Record, Volume 161 Issue 82 (Tuesday, May 26, 2015) [Congressional Record Volume 161, Number 82 (Tuesday, May 26, 2015)] [Senate] [Page S3319] From the Congressional Record Online through the Government Publishing Office [ www.gpo.gov ] ADJOURNMENT UNTIL THURSDAY, MAY 28, 2015, AT 8:30 A.M. The ACTING PRESIDENT pro tempore. Under the previous order, the Senate stands adjourned until 8:30 a.m. on Thursday, May 28, 2015. Thereupon, the Senate, at 4:30 and 23 seconds p.m., adjourned until Thursday, May 28, 2015, at 8:30 a.m.",package_114_293.csv,475,475,541,"[congressional record volume 161, number 82 (tuesday, may 26, 2015)] [senate] [page s3319] from the congressional record online through the government publishing office [ www.gpo.gov ] adjournment until thursday, may 28, 2015, at 8:30 a.m. the acting president pro tempore. under the previous order, the senate stands adjourned until 8:30 a.m. on thursday, may 28, 2015. thereupon, the senate, at 4:30 and 23 seconds p.m., adjourned until thursday, may 28, 2015, at 8:30 a.m.",475
CREC-2015-05-26-pt1-PgS3319-2,CREC-2015-05-26,114,APPOINTMENT OF ACTING PRESIDENT PRO TEMPORE,"[Congressional Record Volume 161, Number 82 (Tuesday, May 26, 2015)] [Senate] [Page S3319] From the Congressional Record Online through the Government Publishing Office [ www.gpo.gov ] APPOINTMENT OF ACTING PRESIDENT PRO TEMPORE The PRESIDING OFFICER. The clerk will please read a communication to the Senate from the President pro tempore (Mr. Hatch). The senior assistant legislative clerk read the following letter: U.S. Senate, President pro tempore, Washington, DC, May 26, 2015. To the Senate: Under the provisions of rule I, paragraph 3, of the Standing Rules of the Senate, I hereby appoint the Honorable Roy Blunt, a Senator from the State of Missouri, to perform the duties of the Chair. Orrin G. Hatch, President pro tempore. Mr. BLUNT thereupon assumed the Chair as Acting President pro tempore. ____________________","[Congressional Record Volume 161, Number 82 (Tuesday, May 26, 2015)] [Senate] [Page S3319] From the Congressional Record Online through the Government Publishing Office [ www.gpo.gov ] APPOINTMENT OF ACTING PRESIDENT PRO TEMPORE The PRESIDING OFFICER. The clerk will please read a communication to the Senate from the President pro tempore (Mr. Hatch). The senior assistant legislative clerk read the following letter: U.S. Senate, President pro tempore, Washington, DC, May 26, 2015. To the Senate: Under the provisions of rule I, paragraph 3, of the Standing Rules of the Senate, I hereby appoint the Honorable Roy Blunt, a Senator from the State of Missouri, to perform the duties of the Chair. Orrin G. Hatch, President pro tempore. Mr. BLUNT thereupon assumed the Chair as Acting President pro tempore. ____________________","Congressional Record, Volume 161 Issue 82 (Tuesday, May 26, 2015) [Congressional Record Volume 161, Number 82 (Tuesday, May 26, 2015)] [Senate] [Page S3319] From the Congressional Record Online through the Government Publishing Office [ www.gpo.gov ] APPOINTMENT OF ACTING PRESIDENT PRO TEMPORE The PRESIDING OFFICER. The clerk will please read a communication to the Senate from the President pro tempore (Mr. Hatch). The senior assistant legislative clerk read the following letter: U.S. Senate, President pro tempore, Washington, DC, May 26, 2015. To the Senate: Under the provisions of rule I, paragraph 3, of the Standing Rules of the Senate, I hereby appoint the Honorable Roy Blunt, a Senator from the State of Missouri, to perform the duties of the Chair. Orrin G. Hatch, President pro tempore. Mr. BLUNT thereupon assumed the Chair as Acting President pro tempore. ____________________",package_114_293.csv,828,828,894,"[congressional record volume 161, number 82 (tuesday, may 26, 2015)] [senate] [page s3319] from the congressional record online through the government publishing office [ www.gpo.gov ] appointment of acting president pro tempore the presiding officer. the clerk will please read a communication to the senate from the president pro tempore (mr. hatch). the senior assistant legislative clerk read the following letter: u.s. senate, president pro tempore, washington, dc, may 26, 2015. to the senate: under the provisions of rule i, paragraph 3, of the standing rules of the senate, i hereby appoint the honorable roy blunt, a senator from the state of missouri, to perform the duties of the chair. orrin g. hatch, president pro tempore. mr. blunt thereupon assumed the chair as acting president pro tempore. ____________________",828
CREC-2015-05-26-pt1-PgE793-3,CREC-2015-05-26,114,HONORING PRIVATE FIRST CLASS WILLIAM JOSEPH OAKLEY,"[Congressional Record Volume 161, Number 82 (Tuesday, May 26, 2015)] [Extensions of Remarks] [Page E793] From the Congressional Record Online through the Government Publishing Office [ www.gpo.gov ] HONORING PRIVATE FIRST CLASS WILLIAM JOSEPH OAKLEY ______ HON. ELIZABETH H. ESTY of connecticut in the house of representatives Tuesday, May 26, 2015 Ms. ESTY. Mr. Speaker, I rise today to honor and remember Private First Class William Joseph Oakley, the first casualty of the Vietnam War from Waterbury, Connecticut. At the age of 17, PFC Oakley enlisted in the United States Army. He was extremely proud to serve his country. On May 28, 1965, PFC Oakley was killed when two Army helicopters collided. He was only 18 years old and had served for less than a year. As we commemorate Memorial Day and remember all those who lost their lives while in service to our country, let us pause to think of PFC Oakley on the 50th anniversary of his death. This year also marks the 50th anniversary of the ground offensive in Vietnam. Over 58,000 names are written on the Vietnam Veterans Memorial Wall in Washington, DC. Thirty of these brave Americans, including PFC Oakley, called Waterbury home. The City of Waterbury and the Waterbury Veterans Memorial Committee will never forget the service and sacrifice of the men and women who died while serving in our nation's military throughout our history. I would like to take this opportunity to thank the Waterbury Veterans Memorial Committee for all they do to honor our veterans. ____________________","[Congressional Record Volume 161, Number 82 (Tuesday, May 26, 2015)] [Extensions of Remarks] [Page E793] From the Congressional Record Online through the Government Publishing Office [ www.gpo.gov ] HONORING PRIVATE FIRST CLASS WILLIAM JOSEPH OAKLEY ______ HON. ELIZABETH H. ESTY of connecticut in the house of representatives Tuesday, May 26, 2015 Ms. ESTY. Mr. Speaker, I rise today to honor and remember Private First Class William Joseph Oakley, the first casualty of the Vietnam War from Waterbury, Connecticut. At the age of 17, PFC Oakley enlisted in the United States Army. He was extremely proud to serve his country. On May 28, 1965, PFC Oakley was killed when two Army helicopters collided. He was only 18 years old and had served for less than a year. As we commemorate Memorial Day and remember all those who lost their lives while in service to our country, let us pause to think of PFC Oakley on the 50th anniversary of his death. This year also marks the 50th anniversary of the ground offensive in Vietnam. Over 58,000 names are written on the Vietnam Veterans Memorial Wall in Washington, DC. Thirty of these brave Americans, including PFC Oakley, called Waterbury home. The City of Waterbury and the Waterbury Veterans Memorial Committee will never forget the service and sacrifice of the men and women who died while serving in our nation's military throughout our history. I would like to take this opportunity to thank the Waterbury Veterans Memorial Committee for all they do to honor our veterans. ____________________","Congressional Record, Volume 161 Issue 82 (Tuesday, May 26, 2015) [Congressional Record Volume 161, Number 82 (Tuesday, May 26, 2015)] [Extensions of Remarks] [Page E793] From the Congressional Record Online through the Government Publishing Office [ www.gpo.gov ] HONORING PRIVATE FIRST CLASS WILLIAM JOSEPH OAKLEY ______ HON. ELIZABETH H. ESTY of connecticut in the house of representatives Tuesday, May 26, 2015 Ms. ESTY. Mr. Speaker, I rise today to honor and remember Private First Class William Joseph Oakley, the first casualty of the Vietnam War from Waterbury, Connecticut. At the age of 17, PFC Oakley enlisted in the United States Army. He was extremely proud to serve his country. On May 28, 1965, PFC Oakley was killed when two Army helicopters collided. He was only 18 years old and had served for less than a year. As we commemorate Memorial Day and remember all those who lost their lives while in service to our country, let us pause to think of PFC Oakley on the 50th anniversary of his death. This year also marks the 50th anniversary of the ground offensive in Vietnam. Over 58,000 names are written on the Vietnam Veterans Memorial Wall in Washington, DC. Thirty of these brave Americans, including PFC Oakley, called Waterbury home. The City of Waterbury and the Waterbury Veterans Memorial Committee will never forget the service and sacrifice of the men and women who died while serving in our nation's military throughout our history. I would like to take this opportunity to thank the Waterbury Veterans Memorial Committee for all they do to honor our veterans. ____________________",package_114_293.csv,1542,1542,1608,"[congressional record volume 161, number 82 (tuesday, may 26, 2015)] [extensions of remarks] [page e793] from the congressional record online through the government publishing office [ www.gpo.gov ] honoring private first class william joseph oakley ______ hon. elizabeth h. esty of connecticut in the house of representatives tuesday, may 26, 2015 ms. esty. mr. speaker, i rise today to honor and remember private first class william joseph oakley, the first casualty of the vietnam war from waterbury, connecticut. at the age of 17, pfc oakley enlisted in the united states army. he was extremely proud to serve his country. on may 28, 1965, pfc oakley was killed when two army helicopters collided. he was only 18 years old and had served for less than a year. as we commemorate memorial day and remember all those who lost their lives while in service to our country, let us pause to think of pfc oakley on the 50th anniversary of his death. this year also marks the 50th anniversary of the ground offensive in vietnam. over 58,000 names are written on the vietnam veterans memorial wall in washington, dc. thirty of these brave americans, including pfc oakley, called waterbury home. the city of waterbury and the waterbury veterans memorial committee will never forget the service and sacrifice of the men and women who died while serving in our nation's military throughout our history. i would like to take this opportunity to thank the waterbury veterans memorial committee for all they do to honor our veterans. ____________________",1542
CREC-2015-05-26-pt1-PgE793-4,CREC-2015-05-26,114,RECOGNIZING KEVIN AND SIMA ZLOCK,"[Congressional Record Volume 161, Number 82 (Tuesday, May 26, 2015)] [Extensions of Remarks] [Page E793] From the Congressional Record Online through the Government Publishing Office [ www.gpo.gov ] RECOGNIZING KEVIN AND SIMA ZLOCK ______ HON. MICHAEL G. FITZPATRICK of pennsylvania in the house of representatives Tuesday, May 26, 2015 Mr. FITZPATRICK. Mr. Speaker, I am proud to join you today in recognition of Kevin and Sima Zlock for their efforts to advance and expand the mission at Bucks County Community College. I am told, that Bucks County Community College will officially dedicate the new Kevin and Sima Zlock Performing Arts Center at the college's Newtown, Bucks County campus today. This addition to an already amazing institution will enhance the educational experience of every Bucks student who walks through the door a valuable venue for the college and region's thriving arts community. I consider myself so fortunate to be able to represent Bucks County, Pennsylvania here in the House, and to have grown up around the Community College. The kindness of individuals, businesses and civic groups across my district continue to astound me, and the Zlock's commitment to Bucks County Community College is just the latest in a long line of residents investing in the success of our community. So, I thank Kevin and Sima Zlock for their continued support of Bucks County Community College and wish the best for the dedication of the new Kevin and Sima Zlock Performing Arts Center. Have a great day, Bucks County. ____________________","[Congressional Record Volume 161, Number 82 (Tuesday, May 26, 2015)] [Extensions of Remarks] [Page E793] From the Congressional Record Online through the Government Publishing Office [ www.gpo.gov ] RECOGNIZING KEVIN AND SIMA ZLOCK ______ HON. MICHAEL G. FITZPATRICK of pennsylvania in the house of representatives Tuesday, May 26, 2015 Mr. FITZPATRICK. Mr. Speaker, I am proud to join you today in recognition of Kevin and Sima Zlock for their efforts to advance and expand the mission at Bucks County Community College. I am told, that Bucks County Community College will officially dedicate the new Kevin and Sima Zlock Performing Arts Center at the college's Newtown, Bucks County campus today. This addition to an already amazing institution will enhance the educational experience of every Bucks student who walks through the door a valuable venue for the college and region's thriving arts community. I consider myself so fortunate to be able to represent Bucks County, Pennsylvania here in the House, and to have grown up around the Community College. The kindness of individuals, businesses and civic groups across my district continue to astound me, and the Zlock's commitment to Bucks County Community College is just the latest in a long line of residents investing in the success of our community. So, I thank Kevin and Sima Zlock for their continued support of Bucks County Community College and wish the best for the dedication of the new Kevin and Sima Zlock Performing Arts Center. Have a great day, Bucks County. ____________________","Congressional Record, Volume 161 Issue 82 (Tuesday, May 26, 2015) [Congressional Record Volume 161, Number 82 (Tuesday, May 26, 2015)] [Extensions of Remarks] [Page E793] From the Congressional Record Online through the Government Publishing Office [ www.gpo.gov ] RECOGNIZING KEVIN AND SIMA ZLOCK ______ HON. MICHAEL G. FITZPATRICK of pennsylvania in the house of representatives Tuesday, May 26, 2015 Mr. FITZPATRICK. Mr. Speaker, I am proud to join you today in recognition of Kevin and Sima Zlock for their efforts to advance and expand the mission at Bucks County Community College. I am told, that Bucks County Community College will officially dedicate the new Kevin and Sima Zlock Performing Arts Center at the college's Newtown, Bucks County campus today. This addition to an already amazing institution will enhance the educational experience of every Bucks student who walks through the door a valuable venue for the college and region's thriving arts community. I consider myself so fortunate to be able to represent Bucks County, Pennsylvania here in the House, and to have grown up around the Community College. The kindness of individuals, businesses and civic groups across my district continue to astound me, and the Zlock's commitment to Bucks County Community College is just the latest in a long line of residents investing in the success of our community. So, I thank Kevin and Sima Zlock for their continued support of Bucks County Community College and wish the best for the dedication of the new Kevin and Sima Zlock Performing Arts Center. Have a great day, Bucks County. ____________________",package_114_293.csv,1551,1551,1617,"[congressional record volume 161, number 82 (tuesday, may 26, 2015)] [extensions of remarks] [page e793] from the congressional record online through the government publishing office [ www.gpo.gov ] recognizing kevin and sima zlock ______ hon. michael g. fitzpatrick of pennsylvania in the house of representatives tuesday, may 26, 2015 mr. fitzpatrick. mr. speaker, i am proud to join you today in recognition of kevin and sima zlock for their efforts to advance and expand the mission at bucks county community college. i am told, that bucks county community college will officially dedicate the new kevin and sima zlock performing arts center at the college's newtown, bucks county campus today. this addition to an already amazing institution will enhance the educational experience of every bucks student who walks through the door a valuable venue for the college and region's thriving arts community. i consider myself so fortunate to be able to represent bucks county, pennsylvania here in the house, and to have grown up around the community college. the kindness of individuals, businesses and civic groups across my district continue to astound me, and the zlock's commitment to bucks county community college is just the latest in a long line of residents investing in the success of our community. so, i thank kevin and sima zlock for their continued support of bucks county community college and wish the best for the dedication of the new kevin and sima zlock performing arts center. have a great day, bucks county. ____________________",1551
