granuleId,packageId,congress,title,parsed_text,text_readability,text_bs4,__source_file,parsed_text_len,text_readability_len,text_bs4_len,search_text,search_text_len
CREC-2015-05-26-pt1-PgE793-2,CREC-2015-05-26,114,RECOGNIZING MAY AS PREECLAMPSIA AWARENESS MONTH,"[Congressional Record Volume 161, Number 82 (Tuesday, May 26, 2015)] [Extensions of Remarks] [Page E793] From the Congressional Record Online through the Government Publishing Office [ www.gpo.gov ] RECOGNIZING MAY AS PREECLAMPSIA AWARENESS MONTH ______ HON. KRISTI L. NOEM of south dakota in the house of representatives Tuesday, May 26, 2015 Mrs. NOEM. Mr. Speaker, I rise to recognize May as Preeclampsia Awareness Month. Despite advances in treatment and technology across the medical field, the disease of preeclampsia continues to affect mothers and infants across the country. As one of the leading causes of premature birth, illness, and maternal death, preeclampsia afflicts one in 12 women, according to the Preeclampsia Foundation. Preeclampsia is characterized by high blood pressure, and its symptoms mimic common difficulties associated with pregnancy, like abdominal pain, the cause of headaches, vomiting, and anxiety. Because they are so common, many women may simply ignore these symptoms. Worse, little is known about preeclampsia. While current research suggests it is related to the placenta, we do not know why it occurs, we do not know how to cure it, and we are still learning about its long-term effects on mothers and their children. Our lack of understanding about preeclampsia is why I strongly support the work of groups like the Preeclampsia Foundation to educate women about the symptoms of preeclampsia and how they can find care. I also support the research being done at the National Institute of Child Health and Human Development. I am hopeful that research and support from NIH and the Preeclampsia Foundation will help us understand and address this disease. ____________________","[Congressional Record Volume 161, Number 82 (Tuesday, May 26, 2015)] [Extensions of Remarks] [Page E793] From the Congressional Record Online through the Government Publishing Office [ www.gpo.gov ] RECOGNIZING MAY AS PREECLAMPSIA AWARENESS MONTH ______ HON. KRISTI L. NOEM of south dakota in the house of representatives Tuesday, May 26, 2015 Mrs. NOEM. Mr. Speaker, I rise to recognize May as Preeclampsia Awareness Month. Despite advances in treatment and technology across the medical field, the disease of preeclampsia continues to affect mothers and infants across the country. As one of the leading causes of premature birth, illness, and maternal death, preeclampsia afflicts one in 12 women, according to the Preeclampsia Foundation. Preeclampsia is characterized by high blood pressure, and its symptoms mimic common difficulties associated with pregnancy, like abdominal pain, the cause of headaches, vomiting, and anxiety. Because they are so common, many women may simply ignore these symptoms. Worse, little is known about preeclampsia. While current research suggests it is related to the placenta, we do not know why it occurs, we do not know how to cure it, and we are still learning about its long-term effects on mothers and their children. Our lack of understanding about preeclampsia is why I strongly support the work of groups like the Preeclampsia Foundation to educate women about the symptoms of preeclampsia and how they can find care. I also support the research being done at the National Institute of Child Health and Human Development. I am hopeful that research and support from NIH and the Preeclampsia Foundation will help us understand and address this disease. ____________________","Congressional Record, Volume 161 Issue 82 (Tuesday, May 26, 2015) [Congressional Record Volume 161, Number 82 (Tuesday, May 26, 2015)] [Extensions of Remarks] [Page E793] From the Congressional Record Online through the Government Publishing Office [ www.gpo.gov ] RECOGNIZING MAY AS PREECLAMPSIA AWARENESS MONTH ______ HON. KRISTI L. NOEM of south dakota in the house of representatives Tuesday, May 26, 2015 Mrs. NOEM. Mr. Speaker, I rise to recognize May as Preeclampsia Awareness Month. Despite advances in treatment and technology across the medical field, the disease of preeclampsia continues to affect mothers and infants across the country. As one of the leading causes of premature birth, illness, and maternal death, preeclampsia afflicts one in 12 women, according to the Preeclampsia Foundation. Preeclampsia is characterized by high blood pressure, and its symptoms mimic common difficulties associated with pregnancy, like abdominal pain, the cause of headaches, vomiting, and anxiety. Because they are so common, many women may simply ignore these symptoms. Worse, little is known about preeclampsia. While current research suggests it is related to the placenta, we do not know why it occurs, we do not know how to cure it, and we are still learning about its long-term effects on mothers and their children. Our lack of understanding about preeclampsia is why I strongly support the work of groups like the Preeclampsia Foundation to educate women about the symptoms of preeclampsia and how they can find care. I also support the research being done at the National Institute of Child Health and Human Development. I am hopeful that research and support from NIH and the Preeclampsia Foundation will help us understand and address this disease. ____________________",package_114_293.csv,1717,1717,1783,"[congressional record volume 161, number 82 (tuesday, may 26, 2015)] [extensions of remarks] [page e793] from the congressional record online through the government publishing office [ www.gpo.gov ] recognizing may as preeclampsia awareness month ______ hon. kristi l. noem of south dakota in the house of representatives tuesday, may 26, 2015 mrs. noem. mr. speaker, i rise to recognize may as preeclampsia awareness month. despite advances in treatment and technology across the medical field, the disease of preeclampsia continues to affect mothers and infants across the country. as one of the leading causes of premature birth, illness, and maternal death, preeclampsia afflicts one in 12 women, according to the preeclampsia foundation. preeclampsia is characterized by high blood pressure, and its symptoms mimic common difficulties associated with pregnancy, like abdominal pain, the cause of headaches, vomiting, and anxiety. because they are so common, many women may simply ignore these symptoms. worse, little is known about preeclampsia. while current research suggests it is related to the placenta, we do not know why it occurs, we do not know how to cure it, and we are still learning about its long-term effects on mothers and their children. our lack of understanding about preeclampsia is why i strongly support the work of groups like the preeclampsia foundation to educate women about the symptoms of preeclampsia and how they can find care. i also support the research being done at the national institute of child health and human development. i am hopeful that research and support from nih and the preeclampsia foundation will help us understand and address this disease. ____________________",1717
CREC-2015-05-26-pt1-PgE793-5,CREC-2015-05-26,114,THE INTERNATIONAL DAY TO END OBSTETRIC FISTULA,"[Congressional Record Volume 161, Number 82 (Tuesday, May 26, 2015)] [Extensions of Remarks] [Page E793] From the Congressional Record Online through the Government Publishing Office [ www.gpo.gov ] THE INTERNATIONAL DAY TO END OBSTETRIC FISTULA ______ HON. ROSA L. DeLAURO of connecticut in the house of representatives Tuesday, May 26, 2015 Ms. DeLAURO. Mr. Speaker, I rise in recognition of the International Day to End Obstetric Fistula. Obstetric fistula, a debilitating condition, has left hundreds of thousands of women suffering in solitude and shame. It is perhaps one of the most telling examples of inequitable access to maternal health care and, until recently, one of the most hidden. Addressing this issue is not only a moral imperative for the United States, but it is also in our best strategic interest. When women are pushed out of society, they cannot contribute. By treating and preventing this condition, we empower women to care for themselves and their families, and be active participants in society, reducing global poverty. Dr. Babatunde Osotimehin, United Nations Under-Secretary-General and Executive Director of UNFPA, the United Nations Population Fund, recently said, ``Let us decide, as a global community, that the world we want is one where fistula no longer exists. Let us, once and for all, put an end to this assault on women's and girls' health and human rights, which steals from them their very dignity and destroys the most fundamental of human qualities: hope. Much of the world has already virtually eliminated fistula. It is time to finish the job. Let us all work together to wipe fistula off the map.'' The International Day to End Obstetric Fistula is an important opportunity to raise awareness of a condition that is not well- understood, even in societies where it is prevalent. I urge everyone to use the day of recognition to help raise awareness and intensify actions towards ending obstetric fistula. ____________________","[Congressional Record Volume 161, Number 82 (Tuesday, May 26, 2015)] [Extensions of Remarks] [Page E793] From the Congressional Record Online through the Government Publishing Office [ www.gpo.gov ] THE INTERNATIONAL DAY TO END OBSTETRIC FISTULA ______ HON. ROSA L. DeLAURO of connecticut in the house of representatives Tuesday, May 26, 2015 Ms. DeLAURO. Mr. Speaker, I rise in recognition of the International Day to End Obstetric Fistula. Obstetric fistula, a debilitating condition, has left hundreds of thousands of women suffering in solitude and shame. It is perhaps one of the most telling examples of inequitable access to maternal health care and, until recently, one of the most hidden. Addressing this issue is not only a moral imperative for the United States, but it is also in our best strategic interest. When women are pushed out of society, they cannot contribute. By treating and preventing this condition, we empower women to care for themselves and their families, and be active participants in society, reducing global poverty. Dr. Babatunde Osotimehin, United Nations Under-Secretary-General and Executive Director of UNFPA, the United Nations Population Fund, recently said, ``Let us decide, as a global community, that the world we want is one where fistula no longer exists. Let us, once and for all, put an end to this assault on women's and girls' health and human rights, which steals from them their very dignity and destroys the most fundamental of human qualities: hope. Much of the world has already virtually eliminated fistula. It is time to finish the job. Let us all work together to wipe fistula off the map.'' The International Day to End Obstetric Fistula is an important opportunity to raise awareness of a condition that is not well- understood, even in societies where it is prevalent. I urge everyone to use the day of recognition to help raise awareness and intensify actions towards ending obstetric fistula. ____________________","Congressional Record, Volume 161 Issue 82 (Tuesday, May 26, 2015) [Congressional Record Volume 161, Number 82 (Tuesday, May 26, 2015)] [Extensions of Remarks] [Page E793] From the Congressional Record Online through the Government Publishing Office [ www.gpo.gov ] THE INTERNATIONAL DAY TO END OBSTETRIC FISTULA ______ HON. ROSA L. DeLAURO of connecticut in the house of representatives Tuesday, May 26, 2015 Ms. DeLAURO. Mr. Speaker, I rise in recognition of the International Day to End Obstetric Fistula. Obstetric fistula, a debilitating condition, has left hundreds of thousands of women suffering in solitude and shame. It is perhaps one of the most telling examples of inequitable access to maternal health care and, until recently, one of the most hidden. Addressing this issue is not only a moral imperative for the United States, but it is also in our best strategic interest. When women are pushed out of society, they cannot contribute. By treating and preventing this condition, we empower women to care for themselves and their families, and be active participants in society, reducing global poverty. Dr. Babatunde Osotimehin, United Nations Under-Secretary-General and Executive Director of UNFPA, the United Nations Population Fund, recently said, ``Let us decide, as a global community, that the world we want is one where fistula no longer exists. Let us, once and for all, put an end to this assault on women's and girls' health and human rights, which steals from them their very dignity and destroys the most fundamental of human qualities: hope. Much of the world has already virtually eliminated fistula. It is time to finish the job. Let us all work together to wipe fistula off the map.'' The International Day to End Obstetric Fistula is an important opportunity to raise awareness of a condition that is not well- understood, even in societies where it is prevalent. I urge everyone to use the day of recognition to help raise awareness and intensify actions towards ending obstetric fistula. ____________________",package_114_293.csv,1975,1975,2041,"[congressional record volume 161, number 82 (tuesday, may 26, 2015)] [extensions of remarks] [page e793] from the congressional record online through the government publishing office [ www.gpo.gov ] the international day to end obstetric fistula ______ hon. rosa l. delauro of connecticut in the house of representatives tuesday, may 26, 2015 ms. delauro. mr. speaker, i rise in recognition of the international day to end obstetric fistula. obstetric fistula, a debilitating condition, has left hundreds of thousands of women suffering in solitude and shame. it is perhaps one of the most telling examples of inequitable access to maternal health care and, until recently, one of the most hidden. addressing this issue is not only a moral imperative for the united states, but it is also in our best strategic interest. when women are pushed out of society, they cannot contribute. by treating and preventing this condition, we empower women to care for themselves and their families, and be active participants in society, reducing global poverty. dr. babatunde osotimehin, united nations under-secretary-general and executive director of unfpa, the united nations population fund, recently said, ``let us decide, as a global community, that the world we want is one where fistula no longer exists. let us, once and for all, put an end to this assault on women's and girls' health and human rights, which steals from them their very dignity and destroys the most fundamental of human qualities: hope. much of the world has already virtually eliminated fistula. it is time to finish the job. let us all work together to wipe fistula off the map.'' the international day to end obstetric fistula is an important opportunity to raise awareness of a condition that is not well- understood, even in societies where it is prevalent. i urge everyone to use the day of recognition to help raise awareness and intensify actions towards ending obstetric fistula. ____________________",1975
CREC-2015-05-26-pt1-PgD605,CREC-2015-05-26,114,Daily Digest/Senate,"[Congressional Record Volume 161, Number 82 (Tuesday, May 26, 2015)] [Daily Digest] [Page D605] From the Congressional Record Online through the Government Publishing Office [ www.gpo.gov ] Tuesday, May 26, 2015 [[Page D605]] Daily Digest Senate Chamber Action The Senate met at 4:29:55 p.m. in pro forma session, and adjourned at 4:30:23 p.m. until 8:30 a.m., on Thursday, May 28, 2015.","[Congressional Record Volume 161, Number 82 (Tuesday, May 26, 2015)] [Daily Digest] [Page D605] From the Congressional Record Online through the Government Publishing Office [ www.gpo.gov ] Tuesday, May 26, 2015 [[Page D605]] Daily Digest Senate Chamber Action The Senate met at 4:29:55 p.m. in pro forma session, and adjourned at 4:30:23 p.m. until 8:30 a.m., on Thursday, May 28, 2015.","Congressional Record, Volume 161 Issue 82 (Tuesday, May 26, 2015) [Congressional Record Volume 161, Number 82 (Tuesday, May 26, 2015)] [Daily Digest] [Page D605] From the Congressional Record Online through the Government Publishing Office [ www.gpo.gov ] Tuesday, May 26, 2015 [[Page D605]] Daily Digest Senate Chamber Action The Senate met at 4:29:55 p.m. in pro forma session, and adjourned at 4:30:23 p.m. until 8:30 a.m., on Thursday, May 28, 2015.",package_114_293.csv,387,387,453,"[congressional record volume 161, number 82 (tuesday, may 26, 2015)] [daily digest] [page d605] from the congressional record online through the government publishing office [ www.gpo.gov ] tuesday, may 26, 2015 [[page d605]] daily digest senate chamber action the senate met at 4:29:55 p.m. in pro forma session, and adjourned at 4:30:23 p.m. until 8:30 a.m., on thursday, may 28, 2015.",387
CREC-2015-05-26-pt1-PgE793-6,CREC-2015-05-26,114,"HONORING JOSEPH STRZELCZYK, THE MAYOR OF SUMMIT, ILLINOIS","[Congressional Record Volume 161, Number 82 (Tuesday, May 26, 2015)] [Extensions of Remarks] [Pages E793-E794] From the Congressional Record Online through the Government Publishing Office [ www.gpo.gov ] HONORING JOSEPH STRZELCZYK, THE MAYOR OF SUMMIT, ILLINOIS ______ HON. DANIEL LIPINSKI of illinois in the house of representatives Tuesday, May 26, 2015 Mr. LIPINSKI. Mr. Speaker, I rise today to honor Joseph Strzelczyk, the Mayor of Summit, Illinois who passed away on May 17, 2015 at the age of 75. Commonly known as ``Mayor Joe'' to residents of Summit, Joe Strzelczyk was recognized for his tremendous dedication to his town and its residents. Mayor Strzelczyk began his career in public service in 1978 when he worked as a special recreation instructor for the Chicago Park District. In 1990, he was elected as a Village Trustee in Summit, a position which he held until he was elected mayor. Joe Strzelczyk was originally elected mayor in 1997 and won reelection four times. Over almost two decades as mayor, he focused on improving and revitalizing Summit through grassroots efforts along with attracting businesses and revenue to the city. Mayor Strzelczyk played a vital role in ensuring a revenue sharing agreement with the Rivers Casino in Des Plaines which brought in more than $604,000 to Summit in the first year alone. Mayor Strzelczyk was also active in organizing village cleanups. Mayor Strzelczyk's love of his community stretched into all facets of his life. An avid softball player, he coached in the North American Pro Softball League and later hosted a local cable TV show in addition to being a sports commentator on radio. In 2012, he was [[Page E794]] inducted into the Chicago 16 Inch Softball Hall of Fame. Today I ask my colleagues to join me in honoring Mayor Joseph Strzelczyk. A truly dedicated public servant, Joe Strzelczyk made Summit a great place to live. His leadership and dedication to his community was unparalleled and will truly be missed. ____________________","[Congressional Record Volume 161, Number 82 (Tuesday, May 26, 2015)] [Extensions of Remarks] [Pages E793-E794] From the Congressional Record Online through the Government Publishing Office [ www.gpo.gov ] HONORING JOSEPH STRZELCZYK, THE MAYOR OF SUMMIT, ILLINOIS ______ HON. DANIEL LIPINSKI of illinois in the house of representatives Tuesday, May 26, 2015 Mr. LIPINSKI. Mr. Speaker, I rise today to honor Joseph Strzelczyk, the Mayor of Summit, Illinois who passed away on May 17, 2015 at the age of 75. Commonly known as ``Mayor Joe'' to residents of Summit, Joe Strzelczyk was recognized for his tremendous dedication to his town and its residents. Mayor Strzelczyk began his career in public service in 1978 when he worked as a special recreation instructor for the Chicago Park District. In 1990, he was elected as a Village Trustee in Summit, a position which he held until he was elected mayor. Joe Strzelczyk was originally elected mayor in 1997 and won reelection four times. Over almost two decades as mayor, he focused on improving and revitalizing Summit through grassroots efforts along with attracting businesses and revenue to the city. Mayor Strzelczyk played a vital role in ensuring a revenue sharing agreement with the Rivers Casino in Des Plaines which brought in more than $604,000 to Summit in the first year alone. Mayor Strzelczyk was also active in organizing village cleanups. Mayor Strzelczyk's love of his community stretched into all facets of his life. An avid softball player, he coached in the North American Pro Softball League and later hosted a local cable TV show in addition to being a sports commentator on radio. In 2012, he was [[Page E794]] inducted into the Chicago 16 Inch Softball Hall of Fame. Today I ask my colleagues to join me in honoring Mayor Joseph Strzelczyk. A truly dedicated public servant, Joe Strzelczyk made Summit a great place to live. His leadership and dedication to his community was unparalleled and will truly be missed. ____________________","Congressional Record, Volume 161 Issue 82 (Tuesday, May 26, 2015) [Congressional Record Volume 161, Number 82 (Tuesday, May 26, 2015)] [Extensions of Remarks] [Pages E793-E794] From the Congressional Record Online through the Government Publishing Office [ www.gpo.gov ] HONORING JOSEPH STRZELCZYK, THE MAYOR OF SUMMIT, ILLINOIS ______ HON. DANIEL LIPINSKI of illinois in the house of representatives Tuesday, May 26, 2015 Mr. LIPINSKI. Mr. Speaker, I rise today to honor Joseph Strzelczyk, the Mayor of Summit, Illinois who passed away on May 17, 2015 at the age of 75. Commonly known as ``Mayor Joe'' to residents of Summit, Joe Strzelczyk was recognized for his tremendous dedication to his town and its residents. Mayor Strzelczyk began his career in public service in 1978 when he worked as a special recreation instructor for the Chicago Park District. In 1990, he was elected as a Village Trustee in Summit, a position which he held until he was elected mayor. Joe Strzelczyk was originally elected mayor in 1997 and won reelection four times. Over almost two decades as mayor, he focused on improving and revitalizing Summit through grassroots efforts along with attracting businesses and revenue to the city. Mayor Strzelczyk played a vital role in ensuring a revenue sharing agreement with the Rivers Casino in Des Plaines which brought in more than $604,000 to Summit in the first year alone. Mayor Strzelczyk was also active in organizing village cleanups. Mayor Strzelczyk's love of his community stretched into all facets of his life. An avid softball player, he coached in the North American Pro Softball League and later hosted a local cable TV show in addition to being a sports commentator on radio. In 2012, he was [[Page E794]] inducted into the Chicago 16 Inch Softball Hall of Fame. Today I ask my colleagues to join me in honoring Mayor Joseph Strzelczyk. A truly dedicated public servant, Joe Strzelczyk made Summit a great place to live. His leadership and dedication to his community was unparalleled and will truly be missed. ____________________",package_114_293.csv,2007,2007,2073,"[congressional record volume 161, number 82 (tuesday, may 26, 2015)] [extensions of remarks] [pages e793-e794] from the congressional record online through the government publishing office [ www.gpo.gov ] honoring joseph strzelczyk, the mayor of summit, illinois ______ hon. daniel lipinski of illinois in the house of representatives tuesday, may 26, 2015 mr. lipinski. mr. speaker, i rise today to honor joseph strzelczyk, the mayor of summit, illinois who passed away on may 17, 2015 at the age of 75. commonly known as ``mayor joe'' to residents of summit, joe strzelczyk was recognized for his tremendous dedication to his town and its residents. mayor strzelczyk began his career in public service in 1978 when he worked as a special recreation instructor for the chicago park district. in 1990, he was elected as a village trustee in summit, a position which he held until he was elected mayor. joe strzelczyk was originally elected mayor in 1997 and won reelection four times. over almost two decades as mayor, he focused on improving and revitalizing summit through grassroots efforts along with attracting businesses and revenue to the city. mayor strzelczyk played a vital role in ensuring a revenue sharing agreement with the rivers casino in des plaines which brought in more than $604,000 to summit in the first year alone. mayor strzelczyk was also active in organizing village cleanups. mayor strzelczyk's love of his community stretched into all facets of his life. an avid softball player, he coached in the north american pro softball league and later hosted a local cable tv show in addition to being a sports commentator on radio. in 2012, he was [[page e794]] inducted into the chicago 16 inch softball hall of fame. today i ask my colleagues to join me in honoring mayor joseph strzelczyk. a truly dedicated public servant, joe strzelczyk made summit a great place to live. his leadership and dedication to his community was unparalleled and will truly be missed. ____________________",2007
