granuleId,packageId,congress,title,parsed_text,text_readability,text_bs4,__source_file,parsed_text_len,text_readability_len,text_bs4_len,search_text,search_text_len
CREC-2016-06-03-pt1-PgE819-5,CREC-2016-06-03,114,RECOGNIZING THE ACCOMPLISHMENTS AND LIFE OF FRAN NITKIN,"[Congressional Record Volume 162, Number 87 (Friday, June 3, 2016)] [Extensions of Remarks] [Page E819] From the Congressional Record Online through the Government Publishing Office [ www.gpo.gov ] RECOGNIZING THE ACCOMPLISHMENTS AND LIFE OF FRAN NITKIN ______ HON. MICHAEL G. FITZPATRICK of pennsylvania in the house of representatives Friday, June 3, 2016 Mr. FITZPATRICK. Mr. Speaker, I rise today to recognize the accomplishments and life of Mrs. Fran Nitkin. There is an old proverb that says, ``Better than a thousand days of diligent study is one day with a great teacher.'' Fortunately for the students of the Pennsbury School District they shared many days with a great teacher, Mrs. Fran Nitkin. Mrs. Nitkin was hired by Pennsbury in 1989 initially as a substitute teacher. She then served for many years as a teacher at Oxford Valley Elementary and had the opportunity to inspire young minds in elementary schools across the Pennsbury School District including Edgewood, Eleanor Roosevelt, and Quarry Hill elementary schools. In 2003, Mrs. Nitkin was appointed principal at Village Park Elementary. She then moved to Oxford Valley in 2006 and remained principal there until her death. Known by all for her high standards and dedication as a teacher and administrator, she was always ready to ``provide assistance and wise counsel.'' Oxford Valley Elementary School, a National School of Character, was built on the cornerstones of Cooperation, Respect, Responsibility, and Sportsmanship. Principal Fran Nitkin embodied these qualities and passed them along to her students every single day because she was a great teacher. ____________________","[Congressional Record Volume 162, Number 87 (Friday, June 3, 2016)] [Extensions of Remarks] [Page E819] From the Congressional Record Online through the Government Publishing Office [ www.gpo.gov ] RECOGNIZING THE ACCOMPLISHMENTS AND LIFE OF FRAN NITKIN ______ HON. MICHAEL G. FITZPATRICK of pennsylvania in the house of representatives Friday, June 3, 2016 Mr. FITZPATRICK. Mr. Speaker, I rise today to recognize the accomplishments and life of Mrs. Fran Nitkin. There is an old proverb that says, ``Better than a thousand days of diligent study is one day with a great teacher.'' Fortunately for the students of the Pennsbury School District they shared many days with a great teacher, Mrs. Fran Nitkin. Mrs. Nitkin was hired by Pennsbury in 1989 initially as a substitute teacher. She then served for many years as a teacher at Oxford Valley Elementary and had the opportunity to inspire young minds in elementary schools across the Pennsbury School District including Edgewood, Eleanor Roosevelt, and Quarry Hill elementary schools. In 2003, Mrs. Nitkin was appointed principal at Village Park Elementary. She then moved to Oxford Valley in 2006 and remained principal there until her death. Known by all for her high standards and dedication as a teacher and administrator, she was always ready to ``provide assistance and wise counsel.'' Oxford Valley Elementary School, a National School of Character, was built on the cornerstones of Cooperation, Respect, Responsibility, and Sportsmanship. Principal Fran Nitkin embodied these qualities and passed them along to her students every single day because she was a great teacher. ____________________","Congressional Record, Volume 162 Issue 87 (Friday, June 3, 2016) [Congressional Record Volume 162, Number 87 (Friday, June 3, 2016)] [Extensions of Remarks] [Page E819] From the Congressional Record Online through the Government Publishing Office [ www.gpo.gov ] RECOGNIZING THE ACCOMPLISHMENTS AND LIFE OF FRAN NITKIN ______ HON. MICHAEL G. FITZPATRICK of pennsylvania in the house of representatives Friday, June 3, 2016 Mr. FITZPATRICK. Mr. Speaker, I rise today to recognize the accomplishments and life of Mrs. Fran Nitkin. There is an old proverb that says, ``Better than a thousand days of diligent study is one day with a great teacher.'' Fortunately for the students of the Pennsbury School District they shared many days with a great teacher, Mrs. Fran Nitkin. Mrs. Nitkin was hired by Pennsbury in 1989 initially as a substitute teacher. She then served for many years as a teacher at Oxford Valley Elementary and had the opportunity to inspire young minds in elementary schools across the Pennsbury School District including Edgewood, Eleanor Roosevelt, and Quarry Hill elementary schools. In 2003, Mrs. Nitkin was appointed principal at Village Park Elementary. She then moved to Oxford Valley in 2006 and remained principal there until her death. Known by all for her high standards and dedication as a teacher and administrator, she was always ready to ``provide assistance and wise counsel.'' Oxford Valley Elementary School, a National School of Character, was built on the cornerstones of Cooperation, Respect, Responsibility, and Sportsmanship. Principal Fran Nitkin embodied these qualities and passed them along to her students every single day because she was a great teacher. ____________________",package_114_268.csv,1654,1654,1719,"[congressional record volume 162, number 87 (friday, june 3, 2016)] [extensions of remarks] [page e819] from the congressional record online through the government publishing office [ www.gpo.gov ] recognizing the accomplishments and life of fran nitkin ______ hon. michael g. fitzpatrick of pennsylvania in the house of representatives friday, june 3, 2016 mr. fitzpatrick. mr. speaker, i rise today to recognize the accomplishments and life of mrs. fran nitkin. there is an old proverb that says, ``better than a thousand days of diligent study is one day with a great teacher.'' fortunately for the students of the pennsbury school district they shared many days with a great teacher, mrs. fran nitkin. mrs. nitkin was hired by pennsbury in 1989 initially as a substitute teacher. she then served for many years as a teacher at oxford valley elementary and had the opportunity to inspire young minds in elementary schools across the pennsbury school district including edgewood, eleanor roosevelt, and quarry hill elementary schools. in 2003, mrs. nitkin was appointed principal at village park elementary. she then moved to oxford valley in 2006 and remained principal there until her death. known by all for her high standards and dedication as a teacher and administrator, she was always ready to ``provide assistance and wise counsel.'' oxford valley elementary school, a national school of character, was built on the cornerstones of cooperation, respect, responsibility, and sportsmanship. principal fran nitkin embodied these qualities and passed them along to her students every single day because she was a great teacher. ____________________",1654
CREC-2016-06-03-pt1-PgE819-4,CREC-2016-06-03,114,IN RECOGNITION OF DEPUTY GLENN KEOUGH FOR EXCELLENCE IN COMMUNITY SERVICE AND PUBLIC SAFETY,"[Congressional Record Volume 162, Number 87 (Friday, June 3, 2016)] [Extensions of Remarks] [Page E819] From the Congressional Record Online through the Government Publishing Office [ www.gpo.gov ] IN RECOGNITION OF DEPUTY GLENN KEOUGH FOR EXCELLENCE IN COMMUNITY SERVICE AND PUBLIC SAFETY ______ HON. BARBARA COMSTOCK of virginia in the house of representatives Friday, June 3, 2016 Mrs. COMSTOCK. Mr. Speaker, I rise today to honor Deputy Glenn Keough, a law enforcement officer who recently was recognized at the 25th Annual Awards for Excellence in Community Service and Public Safety Ceremony for his invaluable service and commitment to our community. Deputy Keough first joined the Loudoun County Sheriff's Department in 2014. He is currently assigned to the Patrol in the Field Operations Division. Last year, Deputy Keough made 23 DUI arrests, 49 misdemeanor arrests, and 36 felony arrests. He selflessly executed these 108 arrests with professionalism and courage in order to further protect the citizens of our community. I would like to thank him for the honorable service he provides my constituents day-in and day-out. His daily sacrifices and commitment to serving our region are commendable. Our community is safer thanks to the continued efforts of Deputy Keough and his fellow law enforcement officers. His bravery, service, and commitment to Loudoun County have not gone unnoticed and will not be forgotten. Mr. Speaker, I ask that my colleagues join me in thanking and congratulating Deputy Glenn Keough for his dedication to both Virginia's 10th Congressional District and the Loudoun County Sheriff's Department. ____________________","[Congressional Record Volume 162, Number 87 (Friday, June 3, 2016)] [Extensions of Remarks] [Page E819] From the Congressional Record Online through the Government Publishing Office [ www.gpo.gov ] IN RECOGNITION OF DEPUTY GLENN KEOUGH FOR EXCELLENCE IN COMMUNITY SERVICE AND PUBLIC SAFETY ______ HON. BARBARA COMSTOCK of virginia in the house of representatives Friday, June 3, 2016 Mrs. COMSTOCK. Mr. Speaker, I rise today to honor Deputy Glenn Keough, a law enforcement officer who recently was recognized at the 25th Annual Awards for Excellence in Community Service and Public Safety Ceremony for his invaluable service and commitment to our community. Deputy Keough first joined the Loudoun County Sheriff's Department in 2014. He is currently assigned to the Patrol in the Field Operations Division. Last year, Deputy Keough made 23 DUI arrests, 49 misdemeanor arrests, and 36 felony arrests. He selflessly executed these 108 arrests with professionalism and courage in order to further protect the citizens of our community. I would like to thank him for the honorable service he provides my constituents day-in and day-out. His daily sacrifices and commitment to serving our region are commendable. Our community is safer thanks to the continued efforts of Deputy Keough and his fellow law enforcement officers. His bravery, service, and commitment to Loudoun County have not gone unnoticed and will not be forgotten. Mr. Speaker, I ask that my colleagues join me in thanking and congratulating Deputy Glenn Keough for his dedication to both Virginia's 10th Congressional District and the Loudoun County Sheriff's Department. ____________________","Congressional Record, Volume 162 Issue 87 (Friday, June 3, 2016) [Congressional Record Volume 162, Number 87 (Friday, June 3, 2016)] [Extensions of Remarks] [Page E819] From the Congressional Record Online through the Government Publishing Office [ www.gpo.gov ] IN RECOGNITION OF DEPUTY GLENN KEOUGH FOR EXCELLENCE IN COMMUNITY SERVICE AND PUBLIC SAFETY ______ HON. BARBARA COMSTOCK of virginia in the house of representatives Friday, June 3, 2016 Mrs. COMSTOCK. Mr. Speaker, I rise today to honor Deputy Glenn Keough, a law enforcement officer who recently was recognized at the 25th Annual Awards for Excellence in Community Service and Public Safety Ceremony for his invaluable service and commitment to our community. Deputy Keough first joined the Loudoun County Sheriff's Department in 2014. He is currently assigned to the Patrol in the Field Operations Division. Last year, Deputy Keough made 23 DUI arrests, 49 misdemeanor arrests, and 36 felony arrests. He selflessly executed these 108 arrests with professionalism and courage in order to further protect the citizens of our community. I would like to thank him for the honorable service he provides my constituents day-in and day-out. His daily sacrifices and commitment to serving our region are commendable. Our community is safer thanks to the continued efforts of Deputy Keough and his fellow law enforcement officers. His bravery, service, and commitment to Loudoun County have not gone unnoticed and will not be forgotten. Mr. Speaker, I ask that my colleagues join me in thanking and congratulating Deputy Glenn Keough for his dedication to both Virginia's 10th Congressional District and the Loudoun County Sheriff's Department. ____________________",package_114_268.csv,1655,1655,1720,"[congressional record volume 162, number 87 (friday, june 3, 2016)] [extensions of remarks] [page e819] from the congressional record online through the government publishing office [ www.gpo.gov ] in recognition of deputy glenn keough for excellence in community service and public safety ______ hon. barbara comstock of virginia in the house of representatives friday, june 3, 2016 mrs. comstock. mr. speaker, i rise today to honor deputy glenn keough, a law enforcement officer who recently was recognized at the 25th annual awards for excellence in community service and public safety ceremony for his invaluable service and commitment to our community. deputy keough first joined the loudoun county sheriff's department in 2014. he is currently assigned to the patrol in the field operations division. last year, deputy keough made 23 dui arrests, 49 misdemeanor arrests, and 36 felony arrests. he selflessly executed these 108 arrests with professionalism and courage in order to further protect the citizens of our community. i would like to thank him for the honorable service he provides my constituents day-in and day-out. his daily sacrifices and commitment to serving our region are commendable. our community is safer thanks to the continued efforts of deputy keough and his fellow law enforcement officers. his bravery, service, and commitment to loudoun county have not gone unnoticed and will not be forgotten. mr. speaker, i ask that my colleagues join me in thanking and congratulating deputy glenn keough for his dedication to both virginia's 10th congressional district and the loudoun county sheriff's department. ____________________",1655
CREC-2016-06-03-pt1-PgE819-6,CREC-2016-06-03,114,IN RECOGNITION OF DFC RUBEN CARDENAS FOR EXCELLENCE IN COMMUNITY SERVICE AND PUBLIC SAFETY,"[Congressional Record Volume 162, Number 87 (Friday, June 3, 2016)] [Extensions of Remarks] [Pages E819-E820] From the Congressional Record Online through the Government Publishing Office [ www.gpo.gov ] IN RECOGNITION OF DFC RUBEN CARDENAS FOR EXCELLENCE IN COMMUNITY SERVICE AND PUBLIC SAFETY ______ HON. BARBARA COMSTOCK of virginia in the house of representatives Friday, June 3, 2016 Mrs. COMSTOCK. Mr. Speaker, I rise today to honor Deputy First Class Ruben Cardenas, a law enforcement officer who recently was recognized at the 25th Annual Awards for Excellence in Community Service and Public Safety Ceremony for his invaluable service and commitment to our community. [[Page E820]] DFC Cardenas first joined the Loudoun County Sheriff's Department in 2014. He is currently assigned to the Patrol in the Field Operations Division. Last year, DFC Cardenas made 22 DUI arrests, 68 misdemeanor arrests, and 11 felony arrests. He selflessly executed these 101 arrests with professionalism and courage in order to further protect the citizens of our community. I would like to thank him for the honorable service he provides my constituents day-in and day-out. His daily sacrifices and commitment to serving our region are commendable. Our community is safer thanks to the continued efforts of DFC Cardenas and his fellow law enforcement officers. His bravery, service, and commitment to Loudoun County have not gone unnoticed and will not be forgotten. Mr. Speaker, I ask that my colleagues join me in thanking and congratulating DFC Ruben Cardenas for his dedication to both Virginia's 10th Congressional District and the Loudoun County Sheriff's Department. ____________________","[Congressional Record Volume 162, Number 87 (Friday, June 3, 2016)] [Extensions of Remarks] [Pages E819-E820] From the Congressional Record Online through the Government Publishing Office [ www.gpo.gov ] IN RECOGNITION OF DFC RUBEN CARDENAS FOR EXCELLENCE IN COMMUNITY SERVICE AND PUBLIC SAFETY ______ HON. BARBARA COMSTOCK of virginia in the house of representatives Friday, June 3, 2016 Mrs. COMSTOCK. Mr. Speaker, I rise today to honor Deputy First Class Ruben Cardenas, a law enforcement officer who recently was recognized at the 25th Annual Awards for Excellence in Community Service and Public Safety Ceremony for his invaluable service and commitment to our community. [[Page E820]] DFC Cardenas first joined the Loudoun County Sheriff's Department in 2014. He is currently assigned to the Patrol in the Field Operations Division. Last year, DFC Cardenas made 22 DUI arrests, 68 misdemeanor arrests, and 11 felony arrests. He selflessly executed these 101 arrests with professionalism and courage in order to further protect the citizens of our community. I would like to thank him for the honorable service he provides my constituents day-in and day-out. His daily sacrifices and commitment to serving our region are commendable. Our community is safer thanks to the continued efforts of DFC Cardenas and his fellow law enforcement officers. His bravery, service, and commitment to Loudoun County have not gone unnoticed and will not be forgotten. Mr. Speaker, I ask that my colleagues join me in thanking and congratulating DFC Ruben Cardenas for his dedication to both Virginia's 10th Congressional District and the Loudoun County Sheriff's Department. ____________________","Congressional Record, Volume 162 Issue 87 (Friday, June 3, 2016) [Congressional Record Volume 162, Number 87 (Friday, June 3, 2016)] [Extensions of Remarks] [Pages E819-E820] From the Congressional Record Online through the Government Publishing Office [ www.gpo.gov ] IN RECOGNITION OF DFC RUBEN CARDENAS FOR EXCELLENCE IN COMMUNITY SERVICE AND PUBLIC SAFETY ______ HON. BARBARA COMSTOCK of virginia in the house of representatives Friday, June 3, 2016 Mrs. COMSTOCK. Mr. Speaker, I rise today to honor Deputy First Class Ruben Cardenas, a law enforcement officer who recently was recognized at the 25th Annual Awards for Excellence in Community Service and Public Safety Ceremony for his invaluable service and commitment to our community. [[Page E820]] DFC Cardenas first joined the Loudoun County Sheriff's Department in 2014. He is currently assigned to the Patrol in the Field Operations Division. Last year, DFC Cardenas made 22 DUI arrests, 68 misdemeanor arrests, and 11 felony arrests. He selflessly executed these 101 arrests with professionalism and courage in order to further protect the citizens of our community. I would like to thank him for the honorable service he provides my constituents day-in and day-out. His daily sacrifices and commitment to serving our region are commendable. Our community is safer thanks to the continued efforts of DFC Cardenas and his fellow law enforcement officers. His bravery, service, and commitment to Loudoun County have not gone unnoticed and will not be forgotten. Mr. Speaker, I ask that my colleagues join me in thanking and congratulating DFC Ruben Cardenas for his dedication to both Virginia's 10th Congressional District and the Loudoun County Sheriff's Department. ____________________",package_114_268.csv,1684,1684,1749,"[congressional record volume 162, number 87 (friday, june 3, 2016)] [extensions of remarks] [pages e819-e820] from the congressional record online through the government publishing office [ www.gpo.gov ] in recognition of dfc ruben cardenas for excellence in community service and public safety ______ hon. barbara comstock of virginia in the house of representatives friday, june 3, 2016 mrs. comstock. mr. speaker, i rise today to honor deputy first class ruben cardenas, a law enforcement officer who recently was recognized at the 25th annual awards for excellence in community service and public safety ceremony for his invaluable service and commitment to our community. [[page e820]] dfc cardenas first joined the loudoun county sheriff's department in 2014. he is currently assigned to the patrol in the field operations division. last year, dfc cardenas made 22 dui arrests, 68 misdemeanor arrests, and 11 felony arrests. he selflessly executed these 101 arrests with professionalism and courage in order to further protect the citizens of our community. i would like to thank him for the honorable service he provides my constituents day-in and day-out. his daily sacrifices and commitment to serving our region are commendable. our community is safer thanks to the continued efforts of dfc cardenas and his fellow law enforcement officers. his bravery, service, and commitment to loudoun county have not gone unnoticed and will not be forgotten. mr. speaker, i ask that my colleagues join me in thanking and congratulating dfc ruben cardenas for his dedication to both virginia's 10th congressional district and the loudoun county sheriff's department. ____________________",1684
