granuleId,packageId,congress,title,parsed_text,text_readability,text_bs4,__source_file,parsed_text_len,text_readability_len,text_bs4_len,search_text,search_text_len
CREC-2016-06-03-pt1-PgH3459-4,CREC-2016-06-03,114,THE JOURNAL,"[Congressional Record Volume 162, Number 87 (Friday, June 3, 2016)] [House] [Page H3459] From the Congressional Record Online through the Government Publishing Office [ www.gpo.gov ] THE JOURNAL The SPEAKER pro tempore. Pursuant to section 4(a) of House Resolution 744, the Journal of the last day's proceedings is approved. ____________________","[Congressional Record Volume 162, Number 87 (Friday, June 3, 2016)] [House] [Page H3459] From the Congressional Record Online through the Government Publishing Office [ www.gpo.gov ] THE JOURNAL The SPEAKER pro tempore. Pursuant to section 4(a) of House Resolution 744, the Journal of the last day's proceedings is approved. ____________________","Congressional Record, Volume 162 Issue 87 (Friday, June 3, 2016) [Congressional Record Volume 162, Number 87 (Friday, June 3, 2016)] [House] [Page H3459] From the Congressional Record Online through the Government Publishing Office [ www.gpo.gov ] THE JOURNAL The SPEAKER pro tempore. Pursuant to section 4(a) of House Resolution 744, the Journal of the last day's proceedings is approved. ____________________",package_114_268.csv,345,345,410,"[congressional record volume 162, number 87 (friday, june 3, 2016)] [house] [page h3459] from the congressional record online through the government publishing office [ www.gpo.gov ] the journal the speaker pro tempore. pursuant to section 4(a) of house resolution 744, the journal of the last day's proceedings is approved. ____________________",345
CREC-2016-06-03-pt1-PgH3459-2,CREC-2016-06-03,114,DESIGNATION OF THE SPEAKER PRO TEMPORE,"[Congressional Record Volume 162, Number 87 (Friday, June 3, 2016)] [House] [Page H3459] From the Congressional Record Online through the Government Publishing Office [ www.gpo.gov ] DESIGNATION OF THE SPEAKER PRO TEMPORE The SPEAKER pro tempore laid before the House the following communication from the Speaker: Washington, DC, June 3, 2016. I hereby appoint the Honorable Thomas J. Rooney to act as Speaker pro tempore on this day. Paul D. Ryan, Speaker of the House of Representatives. ____________________","[Congressional Record Volume 162, Number 87 (Friday, June 3, 2016)] [House] [Page H3459] From the Congressional Record Online through the Government Publishing Office [ www.gpo.gov ] DESIGNATION OF THE SPEAKER PRO TEMPORE The SPEAKER pro tempore laid before the House the following communication from the Speaker: Washington, DC, June 3, 2016. I hereby appoint the Honorable Thomas J. Rooney to act as Speaker pro tempore on this day. Paul D. Ryan, Speaker of the House of Representatives. ____________________","Congressional Record, Volume 162 Issue 87 (Friday, June 3, 2016) [Congressional Record Volume 162, Number 87 (Friday, June 3, 2016)] [House] [Page H3459] From the Congressional Record Online through the Government Publishing Office [ www.gpo.gov ] DESIGNATION OF THE SPEAKER PRO TEMPORE The SPEAKER pro tempore laid before the House the following communication from the Speaker: Washington, DC, June 3, 2016. I hereby appoint the Honorable Thomas J. Rooney to act as Speaker pro tempore on this day. Paul D. Ryan, Speaker of the House of Representatives. ____________________",package_114_268.csv,510,510,575,"[congressional record volume 162, number 87 (friday, june 3, 2016)] [house] [page h3459] from the congressional record online through the government publishing office [ www.gpo.gov ] designation of the speaker pro tempore the speaker pro tempore laid before the house the following communication from the speaker: washington, dc, june 3, 2016. i hereby appoint the honorable thomas j. rooney to act as speaker pro tempore on this day. paul d. ryan, speaker of the house of representatives. ____________________",510
CREC-2016-06-03-pt1-PgH3459-6,CREC-2016-06-03,114,ANNOUNCEMENT BY THE SPEAKER PRO TEMPORE,"[Congressional Record Volume 162, Number 87 (Friday, June 3, 2016)] [House] [Page H3459] From the Congressional Record Online through the Government Publishing Office [ www.gpo.gov ] ANNOUNCEMENT BY THE SPEAKER PRO TEMPORE The SPEAKER pro tempore. Pursuant to clause 4 of rule I, the following enrolled joint resolution was signed by the Speaker on Thursday, May 26, 2016: H.J. Res. 88, disapproving the rule submitted by the Department of Labor relating to the definition of the term ``Fiduciary''. ____________________","[Congressional Record Volume 162, Number 87 (Friday, June 3, 2016)] [House] [Page H3459] From the Congressional Record Online through the Government Publishing Office [ www.gpo.gov ] ANNOUNCEMENT BY THE SPEAKER PRO TEMPORE The SPEAKER pro tempore. Pursuant to clause 4 of rule I, the following enrolled joint resolution was signed by the Speaker on Thursday, May 26, 2016: H.J. Res. 88, disapproving the rule submitted by the Department of Labor relating to the definition of the term ``Fiduciary''. ____________________","Congressional Record, Volume 162 Issue 87 (Friday, June 3, 2016) [Congressional Record Volume 162, Number 87 (Friday, June 3, 2016)] [House] [Page H3459] From the Congressional Record Online through the Government Publishing Office [ www.gpo.gov ] ANNOUNCEMENT BY THE SPEAKER PRO TEMPORE The SPEAKER pro tempore. Pursuant to clause 4 of rule I, the following enrolled joint resolution was signed by the Speaker on Thursday, May 26, 2016: H.J. Res. 88, disapproving the rule submitted by the Department of Labor relating to the definition of the term ``Fiduciary''. ____________________",package_114_268.csv,520,520,585,"[congressional record volume 162, number 87 (friday, june 3, 2016)] [house] [page h3459] from the congressional record online through the government publishing office [ www.gpo.gov ] announcement by the speaker pro tempore the speaker pro tempore. pursuant to clause 4 of rule i, the following enrolled joint resolution was signed by the speaker on thursday, may 26, 2016: h.j. res. 88, disapproving the rule submitted by the department of labor relating to the definition of the term ``fiduciary''. ____________________",520
CREC-2016-06-03-pt1-PgH-FrontMatter,CREC-2016-06-03,114,House of Representatives,"[Congressional Record Volume 162, Number 87 (Friday, June 3, 2016)] [House] [Page H3459] From the Congressional Record Online through the Government Publishing Office [ www.gpo.gov ] H O U S E O F R E P R E S E N T A T I V E S Vol. 162 WASHINGTON, FRIDAY, JUNE 3, 2016 No. 87","[Congressional Record Volume 162, Number 87 (Friday, June 3, 2016)] [House] [Page H3459] From the Congressional Record Online through the Government Publishing Office [ www.gpo.gov ] H O U S E O F R E P R E S E N T A T I V E S Vol. 162 WASHINGTON, FRIDAY, JUNE 3, 2016 No. 87","Congressional Record, Volume 162 Issue 87 (Friday, June 3, 2016) [Congressional Record Volume 162, Number 87 (Friday, June 3, 2016)] [House] [Page H3459] From the Congressional Record Online through the Government Publishing Office [ www.gpo.gov ] H O U S E O F R E P R E S E N T A T I V E S Vol. 162 WASHINGTON, FRIDAY, JUNE 3, 2016 No. 87",package_114_268.csv,275,275,340,"[congressional record volume 162, number 87 (friday, june 3, 2016)] [house] [page h3459] from the congressional record online through the government publishing office [ www.gpo.gov ] h o u s e o f r e p r e s e n t a t i v e s vol. 162 washington, friday, june 3, 2016 no. 87",275
CREC-2016-06-03-pt1-PgH3459-3,CREC-2016-06-03,114,PRAYER,"[Congressional Record Volume 162, Number 87 (Friday, June 3, 2016)] [House] [Page H3459] From the Congressional Record Online through the Government Publishing Office [ www.gpo.gov ] PRAYER The Chaplain, the Reverend Patrick J. Conroy, offered the following prayer: Eternal God, we give You thanks for giving us another day. We pause now in Your presence, and acknowledge our dependence on You. We ask Your blessing upon the men and women of this, the people's House. Keep them aware of Your presence as they face the tasks of this day, and may their time back home with family and with constituents be restorative and beneficial. Help them, and indeed help us all, to obey Your law, to do Your will, and to walk in Your way. Grant that they might be good in thought, gracious in word, generous in deed, and great in spirit. May all that is done this day be for Your greater honor and glory. Amen. ____________________","[Congressional Record Volume 162, Number 87 (Friday, June 3, 2016)] [House] [Page H3459] From the Congressional Record Online through the Government Publishing Office [ www.gpo.gov ] PRAYER The Chaplain, the Reverend Patrick J. Conroy, offered the following prayer: Eternal God, we give You thanks for giving us another day. We pause now in Your presence, and acknowledge our dependence on You. We ask Your blessing upon the men and women of this, the people's House. Keep them aware of Your presence as they face the tasks of this day, and may their time back home with family and with constituents be restorative and beneficial. Help them, and indeed help us all, to obey Your law, to do Your will, and to walk in Your way. Grant that they might be good in thought, gracious in word, generous in deed, and great in spirit. May all that is done this day be for Your greater honor and glory. Amen. ____________________","Congressional Record, Volume 162 Issue 87 (Friday, June 3, 2016) [Congressional Record Volume 162, Number 87 (Friday, June 3, 2016)] [House] [Page H3459] From the Congressional Record Online through the Government Publishing Office [ www.gpo.gov ] PRAYER The Chaplain, the Reverend Patrick J. Conroy, offered the following prayer: Eternal God, we give You thanks for giving us another day. We pause now in Your presence, and acknowledge our dependence on You. We ask Your blessing upon the men and women of this, the people's House. Keep them aware of Your presence as they face the tasks of this day, and may their time back home with family and with constituents be restorative and beneficial. Help them, and indeed help us all, to obey Your law, to do Your will, and to walk in Your way. Grant that they might be good in thought, gracious in word, generous in deed, and great in spirit. May all that is done this day be for Your greater honor and glory. Amen. ____________________",package_114_268.csv,918,918,983,"[congressional record volume 162, number 87 (friday, june 3, 2016)] [house] [page h3459] from the congressional record online through the government publishing office [ www.gpo.gov ] prayer the chaplain, the reverend patrick j. conroy, offered the following prayer: eternal god, we give you thanks for giving us another day. we pause now in your presence, and acknowledge our dependence on you. we ask your blessing upon the men and women of this, the people's house. keep them aware of your presence as they face the tasks of this day, and may their time back home with family and with constituents be restorative and beneficial. help them, and indeed help us all, to obey your law, to do your will, and to walk in your way. grant that they might be good in thought, gracious in word, generous in deed, and great in spirit. may all that is done this day be for your greater honor and glory. amen. ____________________",918
CREC-2016-06-03-pt1-PgH3459,CREC-2016-06-03,114,House of Representatives,"[Congressional Record Volume 162, Number 87 (Friday, June 3, 2016)] [House] [Page H3459] From the Congressional Record Online through the Government Publishing Office [ www.gpo.gov ] [[Page H3459]] House of Representatives The House met at 4:30 p.m. and was called to order by the Speaker pro tempore (Mr. Rooney of Florida). ____________________","[Congressional Record Volume 162, Number 87 (Friday, June 3, 2016)] [House] [Page H3459] From the Congressional Record Online through the Government Publishing Office [ www.gpo.gov ] [[Page H3459]] House of Representatives The House met at 4:30 p.m. and was called to order by the Speaker pro tempore (Mr. Rooney of Florida). ____________________","Congressional Record, Volume 162 Issue 87 (Friday, June 3, 2016) [Congressional Record Volume 162, Number 87 (Friday, June 3, 2016)] [House] [Page H3459] From the Congressional Record Online through the Government Publishing Office [ www.gpo.gov ] [[Page H3459]] House of Representatives The House met at 4:30 p.m. and was called to order by the Speaker pro tempore (Mr. Rooney of Florida). ____________________",package_114_268.csv,346,346,411,"[congressional record volume 162, number 87 (friday, june 3, 2016)] [house] [page h3459] from the congressional record online through the government publishing office [ www.gpo.gov ] [[page h3459]] house of representatives the house met at 4:30 p.m. and was called to order by the speaker pro tempore (mr. rooney of florida). ____________________",346
CREC-2016-06-03-pt1-PgH3459-5,CREC-2016-06-03,114,PLEDGE OF ALLEGIANCE,"[Congressional Record Volume 162, Number 87 (Friday, June 3, 2016)] [House] [Page H3459] From the Congressional Record Online through the Government Publishing Office [ www.gpo.gov ] PLEDGE OF ALLEGIANCE The SPEAKER pro tempore. The Chair will lead the House in the Pledge of Allegiance. The SPEAKER pro tempore led the Pledge of Allegiance as follows: I pledge allegiance to the Flag of the United States of America, and to the Republic for which it stands, one nation under God, indivisible, with liberty and justice for all. ____________________","[Congressional Record Volume 162, Number 87 (Friday, June 3, 2016)] [House] [Page H3459] From the Congressional Record Online through the Government Publishing Office [ www.gpo.gov ] PLEDGE OF ALLEGIANCE The SPEAKER pro tempore. The Chair will lead the House in the Pledge of Allegiance. The SPEAKER pro tempore led the Pledge of Allegiance as follows: I pledge allegiance to the Flag of the United States of America, and to the Republic for which it stands, one nation under God, indivisible, with liberty and justice for all. ____________________","Congressional Record, Volume 162 Issue 87 (Friday, June 3, 2016) [Congressional Record Volume 162, Number 87 (Friday, June 3, 2016)] [House] [Page H3459] From the Congressional Record Online through the Government Publishing Office [ www.gpo.gov ] PLEDGE OF ALLEGIANCE The SPEAKER pro tempore. The Chair will lead the House in the Pledge of Allegiance. The SPEAKER pro tempore led the Pledge of Allegiance as follows: I pledge allegiance to the Flag of the United States of America, and to the Republic for which it stands, one nation under God, indivisible, with liberty and justice for all. ____________________",package_114_268.csv,548,548,613,"[congressional record volume 162, number 87 (friday, june 3, 2016)] [house] [page h3459] from the congressional record online through the government publishing office [ www.gpo.gov ] pledge of allegiance the speaker pro tempore. the chair will lead the house in the pledge of allegiance. the speaker pro tempore led the pledge of allegiance as follows: i pledge allegiance to the flag of the united states of america, and to the republic for which it stands, one nation under god, indivisible, with liberty and justice for all. ____________________",548
